"hep-th/9407039",,"K. Behrndt, T.T. Burwick","Towards Quantum Cosmology without Singularities","9 pages, 2 figures, Latex, epsfig.sty, epsf.tex","Phys.Rev. D52 (1995) 1292-1295","10.1103/PhysRevD.52.1292","SLAC--PUB--6506","hep-th gr-qc",,"  In this paper we investigate the vanishing of cosmological singularities by
quantization. Starting from a 5d Kaluza--Klein approach we quantize, as a first
step, the non--spherical metric part and the dilaton field. These fields which
are classically singular become smooth after quantization. In addition, we
argue that the incorporation of non perturbative quantum corrections form a
dilaton potential. Technically, the procedure corresponds to the quantization
of 2d dilaton gravity and we discuss several models. From the 4d point of view
this procedure is a semiclassical approach where only the dilaton and moduli
matter fields are quantized.
","[{""version"":""v1"",""created"":""Thu, 7 Jul 1994 00:03:42 GMT""}]","2009-10-28"
"hep-th/9407040",,"A. G. Litvak, V. A. Mironov, and A. P. Protogenov","Strong Phase Correlations of Solitons of Nonlinear Schr\""odinger
  Equation",,,,,"hep-th",,"  We discuss the possibility to suppress the collapse in the nonlinear 2+1 D
Schr\""odinger equation by using the gauge theory of strong phase correlations.
It is shown that invariance relative to $q$-deformed Hopf algebra with
deformation parameter $q$ being the fourth root of unity makes the values of
the Chern-Simons term coefficient, $k=2$, and of the coupling constant,
$g=1/2$, fixed; no collapsing solutions are present at those values.
","[{""version"":""v1"",""created"":""Thu, 7 Jul 1994 10:39:48 GMT""}]","2016-09-06"
"hep-th/9407041","Alexander Balinsky","A. A. Balinsky and Yu. Burman","Quadratic Poisson brackets compatible with an algebra structure","6 pages","J.Phys. A27 (1994) L693-L696","10.1088/0305-4470/27/18/008",,"hep-th math.QA",,"  Quadratic Poisson brackets on a vector space equipped with a bilinear
multiplication are studied. A notion of a bracket compatible with the
multiplication is introduced and an effective criterion of such compatibility
is given. Among compatible brackets, a subclass of coboundary brackets is
described, and such brackets are enumerated in a number of examples.
","[{""version"":""v1"",""created"":""Thu, 7 Jul 1994 13:25:41 GMT""},{""version"":""v2"",""created"":""Sun, 10 Jul 1994 16:01:58 GMT""}]","2009-10-28"
"hep-th/9407042","Blau Matthias","Matthias Blau and George Thompson","Equivariant Kaehler Geometry and Localization in the G/G Model","LaTex file, 40 A4 pages, IC/94/108 and ENSLAPP-L-469/94","Nucl.Phys. B439 (1995) 367-394","10.1016/0550-3213(95)00058-Z",,"hep-th",,"  We analyze in detail the equivariant supersymmetry of the $G/G$ model. In
spite of the fact that this supersymmetry does not model the infinitesimal
action of the group of gauge transformations, localization can be established
by standard arguments. The theory localizes onto reducible connections and a
careful evaluation of the fixed point contributions leads to an alternative
derivation of the Verlinde formula for the $G_{k}$ WZW model. We show that the
supersymmetry of the $G/G$ model can be regarded as an infinite dimensional
realization of Bismut's theory of equivariant Bott-Chern currents on K\""ahler
manifolds, thus providing a convenient cohomological setting for understanding
the Verlinde formula. We also show that the supersymmetry is related to a
non-linear generalization (q-deformation) of the ordinary moment map of
symplectic geometry in which a representation of the Lie algebra of a group $G$
is replaced by a representation of its group algebra with commutator $[g,h] =
gh-hg$. In the large $k$ limit it reduces to the ordinary moment map of
two-dimensional gauge theories.
","[{""version"":""v1"",""created"":""Thu, 7 Jul 1994 14:08:41 GMT""}]","2009-10-28"
"nucl-th/9407011","Andrey M. Shirokov","Yu.A.Lurie, A.M.Shirokov, and Yu.F.Smirnov (Institute for Nuclear
  Physics, Moscow State University, Moscow, 119899, Russia)","Soft dipole mode in $^{11}$Li and three body continuum","Presented by A.M.Shirokov as a talk at the Conference 'HALO-94'
  (Copenhagen, January 1994). LaTeX, 13 pages including 3 figures in postscript
  (40kb Latex file + 130kb postscript files). Latex sources for printing the
  figures are available from the authors on request",,,,"nucl-th",,"  Properties of the neutron rich $^{11}$Li nucleus are calculated in the
framework of the cluster model $^{9}$Li $+n+n$. The formalism of the harmonic
oscillator representation of the scattering theory is used for the description
of bound and continuum spectrum states in the three-body-democratic-decay
approximation. It is shown that this approach allows one to take into account
adequately the long asymptotic tail of the $^{11}$Li wave function ({\em
neutron halo}) and to reproduce correctly the binding energy, radius and
$^{11}$Li electromagnetic dissociation cross-section on target nuclei. The
shape and the energy position of the $B(E1)$ peak corresponding to the soft
dipole mode are also in agreement with experiment.
","[{""version"":""v1"",""created"":""Wed, 6 Jul 1994 23:10:13 GMT""}]","2007-05-23"
"nucl-th/9407013","Steffen Weber","S. Weber, M. Kachelriess, M. Unkelbach and H.M. Hofmann","6Li Inelastic Form Factors in a Cluster Model","4 pages figures available from author via ftp, accepted for
  publication in Phys. Rev. C","Phys.Rev.C50:1492-1495,1994","10.1103/PhysRevC.50.1492",,"nucl-th",,"  Longitudinal and transverse form factors are calculated for the transition
into the low lying excited T=0 and T=1 states of 6Li in the framework of the
resonating group model. All form factors are reproduced simultaneously using
three cluster-wavefunctions. Meson exchange currents yield only minor
corrections and do not lead to any specific structures at large momentum
transfers.
","[{""version"":""v1"",""created"":""Thu, 7 Jul 1994 07:44:27 GMT""}]","2009-09-25"
"patt-sol/9407001","John D. Crawford","John David Crawford (Department of Physics and Astronomy, University
  of Pittsburgh, Pittsburgh, PA)","Universal trapping scaling on the unstable manifold for a collisionless
  electrostatic mode","11 pages (Latex/RevTex), 2 figures available in hard copy from the
  Author (jdc@minerva.phyast.pitt.edu); paper accepted by Physical Review
  Letters","Phys. Rev. Lett. 73, 656 (1994)","10.1103/PhysRevLett.73.656",,"patt-sol nlin.PS",,"  An amplitude equation for an unstable mode in a collisionless plasma is
derived from the dynamics on the two-dimensional unstable manifold of the
equilibrium. The mode amplitude $\rho(t)$ decouples from the phase due to the
spatial homogeneity of the equilibrium, and the resulting one-dimensional
dynamics is analyzed using an expansion in $\rho$. As the linear growth rate
$\gamma$ vanishes, the expansion coefficients diverge; a rescaling
$\rho(t)\equiv\gamma^2\,r(\gamma t)$ of the mode amplitude absorbs these
singularities and reveals that the mode electric field exhibits trapping
scaling $|E_1|\sim\gamma^2$ as $\gamma\rightarrow0$. The dynamics for $r(\tau)$
depends only on the phase $e^{i\xi}$ where $d\epsilon_{{k}}
/dz=|{\epsilon_{{k}}}|e^{-i\xi/2}$ is the derivative of the dielectric as
$\gamma\rightarrow0$.
","[{""version"":""v1"",""created"":""Wed, 6 Jul 1994 17:18:25 GMT""}]","2009-10-28"
