"hep-th/9407049","Qmw Theory Group","D. Bailin, A. Love, W. A. Sabra and S. Thomas","Modular Symmetries, Threshold Corrections And Moduli For $Z_2 \times Z_2
  $ Orbifolds","QMW--TH--94/18, 12 pages","Mod.Phys.Lett. A10 (1995) 337-346","10.1142/S0217732395000375",,"hep-th",,"  ${\bf Z}_2\times {\bf Z}_2$ Coxeter orbifolds are constructed with the
property that some twisted sectors have fixed planes for which the six-torus
can not be decomposed into a direct sum ${\bf T}^2\bigoplus{\bf T}^4 $ with the
fixed plane lying in ${\bf T}^2$. The string loop threshold corrections to the
gauge coupling constants are derived, and display symmetry groups for the $T$
and $U$ moduli that are subgroups of the full modular group $PSL(2,Z)$. The
effective potential for duality invariant gaugino condensate in the presence of
hidden sector matter is constructed and minimized for the values of the moduli.
The effect of Wilson lines on the modular symmetries is also studied.
","[{""version"":""v1"",""created"":""Fri, 8 Jul 1994 14:22:11 GMT""}]","2015-06-26"
"nucl-th/9407014",,"David Seibert and George Fai (Center for Nuclear Research, Department
  of Physics, Kent State University, Kent, OH)","Heavy resonance production in high energy nuclear collisions","revtex, 15 pages, no figures, KSUCNR-009-94","Phys.Rev.C50:2532-2539,1994","10.1103/PhysRevC.50.2532",,"nucl-th hep-ph",,"  We estimate freezeout conditions for $s$, $c$, and $b$ quarks in high energy
nuclear collisions. Freezeout is due either to loss of thermal contact, or to
particles ``wandering'' out of the region of hot matter. We then develop a
thermal recombination model in which both single-particle (quark and antiquark)
and two-particle (quark-antiquark) densities are conserved. Conservation of
two-particle densities is necessary because quarks and antiquarks are always
produced in coincidence, so that the local two-particle density can be much
larger than the product of the single-particle densities. We use the freezeout
conditions and recombination model to discuss heavy resonance production at
zero baryon density in high energy nuclear collisions.
","[{""version"":""v1"",""created"":""Thu, 7 Jul 1994 21:00:48 GMT""}]","2008-11-26"
"nucl-th/9407015","Jochen Wambach","S. Drozdz, S. Nishizaki, J.Speth and J. Wambach","Phase-Space Exploration in Nuclear Giant Resonance Decay","LATEX, 11 pages +4 figures, figs. available from the authors,
  preprint KFA-IKP(TH)-1994-24","Phys.Rev.Lett. 74 (1995) 1075-1078","10.1103/PhysRevLett.74.1075",,"nucl-th",,"  The rate of phase-space exploration in the decay of isovector and isoscalar
giant quadrupole resonances in $^{40}$Ca is analyzed. The study is based on the
time dependence of the survival probability and of the spectrum of generalized
entropies evaluated in the space of 1p-1h and 2p-2h states. If the 2p-2h
background shows the characteristics typical for chaotic systems, the isovector
excitation evolves almost statistically while the isoscalar excitation remains
largely localized, even though it penetrates the whole available phase space.
","[{""version"":""v1"",""created"":""Fri, 8 Jul 1994 12:19:42 GMT""}]","2009-10-28"
"nucl-th/9407016",,"G. Q. Li and C. M. Ko","Can dileptons reveal the in-medium properties of vector mesons?","22 pages, 11 figures available upon request to gqli@comp.tamu.edu","Nucl.Phys. A582 (1995) 731-748","10.1016/0375-9474(94)00500-M",,"nucl-th",,"  Dilepton production from both pion-pion and kaon-antikaon annihilation in
heavy-ion collisions is studied using the relativistic transport model. The
formation of a rho meson from pion-pion annihilation and a phi meson from
kaon-antikaon annihilation, their propagation in the medium, and their decay
into dileptons are explicitly treated. Including the medium modifications of
the masses and widths of vector mesons as predicted by the QCD sum-rule
calculations, we study their effects on the dilepton invariant mass spectra
from heavy-ion collisions at SIS/GSI energies.
","[{""version"":""v1"",""created"":""Fri, 8 Jul 1994 15:06:55 GMT""}]","2009-10-28"
"nucl-th/9407017",,"G. Q. Li and C. M. Ko","Antiproton production in Ni+Ni collisions at 1.85 GeV/nucleon","10 pages, 4 figures available upon request to gqli@comp.tamu.edu.
  TAMUNT-9404","Phys.Rev.C50:1725-1728,1994","10.1103/PhysRevC.50.1725",,"nucl-th",,"  Antiproton production in Ni+Ni collisions at 1.85 GeV/nucleon is studied in
the relativistic Vlasov-Uehling-Uhlenbeck model. The self-energies of the
antiproton are determined from the nucleon self-energies by the G-parity
transformation. Also, the final-state interactions of the antiproton including
both rescattering and annihilation are explicitly treated. With a soft nuclear
equation of state, the calculated antiproton momentum spectrum is in good
agreement with recent experimental data from the heavy-ion synchrotron at GSI.
The effect due to the reduced nucleon and antinucleon masses in a medium is
found to be more appreciable than in earlier Bevalac experiments with lighter
systems and at higher energies.
","[{""version"":""v1"",""created"":""Fri, 8 Jul 1994 15:46:30 GMT""}]","2009-09-25"
"nucl-th/9407018",,"X. S. Fang, C. M. Ko, G. Q. Li, and Y. M. Zheng","The relativistic transport model description of subthreshold kaon
  production in heavy-ion collisions","27 pages, 16 figures available upon request to gqli@comp.tamu.edu.
  TAMUNT-9405","Nucl.Phys.A575:766-790,1994","10.1016/0375-9474(94)90165-1",,"nucl-th",,"  The relativistic transport model, in which the nucleon effective mass is
connected to the scalar field while its energy is shifted by the vector
potential, is extended to include the kaon degree of freedom. We further take
into account the medium modification of the kaon mass due to the explicit
chiral symmetry breaking. Both the propagation of kaons in the mean-field
potential and the kaon-baryon elastic scattering are explicitly treated in our
study. We find that the attractive kaon scalar mean-field potential in the
dense matter leads to an enhanced kaon yield in heavy-ion collisions at
energies of about 1 GeV/nucleon. The final-state kaon-baryon scattering is seen
to affect significantly the kaon momentum spectra, leading to an enhanced yield
of kaons with large momenta or at large laboratory angles. With a soft nuclear
equation of state and including the attractive kaon scalar potential, the
calculated kaon energy spectra agree with the data from the heavy-ion
synchrotron at GSI.
","[{""version"":""v1"",""created"":""Fri, 8 Jul 1994 15:55:43 GMT""}]","2011-07-19"
