"astro-ph/9411115","Ana","Ana Campos (Instituto Astrofisica Andalucia Csic)","Faint Field Galaxies: A Population of Intrinsically Faint Objects at Low
  Redshift?","5 pages 2 Figures, uuencoded compressed Postscript. To appear in the
  Proceedings of the 11th Internation Potsdam Workshop on Large Scale Structure
  in The Universe",,,,"astro-ph",,"  To distinguish between the different models proposed to understand the excess
of faint field counts over the predictions from non-evolving models, a number
of redshift surveys have been undertaken. The answer has not arrived yet due to
the high rate of incompleteness achieved. Un-identified galaxies have been
shown to be bluer than identified ones. In this paper, it is argued that some
of these galaxies could be ""quiescent"" dwarfs, still quite blue, but with
featureless spectra.
","[{""version"":""v1"",""created"":""Wed, 30 Nov 1994 22:09:52 GMT""}]","2007-05-23"
"astro-ph/9411116","Rosemary Wyse","Gerard Gilmore (Institute of Astronomy, Cambridge), Rosemary F.G. Wyse
  (Center for Particle Astrophysics, University of California, Berkeley) and J.
  Bryn Jones (University of Wales, College of Cardiff)","A Determination of the Thick Disk Chemical Abundance Distribution:
  Implications for Galaxy Evolution","38 pages, plain tex, 19 figures (available by snail mail). To appear
  in the Astronomical Journal",,"10.1086/117344",,"astro-ph",,"  We present a determination of the thick disk iron abundance distribution
obtained from an in situ sample of F/G stars. These stars are faint, $15 \simlt
V \simlt 18$, selected on the basis of color, being a subset of the larger
survey of Gilmore and Wyse designed to determine the properties of the stellar
populations several kiloparsecs from the Sun. The fields studied in the present
paper probe the iron abundance distribution of the stellar populations of the
Galaxy at 500--3000pc above the plane, at the solar Galactocentric distance.
","[{""version"":""v1"",""created"":""Thu, 1 Dec 1994 00:06:42 GMT""}]","2009-10-22"
"astro-ph/9411117","Gautam Vasisht","G. Vasisht, D. A. Frail, and S. R. Kulkarni","Radio Monitoring and High Resolution Observations of the Soft Gamma Ray
  Repeater 1806-20. by Vasisht et al. Postscript file, 13 pages","Requests for figures and tables from authors, 14 pages AAS format.
  Requests to gv@astro.caltech.edu",,"10.1086/187762",,"astro-ph",,"  We report the results of radio flux-monitoring and high resolution
observations at 3.6 cm with the VLA, of the central condensation in G10.0-0.3,
the radio nebula surrounding the soft gamma ray repeater (SGR) 1806-20. The
quiescent X-ray source AX1805.7-2025 is coincident with the radio core
suggesting that G10.0-0.3 is a plerionic supernova remnant. The monitoring
experiment was performed in 10 epochs spread over five months, starting just
before the latest reactivation of SGR 1806-20 in gamma-rays. There is no
apparent increase in the radio flux density from the central region of
G10.0-0.3 on timescales of days to months following the gamma-ray bursts. At a
resolution of 1 arcsec the peak region of G10.0-0.3 is seen to consist of a
compact source with diffuse, one-sided emission, reminiscent of core-jet
geometry seen in AGNs and some accreting Galactic binaries. By analogy with
these latter sources, we argue that the SGR 1806-20 is coincident with the core
component. If so, this is the first arcsecond localization of a high energy
transient. The lack of radio variability and the low brightness temperature of
the central component distinguish SGR 1806-20 from other accreting binaries.
The structure of the high resolution radio image also does not particularly
resemble that seen in the vicinity of young pulsars. Thus there is no
compelling observational evidence for either of the two models discussed for
SGRs, the pulsar model or the accreting binary model.
","[{""version"":""v1"",""created"":""Thu, 1 Dec 1994 02:03:50 GMT""}]","2015-06-24"
"astro-ph/9412001","Francisco Carrera","F.J. Carrera, X. Barcons, J.A. Butcher, A.C. Fabian, O. Lahav, G.C.
  Stewart & R.S. Warwick","Nearby Galaxies and the Ginga X-ray Background","20 pages, 11 compressed uuencoded figures appended at the end
  Submitted to MNRAS",,"10.1093/mnras/275.1.22",,"astro-ph",,"  We present here the results of cross-correlating the X-ray background
measured by Ginga in the 2-10 keV band with several catalogues of extragalactic
objects. Positive signals with an amplitude of a few per cent have been found
for some catalogues implying that some fraction of the X-ray background is
produced either by the class of catalogued sources or by other classes
spatially related to them. Detailed X-ray background simulations have been used
to assess the significance of the results and, for the first time, the full
angular shape of the cross-correlation. The inferred X-ray volume emissivity in
the local Universe, j_0, has been estimated for two galaxy catalogues (UGC and
IRAS) for which the cross-correlation is highly significant. We obtain j_0=
(0.74 +/- 0.07) for UGC and j_0= (1.15 +/- 0.10) for IRAS, in units of 1.E39 h
erg/s/Mpc3. Extrapolating this result back to z~1-4 leads to the conclusion
that <~10-30 per cent of the X-ray background could be produced by a
non-evolving population of galaxies. These values are shown to be consistent
with upper limits on the Auto Correlation Function derived here.
","[{""version"":""v1"",""created"":""Thu, 1 Dec 1994 12:58:11 GMT""},{""version"":""v2"",""created"":""Fri, 2 Dec 1994 09:10:36 GMT""}]","2015-06-24"
"chao-dyn/9411024","Maria Jose Sanchez","A.J.Fendrik and M.J.S\'anchez (Departamento de F\'isica, Facultad de
  Ciencias Exactas y Naturales, Universidad de Buenos Aires, Ciudad
  Universitaria, 1428, Buenos Aires,Argentina)","Decay of the Sinai Well in D dimensions","14 pages, Figures available under request. Revtex. Submitted to Phys.
  Rev. E.,e-mail: majo@dfuba.df.uba.ar",,"10.1103/PhysRevE.51.2996",,"chao-dyn nlin.CD",,"  We study the decay law of the Sinai Well in $D$ dimensions and relate the
behavior of the decay law to internal distributions that characterize the
dynamics of the system. We show that the long time tail of the decay is
algebraic ($1/t$), irrespective of the dimension $D$.
","[{""version"":""v1"",""created"":""Wed, 30 Nov 1994 17:26:18 GMT""}]","2016-08-14"
"cmp-lg/9411032","Ehud Reiter","Ehud Reiter (CoGenTex, Ithaca, USA)","Has a Consensus NL Generation Architecture Appeared, and is it
  Psycholinguistically Plausible?","uuencoded compressed tar file, containing LaTeX source and two style
  files. This paper appeared in the 1994 International NLG workshop",,,,"cmp-lg cs.CL",,"  I survey some recent applications-oriented NL generation systems, and claim
that despite very different theoretical backgrounds, these systems have a
remarkably similar architecture in terms of the modules they divide the
generation process into, the computations these modules perform, and the way
the modules interact with each other. I also compare this `consensus
architecture' among applied NLG systems with psycholinguistic knowledge about
how humans speak, and argue that at least some aspects of the consensus
architecture seem to be in agreement with what is known about human language
production, despite the fact that psycholinguistic plausibility was not in
general a goal of the developers of the surveyed systems.
","[{""version"":""v1"",""created"":""Wed, 30 Nov 1994 18:44:10 GMT""}]","2008-02-03"
"cmp-lg/9412001","Tom Lai","Bong Yeung Tom Lai (City University of Hong Kong & Tsinghua
  University, Beijing) and Changning Huang (Tsinghua University, Beijing)","Dependency Grammar and the Parsing of Chinese Sentences","PostScript. 8 pages. Contains bitmap figures and will therefore print
  slowly. Will appear in Proceedings of 1994 Joint Conference of 8th ACLIC and
  2nd PacFoCoL, Kyoto, Aug. 10-12, 1994",,,,"cmp-lg cs.CL",,"  Dependency Grammar has been used by linguists as the basis of the syntactic
components of their grammar formalisms. It has also been used in natural
language parsing. In China, attempts have been made to use this grammar
formalism to parse Chinese sentences using corpus-based techniques. This paper
reviews the properties of Dependency Grammar as embodied in four axioms for the
well-formedness conditions for dependency structures. It is shown that allowing
multiple governors as done by some followers of this formalism is unnecessary.
The practice of augmenting Dependency Grammar with functional labels is also
discussed in the light of building functional structures when the sentence is
parsed. This will also facilitate semantic interpretation.
","[{""version"":""v1"",""created"":""Thu, 1 Dec 1994 07:19:12 GMT""}]","2008-02-03"
"cond-mat/9411132","Anton Kast","Anton Kast (University of California, Berkeley)","Correlation Length and Average Loop Length of the Fully-Packed Loop
  Model","13 pages, three encapsulated PostScript figures uuencoded, epsf.tex
  required",,,,"cond-mat hep-th",,"  The fully-packed loop model of closed paths covering the honeycomb lattice is
studied through its identification with the $sl_q(3)$ integrable lattice model.
Some known results from the Bethe ansatz solution of this model are reviewed.
The free energy, correlation length, and the ensemble average loop length are
given explicitly for the many-loop phase. The results are compared with the
known result for the model's surface tension. A perturbative formalism is
introduced and used to verify results.
","[{""version"":""v1"",""created"":""Thu, 1 Dec 1994 02:40:43 GMT""}]","2007-05-23"
"cond-mat/9412001","Anna Jadczyk","Sergio Albeverio, Roman Gielerak, Helge Holden, Torbj{\o}rn Kolsrud
  and Mohammed Mebkhout","Thermal fluctuations around classical crystalline ground states. The
  case of bounded fluctuations","38 pages, LaTex file",,,,"cond-mat",,"  We study low--temperature non Gaussian thermal fluctuations of a system of
classical particles around a (hypothetical) crystalline ground state. These
thermal fluctuations are described by the behaviour of a system of long range
interacting charged dipoles at high--temperature and high--density. For the
case of uniformly bounded fluctuations, the low--temperature linked cluster
expansion describing the contribution to the free energy is derived and
analysed. Finally some nonpertubative results on the existence and independence
of boundary conditions of the Gibbs states for the associated dipole systems
are obtained.
","[{""version"":""v1"",""created"":""Thu, 1 Dec 1994 11:57:02 GMT""}]","2007-05-23"
"cond-mat/9412002","Christoph Bruder","C. Bruder, A. van Otterlo, and G. T. Zimanyi","Tunnel junctions of unconventional superconductors","4 pages, revtex, 4 (encapsulated postscript) figures (figures
  replaced)",,"10.1103/PhysRevB.51.12904","TFP-Bru94","cond-mat",,"  The phenomenology of Josephson tunnel junctions between unconventional
superconductors is developed further. In contrast to s-wave superconductors,
for d-wave superconductors the direction dependence of the tunnel matrix
elements that describe the barrier is relevant. We find the full I-V
characteristics and comment on the thermodynamical properties of these
junctions. They depend sensitively on the relative orientation of the
superconductors. The I-V characteristics differ from the normal s-wave RSJ-like
behavior.
","[{""version"":""v1"",""created"":""Thu, 1 Dec 1994 12:04:28 GMT""},{""version"":""v2"",""created"":""Fri, 2 Dec 1994 16:16:37 GMT""},{""version"":""v3"",""created"":""Fri, 2 Dec 1994 18:42:19 GMT""}]","2009-10-22"
"cond-mat/9412003","Masaki Oshikawa","Naoto Nagaosa and Masaki Oshikawa","Chiral Anomaly and Spin Gap in One-Dimensional Interacting Fermions","Revised and enlarged version. 16 pages in REVTEX","J. Phys. Soc. Jpn. 65, 2241 (1996)","10.1143/JPSJ.65.2241",,"cond-mat",,"  Semiclassical approach has been developed for the one-dimensional interacting
fermion systems. Starting from the incommensurate spin density wave (SDW) mean
field state for the repulsive Hubbard model in 1D, the non-Abelian bosonized
Lagrangian describing the spin-charge separation is obtained. The Berry phase
term is derived from the chiral anomaly, and we obtain the massless
Tomonaga-Luttinger liquid in the single chain case while the spin gap opens in
the double-chain system. This approach offers a new method to identify the
strong-coupling fixed point, and its relation to the Abelian bosonization
formalism is discussed on the spin gap state. The generalization to higher
dimensions is also discussed.
","[{""version"":""v1"",""created"":""Thu, 1 Dec 1994 11:24:46 GMT""},{""version"":""v2"",""created"":""Fri, 9 Jun 1995 09:16:38 GMT""}]","2009-10-22"
"cond-mat/9412004","Giorgio Parisi","Giorgio Parisi Dipartimento di fisica Roma I","On the Replica Approach to Spin Glass",,,,,"cond-mat",,"  In this talk I will review the approach to spin glasses based on the
spontaneously broken replica symmetry. I will concentrate my attention mostly
on more general ideas, skipping technical details and stressing the
characteristic predictions of this approach. After the introduction of the
replica method, the predicted structure of states is investigated in details,
paying a particular attention to the local overlaps and to the structure of the
clusters. I will finally study the behaviour of the system near the lower
critical dimension and I will show that the technique of coupling real replicas
is able to give relevant information.
","[{""version"":""v1"",""created"":""Thu, 1 Dec 1994 14:54:36 GMT""}]","2007-05-23"
"cond-mat/9412005",,"Ubaldo Tambini, Roberto Onofrio, and Carlo Presilla","Dynamics of Quantum Collapse in Energy Measurements","20 pages with figures, compressed and uuencoded ps file","Phys. Rev. A 51 (1995) 967-975","10.1103/PhysRevA.51.967",,"cond-mat hep-th quant-ph",,"  The influence of continuous measurements of energy with a finite accuracy is
studied in various quantum systems through a restriction of the Feynman
path-integrals around the measurement result. The method, which is equivalent
to consider an effective Schr\""odinger equation with a non-Hermitian
Hamiltonian, allows one to study the dynamics of the wavefunction collapse. A
numerical algorithm for solving the effective Schr\""odinger equation is
developed and checked in the case of a harmonic oscillator. The situations, of
physical interest, of a two-level system and of a metastable quantum-well are
then discussed. In the first case the Zeno inhibition observed in quantum
optics experiments is recovered and extended to nonresonant transitions, in the
second one we propose to observe inhibition of spontaneous decay in mesoscopic
heterostructures. In all the considered examples the effect of the continuous
measurement of energy is a freezing of the evolution of the system proportional
to the accuracy of the measurement itself.
","[{""version"":""v1"",""created"":""Thu, 1 Dec 1994 15:14:10 GMT""},{""version"":""v2"",""created"":""Tue, 13 Dec 1994 11:48:10 GMT""}]","2009-10-22"
"cond-mat/9412006","Vijay S. Pande","Vijay S. Pande, Alexander Yu. Grosberg, Toyoichi Tanaka","Freezing Transition of Random Heteropolymers Consisting of an Arbitrary
  Set of Monomers","30 pages, 1 postscript figure",,"10.1103/PhysRevE.51.3381",,"cond-mat",,"  Mean field replica theory is employed to analyze the freezing transition of
random heteropolymers comprised of an arbitrary number ($q$) of types of
monomers. Our formalism assumes that interactions are short range and
heterogeneity comes only from pairwise interactions, which are defined by an
arbitrary $q \times q$ matrix. We show that, in general, there exists a
freezing transition from a random globule, in which the thermodynamic
equilibrium is comprised of an essentially infinite number polymer
conformations, to a frozen globule, in which equilibrium ensemble is dominated
by one or very few conformations. We also examine some special cases of
interaction matrices to analyze the relationship between the freezing
transition and the nature of interactions involved.
","[{""version"":""v1"",""created"":""Thu, 1 Dec 1994 15:40:02 GMT""}]","2009-10-22"
"cs/9412101",,"S. Soderland, Lehnert. W","Wrap-Up: a Trainable Discourse Module for Information Extraction","See http://www.jair.org/ for any accompanying files","Journal of Artificial Intelligence Research, Vol 2, (1994),
  131-158",,,"cs.AI",,"  The vast amounts of on-line text now available have led to renewed interest
in information extraction (IE) systems that analyze unrestricted text,
producing a structured representation of selected information from the text.
This paper presents a novel approach that uses machine learning to acquire
knowledge for some of the higher level IE processing. Wrap-Up is a trainable IE
discourse component that makes intersentential inferences and identifies
logical relations among information extracted from the text. Previous
corpus-based approaches were limited to lower level processing such as
part-of-speech tagging, lexical disambiguation, and dictionary construction.
Wrap-Up is fully trainable, and not only automatically decides what classifiers
are needed, but even derives the feature set for each classifier automatically.
Performance equals that of a partially trainable discourse module requiring
manual customization for each domain.
","[{""version"":""v1"",""created"":""Thu, 1 Dec 1994 00:00:00 GMT""}]","2014-11-17"
"cs/9412102",,"W. L. Buntine","Operations for Learning with Graphical Models","See http://www.jair.org/ for any accompanying files","Journal of Artificial Intelligence Research, Vol 2, (1994),
  159-225",,,"cs.AI",,"  This paper is a multidisciplinary review of empirical, statistical learning
from a graphical model perspective. Well-known examples of graphical models
include Bayesian networks, directed graphs representing a Markov chain, and
undirected networks representing a Markov field. These graphical models are
extended to model data analysis and empirical learning using the notation of
plates. Graphical operations for simplifying and manipulating a problem are
provided including decomposition, differentiation, and the manipulation of
probability models from the exponential family. Two standard algorithm schemas
for learning are reviewed in a graphical framework: Gibbs sampling and the
expectation maximization algorithm. Using these operations and schemas, some
popular algorithms can be synthesized from their graphical specification. This
includes versions of linear regression, techniques for feed-forward networks,
and learning Gaussian and discrete Bayesian networks from data. The paper
concludes by sketching some implications for data analysis and summarizing how
some popular algorithms fall within the framework presented. The main original
contributions here are the decomposition techniques and the demonstration that
graphical models provide a framework for understanding and developing complex
learning algorithms.
","[{""version"":""v1"",""created"":""Thu, 1 Dec 1994 00:00:00 GMT""}]","2014-11-17"
"cs/9412103",,"S. Minton, J. Bresina, M. Drummond","Total-Order and Partial-Order Planning: A Comparative Analysis","See http://www.jair.org/ for an online appendix and other files
  accompanying this article","Journal of Artificial Intelligence Research, Vol 2, (1994),
  227-262",,,"cs.AI",,"  For many years, the intuitions underlying partial-order planning were largely
taken for granted. Only in the past few years has there been renewed interest
in the fundamental principles underlying this paradigm. In this paper, we
present a rigorous comparative analysis of partial-order and total-order
planning by focusing on two specific planners that can be directly compared. We
show that there are some subtle assumptions that underly the wide-spread
intuitions regarding the supposed efficiency of partial-order planning. For
instance, the superiority of partial-order planning can depend critically upon
the search strategy and the structure of the search space. Understanding the
underlying assumptions is crucial for constructing efficient planners.
","[{""version"":""v1"",""created"":""Thu, 1 Dec 1994 00:00:00 GMT""}]","2009-09-25"
"dg-ga/9411014","Guofang Wei","Xianzhe Dai, Guofang Wei and Rugang Ye","Smoothing Riemannian Metrics with Ricci Curvature Bounds","15 pages, latex",,,,"dg-ga math.DG",,"  We prove that Riemannian metrics with an absolute Ricci curvature bound and a
conjugate radius bound can be smoothed to having a sectional curvature bound.
  Using this we derive a number of results about structures of manifolds with
Ricci curvature bounds.
","[{""version"":""v1"",""created"":""Wed, 30 Nov 1994 21:08:11 GMT""}]","2008-02-03"
"dg-ga/9411015","Xiao-Song Lin","Xiao-Song Lin and Zhenghan Wang","Integral geometry of plane curves and knot invariants","18 pages, amslatex, 8 figures not included (will send upon request)",,,,"dg-ga hep-th math.DG",,"  We study the integral expression of a knot invariant obtained as the second
coefficient in the perturbative expansion of Witten's Chern-Simons path
integral associated with a knot. One of the integrals involved turns out to be
a generalization of the classical Crofton integral on convex plane curves and
it is related with invariants of generic plane curves defined by Arnold
recently with deep motivations in symplectic and contact geometry. Quadratic
bounds on these plane curve invariants are derived using their relationship
with the knot invariant.
","[{""version"":""v1"",""created"":""Wed, 30 Nov 1994 21:41:06 GMT""}]","2008-02-03"
"gr-qc/9412001","Carlos O. Lousto","M.Campanelli, C.O.Lousto and J.Audretsch","Perturbative Metric of Charged Black Holes in Quadratic Gravity","10 pages, RevTeX","Phys. Rev. D 51, 6810 (1995)","10.1103/PhysRevD.51.6810","UAB-FT-354","gr-qc astro-ph hep-th",,"  We consider perturbative solutions to the classical field equations coming
from a quadratic gravitational lagrangian in four dimensions. We study the
charged, spherically symmetric black hole and explicitly give corrections up to
third order (in the coupling constant $\beta$ multiplying the
$R_{\mu\nu}R^{\mu\nu}$ term) to the Reissner--Nordstr\""om hole metric. We
consider the thermodynamics of such black holes, in particular, we compute
explicitly its temperature and entropy--area relation which deviates from the
usual $S=A/4$ expression.
","[{""version"":""v1"",""created"":""Thu, 1 Dec 1994 15:49:03 GMT""}]","2016-08-24"
"gr-qc/9412003","Melnikov Vitaly Nikolaevich","A.A.Kirillov","Quantum creation of an inhomogeneous unflationary universe","6 pages, latex, no figures","Grav.Cosmol. 2 (1996) 35-37",,"RGA-CSVR-015/94","gr-qc",,"  The process of quantum creation of a qusihomogeneous inflationary universe
near a cosmological singularity is considered. It is shown that during the
evolution quantum fluctuations of spatial topologies increase and the universe
acquires homogeneous and isotropic character on arbitrary large distances.
","[{""version"":""v1"",""created"":""Thu, 1 Dec 1994 15:44:34 GMT""}]","2007-05-23"
"hep-lat/9411083",,"S. Antonelli, A. Bartoloni, C. Battista, M. Bellacci, S. Cabasino,
  N.Cabibbo, L.A. Fernandez, E. Panizzi, P.S.Paolucci, A.Munoz-Sudupe,
  J.J.Ruiz-Lorenzo, R.Sarno, A.Tarancon, G.M.Todesco, M.Torelli, P.Vicini","APE Results of Hadron Masses in Full QCD Simulations","3 pages, compressed ps-file (uufiles), Contribution to Lattice 94","Nucl.Phys.Proc.Suppl. 42 (1995) 300-302","10.1016/0920-5632(95)00232-X",,"hep-lat",,"  We present numerical results obtained in full QCD with 2 flavors of Wilson
fermions. We discuss the relation between the phase of Polyakov loops and the
{\bf sea} quarks boundary conditions. We report preliminary results about the
HMC autocorrelation of the hadronic masses, on a $16^3 \times 32$ lattice
volume, at $\beta=5.55$ with $k_{sea}=0.1570$.
","[{""version"":""v1"",""created"":""Wed, 30 Nov 1994 16:38:36 GMT""}]","2019-08-17"
"hep-lat/9411084","J. Jersak","Christoph Frick and Jiri Jersak","Dynamical fermion mass generation by strong gauge interaction shielded
  by a scalar field","27 pages, macros and figures included in compressed archive","Phys.Rev. D52 (1995) 340-353","10.1103/PhysRevD.52.340","Juelich HLRZ 52/94","hep-lat hep-th",,"  The strongly coupled lattice gauge models with confined fermion and scalar
matter fields, which in a certain phase break dynamically a global chiral
symmetry, are reconsidered from the point of view of the existence of heavy
fermions. If these models are interpreted as describing a new strong force
beyond the standard model, such heavy fermions can arise as neutral bound
states of the fundamental fermion and scalar. The discussed mechanism could be
considered as an alternative to the Higgs mechanism.
","[{""version"":""v1"",""created"":""Wed, 30 Nov 1994 17:18:03 GMT""}]","2009-10-28"
"hep-lat/9411085","Claudio Parrinello","D.S. Henty and C. Parrinello","The SU(3) running coupling from lattice gluons","3 pages, uuencoded PostScript file, to appear in the Proceedings of
  the 1994 Symposium on Lattice Field Theory","Nucl.Phys.Proc.Suppl. 42 (1995) 264-266",,,"hep-lat",,"  We provide numerical results for the running coupling in $SU(3)$ Yang-Mills
theory as determined from an analysis of lattice two and three-point gluon
correlation functions. The coupling is evaluated directly, from first
principles, by defining suitable renormalisation constants from the lattice
triple gluon vertex and gluon propagator. For momenta larger than 2 GeV, the
coupling is found to run according to the 2-loop asymptotic formula. The
influence of lattice artifacts on the results appears negligible within the
precision of our measurements, although further work on this point is in
progress.
","[{""version"":""v1"",""created"":""Wed, 30 Nov 1994 16:25:08 GMT""}]","2007-05-23"
