"hep-lat/9411086","Brian Gough","Brian Gough (for the UKQCD Collaboration)","Update on the lattice calculation of $B \to K^* \gamma$","3 pages, 3 eps figures (using epsf.sty), encoded with uufiles,
  contribution to Lattice '94","Nucl.Phys.Proc.Suppl.42:409-411,1995","10.1016/0920-5632(95)00265-B",,"hep-lat",,"  We summarise our current results for calculations of the form factors for $B
\to K^* \gamma$, and their extrapolation to the physical b-quark mass.
","[{""version"":""v1"",""created"":""Wed, 30 Nov 1994 19:46:05 GMT""}]","2010-11-01"
"hep-lat/9411087","Terry Draper","Terrence Draper, Craig McNeile and Constantine Nenkov","NRQCD and Static Systems -- A General Variational Approach","Contribution to the Lattice '94 conference, 3 pages,
  uuencoded-compressed PostScript file","Nucl.Phys.Proc.Suppl.42:325-327,1995","10.1016/0920-5632(95)00240-A","UK/94-06","hep-lat",,"  We present initial results from Monte Carlo simulations of NRQCD-light,
static-light, and NRQCD-NRQCD mesons, using a variational technique (MOST), as
part of our ongoing calculation of the $f_{B}$ decay constant. The basis states
for the variational calculation are quark-antiquark operators separated by all
possible relative distances not equivalent under the cubic group (for example,
for a $20^{3}$ lattice there are 286 operators). The efficacy of the method is
demonstrated by the good plateaus obtained for the ground state and the clean
extraction of the wave functions of the ground and first radially excited
state.
","[{""version"":""v1"",""created"":""Wed, 30 Nov 1994 20:47:16 GMT""}]","2008-11-26"
"hep-lat/9412001","M. Baig IFAE","M. Baig","Phase Transitions in lattice QED","3-pages, uuencoded compressed postscript file, contribution to
  Lattice'94 conference","Nucl.Phys.Proc.Suppl. 42 (1995) 654-656","10.1016/0920-5632(95)00340-F","UAB-FT-355","hep-lat",,"  The main objective of the work presented here is to understand the appearance
of phase transitions in pure gauge and scalar lattice QED. Main results are as
follows: Pure gauge compact QED with PBC shows a monopole percolation phenomena
coupled to the monopole condensation. Pure gauge compact QED with Fixed
Boundary Conditions (spherical topology) shows a behaviour compatible with a
second order phase transition The $\gamma\to\infty$ limit of Non Compact Scalar
QED with PBC is related to the Villain form of compact QED and also to the Loop
Model for QED, showing a first order phase transition. Numerical a analysis of
a third rank abelian Z(2) theory shows an intriguing behaviour over the phase
transition that may be originated by point-like topological excitations.
","[{""version"":""v1"",""created"":""Thu, 1 Dec 1994 09:59:04 GMT""}]","2009-10-28"
"hep-lat/9412002","Gunnar Bali","G.S. Bali, K. Schilling, A. Wachter","Spin dependent potentials from SU(2) gauge theory","Talk held at LAT 94 conference, 3 pages, latex, uses epscrc2.sty","Nucl.Phys.Proc.Suppl.42:213-215,1995","10.1016/0920-5632(95)00204-M","WUB 94-36","hep-lat",,"  We present results on spin dependent potentials from lattice simulations of
SU(2) gauge theory. The Coulomb like short range part of the central potential
is identified as a mixed vector-scalar exchange while the linear long range
part is pure scalar.
","[{""version"":""v1"",""created"":""Thu, 1 Dec 1994 12:15:15 GMT""}]","2010-11-01"
"hep-lat/9412003","J. Engels","J.~Engels, V. K.~Mitrjushkin, and T.~Neuhaus","Polyakov loop and spin correlators on finite lattices A study beyond the
  mass gap","13 pages and 8 figures, latex","Nucl.Phys. B440 (1995) 555-572","10.1016/0550-3213(95)00080-C","BI-TP 94/47","hep-lat",,"  We derive an analytic expression for point-to-point correlation functions of
the Polyakov loop based on the transfer matrix formalism. For the $2d$ Ising
model we show that the results deduced from point-point spin correlators are
coinciding with those from zero momentum correlators. We investigate the
contributions from eigenvalues of the transfer matrix beyond the mass gap and
discuss the limitations and possibilities of such an analysis. The finite size
behaviour of the obtained $2d$ Ising model matrix elements is examined. The
point-to-point correlator formula is then applied to Polyakov loop data in
finite temperature $SU(2)$ gauge theory. The leading matrix element shows all
expected scaling properties. Just above the critical point we find a Debye
screening mass $~\mu_D/T\approx4~$, independent of the volume.
","[{""version"":""v1"",""created"":""Thu, 1 Dec 1994 14:36:17 GMT""}]","2009-10-28"
"hep-lat/9412004","Andrea Ruben Levi","R.C. Brower, A.R. Levi and K. Orginos","Extrapolation Methods for the Dirac Inverter in Hybrid Monte Carlo","latex file with espcrc2 style","Nucl.Phys.Proc.Suppl. 42 (1995) 855-857","10.1016/0920-5632(95)00402-U","BU-HEP-94-33","hep-lat",,"  In Hybrid Monte Carlo(HMC) simulations for full QCD, the gauge fields evolve
smoothly as a function of Molecular Dynamics (MD) time. Thus we investigate
improved methods of estimating the trial solutions to the Dirac propagator as
superpositions of the solutions in the recent past. So far our best
extrapolation method reduces the number of Conjugate Gradient iterations per
unit MD time by about a factor of 4. Further improvements should be forthcoming
as we further exploit the information of past trajectories.
","[{""version"":""v1"",""created"":""Thu, 1 Dec 1994 15:58:57 GMT""}]","2009-10-28"
"hep-ph/9411441","German Valencia","G. Valencia (Iowa State University)","Constructing CP-Odd Observables","Lectures given at the 1994 TASI summer school, Boulder, Colorado.
  Obsolete macros replaced",,"10.1142/9789814532662","AMES-HET-94-12","hep-ph","http://creativecommons.org/licenses/by-nc-nd/4.0/","  In these lectures we review the general features necessary to construct $\cp$
odd observables and study illustrative examples. We present in some detail the
case of $\cp$ violation in hyperon decays. We survey different observables
sensitive to $\cp$ violating new physics, concentrating on the search for
electric-dipole moments in high energy experiments.
","[{""version"":""v1"",""created"":""Wed, 30 Nov 1994 16:22:52 GMT""},{""version"":""v2"",""created"":""Tue, 20 Jul 2021 06:31:40 GMT""}]","2021-07-21"
"hep-ph/9411442","German Valencia","G. Valencia (Iowa State University)","CP Violation in Hyperon Decays","Invited talk at HQ94, Oct. 7-10, 1994, Charlottesville, Virginia. 8
  pages LaTeX","Frascati Phys.Ser.3:71-80,1994",,"AMES-HET-94-13","hep-ph",,"  In this talk we review the status of the theoretical estimates for CP
violating asymmetries in non-leptonic hyperon decays.
","[{""version"":""v1"",""created"":""Wed, 30 Nov 1994 17:00:03 GMT""}]","2010-11-01"
"hep-ph/9411443","Smaragda Lola","A. De la Macorra and S. Lola","Inflation from superstrings","22 pages, no figures, latex file We have corrected the magnitude of
  the density fluctuations, which become smaller than the COBE ones. Some
  references have also been added, and a few misprints corrected","Int.J.Mod.Phys. D5 (1996) 541-566","10.1142/S0218271896000345","HD-THEP-94-45, IFUNAM-FT-94-63","hep-ph astro-ph",,"  We investigate the possibility of obtaining inflationary solutions of the
slow roll type from a low energy Lagrangian coming from superstrings. The
advantage of such an approach is that in these theories the scalar potential
has only one free parameter (the Planck scale) and therefore no unnatural fine
tuning may be accommodated. We find that in any viable scheme the dilaton and
the moduli fields have to be stabilized and that before this happens, no other
field may be used as the inflaton. Then inflation may occur due to chiral
matter fields. Demanding that the potential terms associated with the chiral
fields do not spoil the dilaton and moduli minimization leads to severe
constraints on the magnitude of the density fluctuations.
","[{""version"":""v1"",""created"":""Wed, 30 Nov 1994 21:07:14 GMT""},{""version"":""v2"",""created"":""Thu, 1 Jun 1995 12:35:35 GMT""}]","2009-10-28"
"hep-ph/9411444",,"John C. Collins and Glenn A. Ladinsky","On pi-pi Correlations in Polarized Quark Fragmentation Using the Linear
  Sigma Model","18 pages, using TeXsis (or mtexsis.tex) and epsf.tex, 3 figures in
  uuencoded format (replaced figures file)",,,"PSU/TH/114","hep-ph",,"  Using the linear sigma model to describe quark--pion interactions, we compute
polarization asymmetries in quark fragmentation. We show that the effects of
transverse quark polarizations appear in the correlation between the two
leading pions in a jet produced by the fragmentation of a quark. Such
asymmetries provide a window to the nature of chiral symmetry breaking in QCD.
","[{""version"":""v1"",""created"":""Wed, 30 Nov 1994 23:38:18 GMT""},{""version"":""v2"",""created"":""Thu, 1 Dec 1994 17:36:23 GMT""}]","2008-02-03"
"hep-ph/9411445","Tao Han","T. Han (UC-Davis), Z. Huang (LBL), P.Q. Hung (Univ. of Virginia)","A Model of Low-lying States in Strongly Interacting Electroweak
  Symmetry-Breaking Sector","revised version, to appear in Modern Physics Letters A; file also
  available via anonymous ftp at ftp://ucdhep.ucdavis.edu/han/sews/lowlying.ps","Mod.Phys.Lett. A11 (1996) 1131-1138","10.1142/S0217732396001168","UCD--94--38, LBL--36270, UVA--INPP--95--6","hep-ph",,"  It is proposed that, in a strongly-interacting electroweak sector, besides
the Goldstone bosons, the coexistence of a scalar state ($H$) and vector
resonances such as $A_1$ [$I^G(J^P)=1^-(1^+$)], $V$ [$1^+(1^-)$] and
$\omega_H^{}$ [$0^-(1^-)$] is required by the proper Regge behavior of the
forward scattering amplitudes. This is a consequence of the following
well-motivated assumptions: (a). Adler-Weisberger-type sum rules and the
superconvergence relations for scattering amplitudes hold in this strongly
interacting sector; (b). the sum rules at $t=0$ are saturated by a minimal set
of low-lying states with appropriate quantum numbers. It therefore suggests
that a complete description should include all these resonances. These states
may lead to distinctive experimental signatures at future colliders.
","[{""version"":""v1"",""created"":""Thu, 1 Dec 1994 01:58:00 GMT""},{""version"":""v2"",""created"":""Sat, 3 Dec 1994 01:39:38 GMT""},{""version"":""v3"",""created"":""Fri, 19 Apr 1996 21:06:42 GMT""}]","2009-10-28"
"hep-ph/9412201",,"D. Bardin, M. Bilenky, A. Chizhov, O. Fedorenko, S. Ganguli, A. Gurtu,
  M. Lokajicek, G. Mitselmakher, A. Olshevsky, J. Ridky, S. Riemann, T.
  Riemann, M. Sachwitz, A. Sazonov, A.D. Schaile, Yu. Sedykh, I. Sheer, L.
  Vertogradov","ZFITTER -- An Analytical Program for Fermion Pair Production in e+e-
  Annihilation","76 pages (LaTeX), 19 figures, 12 tables, files containing the LaTeX
  text and the figures are available via anonymous ftp at
  ftp://ftp.ifh.de/pub/preprint/cernth92-6443.uu and the ps file from
  http://www.ifh.de/~riemann/ New submission for inclusion of figures. No
  changes of the paper",,,,"hep-ph",,"  We describe how to use ZFITTER, a program based on a semi-analytical approach
to fermion pair production in e+e- annihilation and Bhabha scattering. A
flexible treatment of complete ${\cal O}(\alpha)$ QED corrections, also
including higher orders, allows for three calculational {\bf chains} with
different realistic sets of restrictions in the photon phase space. {\tt
ZFITTER} consists of several {\bf branches} with varying assumptions on the
underlying hard scattering process. One includes complete ${\cal O}(\alpha)$
weak loop corrections with a resummation of leading higher-order terms.
Alternatively, an ansatz inspired from S-matrix theory, or several
model-independent effective Born cross sections may be convoluted. The program
calculates cross sections, forward-backward asymmetries, and for $\tau$~pair
production also the final-state polarization. Various {\bf interfaces} allow
fits to be performed with different sets of free parameters.
","[{""version"":""v1"",""created"":""Thu, 1 Dec 1994 09:26:35 GMT""},{""version"":""v2"",""created"":""Thu, 28 Sep 1995 16:55:23 GMT""},{""version"":""v3"",""created"":""Fri, 29 Sep 1995 10:25:51 GMT""}]","2008-02-03"
"hep-ph/9412202",,"M. A. Braun","High-colour pomerons with a running coupling constant in the
  Hartree-Fock approximation","8 pages, LaTeX, no figures","Phys.Lett. B351 (1995) 528-532","10.1016/0370-2693(95)00396-3","US-FT/20-94","hep-ph",,"  The Hartree-Fock approximation is applied to study the ""high-colour pomerons""
in the system of many reggeized gluons with a running QCD coupling constant. It
is shown that, contrary to the fixed coupling case, the high-colour pomerons
result supercritical, although with a smaller intercept than the multipomeron
states.
","[{""version"":""v1"",""created"":""Thu, 1 Dec 1994 02:58:26 GMT""}]","2009-10-28"
"hep-ph/9412203","Seong-Youl Choi","S.Y. Choi, K. Hagiwara, M. Tanabashi","CP Violation in $\tau\rightarrow 3\pi\nu_\tau$","Latex, 30 pages, 2 figures (not included). Three compressed
  postscript files of the paper available at
  ftp://ftp.kek.jp/kek/preprints/TH/TH-419/kekth419.ps.gz, Tau1.ps.gz,
  Tau2.ps.gz","Phys.Rev.D52:1614-1626,1995","10.1103/PhysRevD.52.1614","KEK-TH-419, KEK Preprint 94-158","hep-ph",,"  We consider CP violating effects in the decays $\tau\rightarrow
(3\pi)\nu_\tau$ where both the ${\rm J}^{\rm P}=1^+$ resonance, $a_1$, and
${\rm J}^{\rm P}=0^-$ resonance, $\pi^\prime$, can contribute. The interference
between the $a_1$ and $\pi^\prime$ resonances can lead to enhanced CP-violating
asymmetries whose magnitudes depend crucially on the $\pi^\prime$ decay
constant, $f_{\pi^\prime}$. We make an estimate of $f_{\pi^\prime}$ with a
simplified chiral Lagrangian coupled to a massive pseudoscalar field, and we
compare the estimates from the non-relativistic quark model and from the QCD
sum rule with the estimate from the `mock' meson model. We then estimate
quantitatively the size of CP-violating effects in a multi-Higgs-doublet model
and scalar-leptoquark models. We find that, while CP-violating effects in the
scalar-leptoquark models may require more than $10^{10}$ $\tau$ leptons,
CP-violating effects from the multi-Higgs-doublet model can be seen at the
$2\sigma$ level with about $10^7$ $\tau$ leptons using the chiral Lagrangian
estimate of $f_{\pi^\prime}=(1\sim 5)\times 10^{-3}$ GeV.
","[{""version"":""v1"",""created"":""Thu, 1 Dec 1994 11:23:16 GMT""}]","2009-09-25"
"hep-ph/9412204","Vadim Zeitlin","Vadim Zeitlin (P.N.Lebedev Physical Institute)","Low-Temperature QED with External Magnetic Field","9 pages, LaTeX",,,"FIAN/TD/94-10","hep-ph cond-mat",,"  Low-temperature expansion of the effective Lagrangian of the QED$_{3+1}$ with
a uniform magnetic field and a finite chemical potential is performed.
Temperature corrections, as well as zero-temperature expression for the
effective Lagrangian are presented as finite sums over partially filled Landau
levels.
","[{""version"":""v1"",""created"":""Thu, 1 Dec 1994 12:41:05 GMT""}]","2007-05-23"
"hep-ph/9412205",,"Francesco Murgia and Maurizio Melis","Mass corrections in $J/\psi \to B\bar B$ decay and the role of
  distribution amplitudes","26 pages + 3 figures, REVTEX 3.0, figures appended as uuencoded,
  tar-compressed postscript file","Phys.Rev. D51 (1995) 3487-3500","10.1103/PhysRevD.51.3487","INFNCA-TH-94-2","hep-ph",,"  We consider mass correction effects on the polar angular distribution of a
baryon--antibaryon pair created in the chain decay process $e^-e^+ \to J/\psi
\to B\bar B$, generalizing a previous analysis of Carimalo. We show the
relevance of the features of the baryon distribution amplitudes and estimate
the electromagnetic corrections to the QCD results.
","[{""version"":""v1"",""created"":""Thu, 1 Dec 1994 13:29:06 GMT""}]","2009-10-28"
"hep-ph/9412206",,"Guo-Hong Wu","Nonoblique Corrections in Technicolor Theories Revisited","importance of the rho parameter constraint included, version appeared
  in PRL 74 4137 (1995)","Phys.Rev.Lett. 74 (1995) 4137-4140","10.1103/PhysRevLett.74.4137","YCTP-P16-94","hep-ph",,"  In extended technicolor (ETC) theories, while the sideways ETC boson exchange
decreases the width $\Gamma_b \equiv \Gamma (Z\rightarrow b \bar{b})$, the
flavor-diagonal ETC boson exchange tends to increase it, and the ETC-corrected
$R_b \equiv \Gamma_b / \Gamma_{\mbox{\footnotesize had}}$ value could agree
with recent measurements. The $\tau$ asymmetry parameter may also increase in a
way consistent with experiment. The weak-interaction $\rho$ parameter receives
a correction from diagonal ETC exchange which is just barely acceptable by
experiments.
","[{""version"":""v1"",""created"":""Thu, 1 Dec 1994 15:24:49 GMT""},{""version"":""v2"",""created"":""Sun, 4 Dec 1994 22:31:47 GMT""},{""version"":""v3"",""created"":""Mon, 29 May 1995 22:05:42 GMT""}]","2009-10-28"
"hep-th/9411230","Jakub Rembielinski","J. Rembielinski","Tachyonic neutrinos?","8 pp., RevTeX (AmSsymb removed, due to reported troubles with
  processing)",,,"KFT UL 5/94","hep-th astro-ph gr-qc hep-ph",,"  It is shown that tachyons are associated with unitary representations of
Poincare mappings induced from SO(2) little group instead of SO(2,1) one. This
allows us to treat more seriously possibility that neutrinos are fermionic
tachyons according to the present experimental data.
","[{""version"":""v1"",""created"":""Wed, 30 Nov 1994 22:07:37 GMT""},{""version"":""v2"",""created"":""Mon, 5 Dec 1994 21:21:21 GMT""}]","2008-02-03"
"hep-th/9411231","Patrick Peter","Brandon Carter","Transonic Elastic Model for Wiggly Goto-Nambu String","8 pages, plain TeX, no figures","Phys.Rev.Lett. 74 (1995) 3098-3101","10.1103/PhysRevLett.74.3098",,"hep-th astro-ph gr-qc hep-ph",,"  The hitherto controversial proposition that a ``wiggly"" Goto-Nambu cosmic
string can be effectively represented by an elastic string model of exactly
transonic type (with energy density $U$ inversely proportional to its tension
$T$) is shown to have a firm mathematical basis.
","[{""version"":""v1"",""created"":""Wed, 30 Nov 1994 16:10:13 GMT""}]","2009-10-28"
"hep-th/9411232",,"N. Nakazawa","On Field Theories of Loops","14 pages, LaTex, final version to be published in Modern Physics
  Letters A","Mod.Phys.Lett. A10 (1995) 2175","10.1142/S0217732395002337","NBI-HE-94-54","hep-th",,"  We apply stochastic quantization method to matrix models for the second
quantization of loops in both discretized and continuum levels. The fictitious
time evolution described by the Langevin equation is interpreted as the time
evolution in a field theory of loops. The corresponding Fokker-Planck
hamiltonian defines a non-critical string field theory. We study both
orientable and non-orientable interactions of loops in terms of matrix models
and take the continuum limit for one-matrix case. As a consequence, we show the
equivalence of stochastic quantization of matrix models in loop space to the
transfer-matrix formalism in dynamical triangulation of random surfaces. We
also clarifies the origin of Virasoro algebra in this context.
","[{""version"":""v1"",""created"":""Wed, 30 Nov 1994 17:41:46 GMT""},{""version"":""v2"",""created"":""Tue, 22 Aug 1995 06:56:50 GMT""}]","2009-10-28"
"hep-th/9411233","David Gross","David J. Gross (Princeton University)","Oscar Klein and Gauge Theory","A talk delivered at the Oscar Klein Centenary Symposium, 46 pages
  plus 1 uuencoded eps figures",,,"PUPT-1508","hep-th",,"  In this talk, delivered at the Oscar Klein Centenary Symposium in Stockholm,
I review the 1938 conference held in Warsaw devoted to \lq \lq New Theories in
Physics"". I review all of the talks presented at this meeting and discuss in
detail Klein's paper where he proposed a unified model of electromagnetism and
the nuclear force that foreshadowed the later developments of non-Abelian gauge
theories.
","[{""version"":""v1"",""created"":""Wed, 30 Nov 1994 18:22:49 GMT""}]","2007-05-23"
"hep-th/9411234","Bong Lian","Bong H. Lian and Shing-Tung Yau","Arithmetic Properties of Mirror Map and Quantum Coupling","36 pp harvmac, ""b"" mode; references added","Commun.Math.Phys. 176 (1996) 163-192","10.1007/BF02099367",,"hep-th alg-geom math.AG",,"  We study some arithmetic properties of the mirror maps and the quantum Yukawa
coupling for some 1-parameter deformations of Calabi-Yau manifolds. First we
use the Schwarzian differential equation, which we derived previously, to
characterize the mirror map in each case. For algebraic K3 surfaces, we solve
the equation in terms of the $J$-function. By deriving explicit modular
relations we prove that some K3 mirror maps are algebraic over the genus zero
function field ${\bf Q}(J)$. This leads to a uniform proof that those mirror
maps have integral Fourier coefficients. Regarding the maps as Riemann
mappings, we prove that they are genus zero functions. By virtue of the
Conway-Norton conjecture (proved by Borcherds using Frenkel-Lepowsky-Meurman's
Moonshine module), we find that these maps are actually the reciprocals of the
Thompson series for certain conjugacy classes in the Griess-Fischer group. This
also gives, as an immediate consequence, a second proof that those mirror maps
are integral. We thus conjecture a surprising connection between K3 mirror maps
and the Thompson series. For threefolds, we construct a formal nonlinear ODE
for the quantum coupling reduced $mod\ p$. Under the mirror hypothesis and an
integrality assumption, we derive $mod~p$ congruences for the Fourier
coefficients. For the quintics, we deduce (at least for $5\not{|}d$) that the
degree $d$ instanton numbers $n_d$ are divisible by $5^3$ -- a fact first
conjectured by Clemens.
","[{""version"":""v1"",""created"":""Wed, 30 Nov 1994 18:27:45 GMT""},{""version"":""v2"",""created"":""Thu, 1 Dec 1994 12:46:57 GMT""},{""version"":""v3"",""created"":""Mon, 5 Dec 1994 18:01:01 GMT""}]","2009-10-28"
"hep-th/9411235","Khoudeir Adel","A. Khoudeir and N. Pantoja","Covariant Duality Symmetric Actions","9 pages, revtex, no figures; (To appear in Physical Review D)","Phys.Rev. D53 (1996) 5974-5977","10.1103/PhysRevD.53.5974","CAT/95-05","hep-th",,"  A manifestly Lorentz and diffeomorphism invariant form for the abelian gauge
field action with local duality symmetry of Schwarz and Sen is given. Some of
the underlying symmetries of the covariant action are further considered. The
Noether conserved charge under continuous local duality rotations is found. The
covariant couplings with gravity and the axidilaton field are discussed.
","[{""version"":""v1"",""created"":""Wed, 30 Nov 1994 18:40:25 GMT""},{""version"":""v2"",""created"":""Mon, 10 Apr 1995 19:19:14 GMT""},{""version"":""v3"",""created"":""Mon, 18 Mar 1996 15:22:39 GMT""}]","2009-10-28"
"hep-th/9411236","Parthasarathi Mitra","P. Mitra","Exclusion statistics and many-particle states","6 pages, revtex",,,"SISSA-191/94/EP","hep-th cond-mat",,"  The thermodynamic distribution function for exclusion statistics is derived.
Creation and annihilation operators for particles obeying such statistics are
discussed. A connection with anyons is pointed out.
","[{""version"":""v1"",""created"":""Wed, 30 Nov 1994 17:37:23 GMT""}]","2007-05-23"
"hep-th/9411237","David Lamb","D.J.Lamb, A.Z.Capri and M. Kobayashi","Discrete spectral shift in an anisotropic universe","11 pages, RevTeX, no figures","Mod.Phys.Lett. A9 (1994) 2945-2952","10.1142/S0217732394002781","Alberta Thy-52-93","hep-th gr-qc",,"  In this paper we calculate the particle creation as seen by a stationary
observer in an anisotropic universe. By using an observer and geometry
dependent time to quantise a massive scalar field we show that a discrete
energy spectrum shift occurs. The length scale associated with the geometry
provides the energy scale by which the spectrum is shifted. The $\beta(p,q)$
coefficient for the Bogolubov transformation calculated is proportional to a
series of delta functions whose argument contains $p$ and $q$ and half
multiples of the root of the curvature.
","[{""version"":""v1"",""created"":""Wed, 30 Nov 1994 18:34:34 GMT""}]","2009-10-28"
"hep-th/9411238","Fidel Schaposnik","R.E.Gamboa Saravi, G.L.Rossini and F.A.Schaposnik","The $\zeta$-function answer to parity violation in three dimensional
  gauge theories","23 pages","Int.J.Mod.Phys. A11 (1996) 2643-2660","10.1142/S0217751X96001279","La Plata, 94-09","hep-th",,"  We study parity violation in $2+1$-dimensional gauge theories coupled to
massive fermions. Using the $\zeta$-function regularization approach we
evaluate the ground state fermion current in an arbitrary gauge field
background, showing that it gets two different contributions which violate
parity invariance and induce a Chern-Simons term in the gauge-field effective
action. One is related to the well-known {\em classical} parity breaking
produced by a fermion mass term in 3 dimensions; the other one, already present
for massless fermions, is related to peculiarities of gauge invariant
regularization in odd-dimensional spaces.
","[{""version"":""v1"",""created"":""Wed, 30 Nov 1994 20:01:41 GMT""}]","2015-06-26"
