"hep-th/9411239",,"H.J. Munczek","Dynamical Chiral Symmetry Breaking, Goldstone's Theorem and the
  Consistency of the Schwinger--Dyson and Bethe--Salpeter Equations","13 pages, LaTeX, no figures","Phys.Rev.D52:4736-4740,1995","10.1103/PhysRevD.52.4736","KU-TH-94-10-1","hep-th hep-ph",,"  A proof of Goldstone's theorem is given for the case in which global chiral
symmetry is dynamically broken. The proof highlights a needed consistency
between the exact Schwinger--Dyson equation for the fermion propagator and the
exact Bethe--Salpeter equation for fermion--antifermion bound states. A
criterion, based on the Cornwall, Jackiw and Tomboulis effective action for
composite operators, is provided for maintaining the consistency when the
equations are modified by approximations. For gauge theories in which partial
conservation of the axial current (PCAC) should hold, a constraint on the
approximations to the fermion--gauge boson vertex function is discussed, and a
vertex model is given which satisfies both the PCAC constraint and the vector
Ward--Takahashi identity.
","[{""version"":""v1"",""created"":""Wed, 30 Nov 1994 20:33:00 GMT""}]","2011-07-19"
"hep-th/9411240","Harry Braden","H. W. Braden, V. M. Buchstaber","Integrable Systems with Pairwise Interactions and Functional Equations","32 pages latex2e. Some Proofs removed. New Examples",,,,"hep-th",,"  A new ansatz is presented for a Lax pair describing systems of particles on
the line interacting via (possibly nonsymmetric) pairwise forces. Particular
cases of this yield the known Lax pairs for the Calogero-Moser and Toda
systems, as well as their relativistic generalisations. The ansatz leads to a
system of functional equations. Several new functional equations are described
and the general analytic solution to some of these is given. New integrable
systems are described.
","[{""version"":""v1"",""created"":""Wed, 30 Nov 1994 20:16:20 GMT""},{""version"":""v2"",""created"":""Thu, 18 Apr 1996 07:36:32 GMT""}]","2008-02-03"
"hep-th/9411241","Yao-Zhong Zhang","Gustav W. Delius, Mark D. Gould, Jon R. Links and Yao-Zhong Zhang","Solutions of the Yang-Baxter Equation with Extra Non-Additive Parameters
  II: $U_q(gl(m|n))$}","10 pages, LaTex file (some errors in the Casimirs corrected)","J.Phys. A28 (1995) 6203-6210","10.1088/0305-4470/28/21/023","King's College London and University of Queensland preprint,
  KCL-TH-94-20, UQMATH-94-10","hep-th math.QA q-alg",,"  The type-I quantum superalgebras are known to admit non-trivial one-parameter
families of inequivalent finite dimensional irreps, even for generic $q$. We
apply the recently developed technique to construct new solutions to the
quantum Yang-Baxter equation associated with the one-parameter family of irreps
of $U_q(gl(m|n))$, thus obtaining R-matrices which depend not only on a
spectral parameter but in addition on further continuous parameters. These
extra parameters enter the Yang-Baxter equation in a similar way to the
spectral parameter but in a non-additive form.
","[{""version"":""v1"",""created"":""Thu, 1 Dec 1994 14:52:49 GMT""},{""version"":""v2"",""created"":""Wed, 4 Jan 1995 20:29:39 GMT""}]","2009-10-28"
"hep-th/9411242","Eugene Tyurin","Eugene Tyurin","On Conformal Properties of the Dualized Sigma-Models","12 pages, LaTeX 2e with fleqn.sty (removed the Stony Brook emblem
  which was causing problems)","Phys. Lett. B348 (1995) 386","10.1016/0370-2693(95)00175-K","ITP-SB-94-58","hep-th",,"  We have calculated the first-order beta-functions for a sigma-model ( with
dilaton) dualized with respect to an arbitrary Lie group that acts without
isotropy. We find that non-abelian duality preserves conformal invariance for
semi-simple groups, but in general there is an extra contribution to the
beta-function proportional to the trace of the structure constants, which
cannot be absorbed into an additional dilaton shift. Two particular examples, a
Bianchi V cosmological background and the G \otimes G WZW model, are discussed.
","[{""version"":""v1"",""created"":""Thu, 1 Dec 1994 03:36:00 GMT""},{""version"":""v2"",""created"":""Thu, 1 Dec 1994 23:37:00 GMT""}]","2009-10-28"
"hep-th/9411243","Ruibin Zhang","R. B. Zhang","Representations of Super Yangian","14 pages, plain latex, no figure",,"10.1063/1.530932",,"hep-th",,"  We present in detail the classification of the finite dimensional irreducible
representations of the super Yangian associated with the Lie superalgebra
$gl(1|1)$.
","[{""version"":""v1"",""created"":""Thu, 1 Dec 1994 06:11:43 GMT""}]","2009-10-28"
"hep-th/9412001",,"V. A. Slobodenyuk","Asymptotics of Expansion of the Evolution Operator Kernel in Powers of
  Time Interval $\Delta t$","12 pp., LaTeX","Teor. Mat. Fiz. 105 (1995) 246","10.1007/BF02070934",,"hep-th",,"  The upper bound for asymptotic behavior of the coefficients of expansion of
the evolution operator kernel in powers of the time interval $\Dt$ was
obtained. It is found that for the nonpolynomial potentials the coefficients
may increase as $n!$. But increasing may be more slow if the contributions with
opposite signs cancel each other. Particularly, it is not excluded that for
number of the potentials the expansion is convergent. For the polynomial
potentials $\Dt$-expansion is certainly asymptotic one. The coefficients
increase in this case as $\Gamma(n \frac{L-2}{L+2})$, where $L$ is the order of
the polynom. It means that the point $\Dt=0$ is singular point of the kernel.
","[{""version"":""v1"",""created"":""Thu, 1 Dec 1994 07:09:41 GMT""}]","2009-10-28"
"hep-th/9412002","Hermann Nicolai","B. Julia (ENS, Paris) and H. Nicolai (Hamburg University)","Null Killing Vector Dimensional Reduction and Galilean Geometrodynamics","LATEX, 41 pages, no figures","Nucl.Phys. B439 (1995) 291-326","10.1016/0550-3213(94)00584-2","LPTENS 94/21 and DESY 94-156","hep-th gr-qc",,"  The solutions of Einstein's equations admitting one non-null Killing vector
field are best studied with the projection formalism of Geroch. When the
Killing vector is lightlike, the projection onto the orbit space still exists
and one expects a covariant theory with degenerate contravariant metric to
appear, its geometry is presented here. Despite the complications of
indecomposable representations of the local Euclidean subgroup, one obtains an
absolute time and a canonical, Galilean and so-called Newtonian, torsionless
connection. The quasi-Maxwell field (Kaluza Klein one-form) that appears in the
dimensional reduction is a non-separable part of this affine connection, in
contrast to the reduction with a non-null Killing vector. One may define the
Kaluza Klein scalar (dilaton) together with the absolute time coordinate after
having imposed one of the equations of motion in order to prevent the emergence
of torsion. We present a detailed analysis of the dimensional reduction using
moving frames, we derive the complete equations of motion and propose an action
whose variation gives rise to all but one of them. Hidden symmetries are shown
to act on the space of solutions.
","[{""version"":""v1"",""created"":""Thu, 1 Dec 1994 13:11:14 GMT""}]","2009-10-28"
"hep-th/9412003","Roberto Emparan","R. Emparan","Remarks on the Atick-Witten behavior and strings near black hole
  horizons","12 pages, latex, no figures",,,"EHU-FT-94/10","hep-th",,"  We present arguments pointing to a behavior of the string free energy in the
presence of a black hole horizon similar to the Atick-Witten dependence on
temperature beyond the Hagedorn transition. We give some evidence based on
orbifold techniques applied to Rindler space and further support is found
within a Hamiltonian approach. However, we argue that the interpretation in
terms of a reduction of degrees of freedom is confronted by serious problems.
Finally, we point out the problems concerning heuristic red-shift arguments and
the local interpretation of thermodynamical quantities.
","[{""version"":""v1"",""created"":""Thu, 1 Dec 1994 10:01:00 GMT""}]","2016-09-06"
"hep-th/9412004","Neil Lambert","N.D. Lambert","Topological Massive Sigma Models","20 pages, Phyzzx. Revised version to appear in Nucl. Phys. B. The
  construction of the model is clarified and there are a few minor changes","Nucl.Phys. B445 (1995) 169-181","10.1016/0550-3213(95)00211-A","DAMTP R/94/55","hep-th",,"  In this paper we construct topological sigma models which include a potential
and are related to twisted massive supersymmetric sigma models. Contrary to a
previous construction these models have no central charge and do not require
the manifold to admit a Killing vector. We use the topological massive sigma
model constructed here to simplify the calculation of the observables. Lastly
it is noted that this model can be viewed as interpolating between topological
massless sigma models and topological Landau-Ginzburg models.
","[{""version"":""v1"",""created"":""Thu, 1 Dec 1994 11:57:00 GMT""},{""version"":""v2"",""created"":""Wed, 3 May 1995 22:15:00 GMT""}]","2009-10-28"
"hep-th/9412005","S. Pakuliak","P. Holod and S. Pakuliak","Dressing Technique for Intermediate Hierarchies","16 pages, LaTeX Report/no: DFTUZ/94/23","Theor.Math.Phys. 103 (1995) 668-680; Teor.Mat.Fiz. 103N3 (1995)
  422-436","10.1007/BF02065866",,"hep-th",,"  A generalized AKNS systems introduced and discussed recently in \cite{dGHM}
are considered. It was shown that the dressing technique both in matrix
pseudo-differential operators and formal series with respect to the spectral
parameter can be developed for these hierarchies.
","[{""version"":""v1"",""created"":""Thu, 1 Dec 1994 14:58:42 GMT""}]","2009-10-28"
"hep-th/9412006",,"L.Bonora, C.P.Constantinidis, C.S.Xiong","Exact Correlators of Two-Matrix Models","31 pages, Latex, revised version with an entirely new section","J.Geom.Phys. 20 (1996) 160-194","10.1016/0393-0440(95)00052-6","SISSA 189/94/EP, UTHEP-695","hep-th",,"  We compute exact solutions of two--matrix models, i.e. detailed genus by
genus expressions for the correlation functions of these theories, calculated
without any approximation. We distinguish between two types of models, the
unconstrained and the constrained ones. Unconstrained two--matrix models
represent perturbations of $c=1$ string theory, while the constrained ones
correspond to topological field theories coupled to topological gravity. Among
the latter we treat in particular detail the ones based on the KdV and on the
Boussinesq hierarchies.
","[{""version"":""v1"",""created"":""Thu, 1 Dec 1994 13:57:26 GMT""},{""version"":""v2"",""created"":""Tue, 6 Dec 1994 10:04:06 GMT""},{""version"":""v3"",""created"":""Tue, 8 Aug 1995 10:09:56 GMT""}]","2009-10-28"
"math/9411201",,"Antonio Bove and David S. Tartakoff","Propagation of Gevrey Regularity for a Class of Hypoelliptic Equations",,,,,"math.CV",,"  We prove results on the propagation of Gevrey and analytic wave front sets
for a class of $C^\infty$ hypoelliptic equations with double characteristics.
","[{""version"":""v1"",""created"":""Wed, 30 Nov 1994 22:26:01 GMT""}]","2009-09-25"
"math/9411202",,"David S. Tartakoff","Global (and Local) Analyticity for Second Order Operators Constructed
  from Rigid Vector Fields on Products of Tori",,,,,"math.CV",,"  We prove global analytic hypoellipticity on a product of tori for partial
differential operators which are constructed as rigid (variable coefficient)
quadratic polynomials in real vector fields satisfying the H\""ormander
condition and where $P$ satisfies a `maximal' estimate. We also prove an
analyticity result that is local in some variables and global in others for
operators whose prototype is
  $$ P= \left({\partial \over {\partial x_1}}\right)^2 + \left({\partial \over
{\partial x_2}}\right)^2 + \left(a(x_1,x_2){\partial \over {\partial
t}}\right)^2.$$
  (with analytic $a(x), a(0)=0,$ naturally, but not identically zero). The
results, because of the flexibility of the methods, generalize recent work of
Cordaro and Himonas in \cite{Cordaro-Himonas 1994} and Himonas in \cite{Himonas
199X} which showed that certain operators known not to be locally analytic
hypoelliptic (those of Baouendi and Goulaouic \cite{Baouendi-Goulaouic 1971},
Hanges and Himonas \cite{Hanges-Himonas 1991}, and Christ \cite{Christ 1991a})
were {\it globally} analytic hypoelliptic on products of tori.
","[{""version"":""v1"",""created"":""Wed, 30 Nov 1994 22:27:24 GMT""}]","2016-09-06"
"math/9412232","Peter W. Michor","Dmitri V. Alekseevsky, Peter W. Michor","Differential geometry of Cartan connections",,"Publ. Math. Debrecen 47 (1995), 349-375",,"ESI Preprint 39; Michor 99-08","math.DG",,"  For a more general notion of Cartan connection we define characteristic
classes, we investigate their relation to usual characteristic classes.
","[{""version"":""v1"",""created"":""Thu, 1 Dec 1994 00:00:00 GMT""}]","2009-09-25"
"nucl-th/9412001",,"Michael C. Birse","Low-energy theorem for a composite particle in mean scalar and vector
  fields","8 pages, REVTeX","Phys.Rev.C51:1083-1085,1995","10.1103/PhysRevC.51.1083","MC/TH 94/27","nucl-th",,"  For a relativistic particle moving in the presence of mean scalar and vector
fields, the energy at second order in the scalar field is shown to contain two
contributions in general. One is a momentum-dependent repulsive interaction
satisfying a low-energy theorem pointed out by Wallace, Gross and Tjon. The
other does not vanish at zero-momentum and involves a ``polarisability"" of the
particle by the scalar field. The first of these contributions is independent
of the details of the structure of the particle and the couplings of its
constituents to the external fields. The appearance of such a piece in the
central nucleon-nucleus potential thus would support the existence of strong
scalar fields in nuclei, without requiring the use of a Dirac equation for the
nucleon.
","[{""version"":""v1"",""created"":""Thu, 1 Dec 1994 12:52:49 GMT""}]","2008-11-26"
