"adap-org/9402002","George G. Szpiro","George G. Szpiro","Like Sparrows on a Clothes Line: The Self-Organization of Random Number
  Sequences","7 pages Ascii. Equations and figures are available by mail or fax
  from the author",,,,"adap-org nlin.AO",,"  We study sequences of random numbers {Z[1],Z[2],Z[3],...,Z[n]} -- which can
be considered random walks with reflecting barriers -- and define their ""types""
according to whether Z[i] > Z[i+1], (a down-movement), or Z[i] < Z[i+1]
(up-movement). This paper examines the means, xi, to which the Zi converge,
when a large number of sequences of the same type is considered. It is shown
that these means organize themselves in such a way that, between two turning
points of the sequence, they are equidistant from one another. We also show
that m steps in one direction tend to offset one step in the other direction,
as m -> infinity. Key words:random number sequence, self-organization, random
walk, reflecting barriers.
","[{""version"":""v1"",""created"":""Mon, 14 Feb 1994 17:34:52 GMT""}]","2008-02-03"
"astro-ph/9402036","Ray Carlberg","R. G. Carlberg, H. K. C. Yee, and E. Ellingson","Lensing from the Light-Traces-Mass Map of MS1224+20","8p plain Tex, uuencoded compress postscript available via anonymous
  ftp://moonray.astro.utoronto.ca/pub/1224.ps.Z.uu , problems queries to
  carlberg@hermes.astro.washington.edu",,"10.1086/174975","CNOC-2","astro-ph",,"  The MS1224+20 cluster of galaxies is a high luminosity X-ray source at
z=0.325. To compare the lensing mass to the virial mass we have completed a
uniform, high precision redshift survey over a field of $7\arcm\times9\arcm$,
obtaining 75 redshifts. The velocity dispersion of 30 cluster galaxies is $775$
\kms\ and the projected harmonic radius is 0.32 \hmpc. The virial mass is
$2.1\times 10^{14} h^{-1} \msun$. Correcting for faint cluster galaxies without
redshifts and allowing for a modest evolution in the galaxy luminosity function
gives a current epoch mass-to-light ratio $M/L_V(0)=255h \msun/\lsun$. The same
field contains a $z=0.225$ cluster with $\sigma_v\simeq 500$ \kms, and a group
at $z=0.412$ with $\sigma_v\simeq 400$ \kms. The clusters' gravitational field
induces image ellipticities that are calculated from the light-traces-mass
density distribution and compared to the observed average tangential
distortions from Fahlman \et (1994). Between 1.5 and 3 virial radii, the
observed lensing distortions are $4\pm2$ times stronger than the
light-traces-mass model and the virial M/L predict.
","[{""version"":""v1"",""created"":""Mon, 14 Feb 1994 18:17:31 GMT""}]","2009-10-22"
"chao-dyn/9402003","Toshio Tsuchiya","Toshio Tsuchiya (Department of Physics, Kyoto University, Kyoto,
  Japan), Tetsuro Konishi (Department of Physics, Nagoya University, Nagoya,
  Japan), Naoteru Gouda (Department of Earth and Space Science, Osaka
  University, Toyonaka, Japan)","Quasi-equilibria in one-dimensional self-gravitating many body systems","21pages + 7 figures (available upon request), revtex, submitted to
  Physical Review E",,"10.1103/PhysRevE.50.2607","KUNS 1237 (Kyoto Univ), OU-TAP-4 (Osaka Univ), DPNU-94-09 (Nagoya
  Univ)","chao-dyn astro-ph nlin.CD",,"  The microscopic dynamics of one-dimensional self-gravitating many-body
systems is studied. We examine two courses of the evolution which has the
isothermal and stationary water-bag distribution as initial conditions. We
investigate the evolution of the systems toward thermal equilibrium. It is
found that when the number of degrees of freedom of the system is increased,
the water-bag distribution becomes a quasi-equilibrium, and also the
stochasticity of the system reduces. This results suggest that the phase space
of the system is effectively not ergodic and the system with large degreees of
freedom approaches to the near-integrable one.
","[{""version"":""v1"",""created"":""Tue, 15 Feb 1994 08:00:47 GMT""}]","2009-10-22"
"cond-mat/9402054","Sidney Redner (617) 353-2618  fax -9393","E. Ben-Naim, P.L. Krapivsky and S. Redner","Kinetics of Clustering in Traffic Flows","18 pages, Plain TeX, 2 postscript figures","Phys. Rev. E 50, 822 (1994).","10.1103/PhysRevE.50.822",,"cond-mat",,"  We study a simple aggregation model that mimics the clustering of traffic on
a one-lane roadway. In this model, each ``car'' moves ballistically at its
initial velocity until it overtakes the preceding car or cluster. After this
encounter, the incident car assumes the velocity of the cluster which it has
just joined. The properties of the initial distribution of velocities in the
small velocity limit control the long-time properties of the aggregation
process. For an initial velocity distribution with a power-law tail at small
velocities, $\pvim$ as $v \to 0$, a simple scaling argument shows that the
average cluster size grows as $n \sim t^{\va}$ and that the average velocity
decays as $v \sim t^{-\vb}$ as $t\to \infty$. We derive an analytical solution
for the survival probability of a single car and an asymptotically exact
expression for the joint mass-velocity distribution function. We also consider
the properties of spatially heterogeneous traffic and the kinetics of traffic
clustering in the presence of an input of cars.
","[{""version"":""v1"",""created"":""Mon, 14 Feb 1994 18:31:59 GMT""}]","2009-10-22"
"cond-mat/9402055","Sergei Esipov","Sergei E. Esipov","Fluctuations of the Instantaneous Space Averages in Fragmentation with
  Kolmogorov Time Scales","24 pages PHYZZX, (5 figures upon request)",,,,"cond-mat",,"  We investigate the time behavior of the fragmentation model with Kolmogorov
time scales and space contraction resembling the random $\beta$-model of
turbulence. The space averages computed at any instant using the entire spatial
realization of the velocity field are shown to fluctuate strongly in time, and
in this sense they are not observable. The time averaging required to achieve
the steady-state distributions in the case of constant energy supply are found.
The fluctuations of the probability distribution functions (PDFs) have
intermittency properties different from those of PDFs.
","[{""version"":""v1"",""created"":""Mon, 14 Feb 1994 20:41:11 GMT""}]","2007-05-23"
"cond-mat/9402056","Marcelo Rozenberg","Marcelo J. Rozenberg, Goetz Moeller, Gabriel Kotliar","The Metal-Insulator Transition in the Hubbard Model at Zero Temperature
  II","12 pages, revtex",,"10.1142/S0217984994000571",,"cond-mat",,"  We study the metal-to-insulator transition of the Hubbard model at zero
temperatures in infinite dimensions. The coexistence of metallic and insulating
solutions for a finite range of the interaction is established. It is shown
that the metallic solution is lower in energy for any interaction in the
coexistence region and that the transition is of second order.
","[{""version"":""v1"",""created"":""Mon, 14 Feb 1994 22:09:21 GMT""}]","2015-06-25"
"cond-mat/9402057","Afshin Montakhab","Afshin Montakhab, J.M. Carlson, and Jeremy Levy","Mode-Locking Hysteresis in the Globally Coupled Model of Charge-Density
  Waves","11 pages","Phys. Rev. B 50, 11227 (1994). RAPID COMMUNICATIONS","10.1103/PhysRevB.50.11227",,"cond-mat",,"  We study the response of a recently proposed global coupling model of
charge-density waves to a joint ac+dc drive. The model is the standard
Fukuyama-Lee-Rice model with an additional global coupling term to account for
interaction with (uncondensed) quasi-particles. We find that traditional
mode-locking is accompanied by hysteresis on mode-locked steps. The
experimentally observed asymmetry in the size of hysteresis is reproduced and
explained by drawing attention to the importance of the pinning force. For
large values of global coupling, increased rigidity leads to vanishing of
subharmonic steps consistent with experiments.
","[{""version"":""v1"",""created"":""Tue, 15 Feb 1994 02:32:03 GMT""}]","2009-10-22"
"cond-mat/9402058","Emmanuel Guitter","P. Di Francesco and E. Guitter","Entropy of Folding of the Triangular Lattice","9 pages, harvmac, epsf, uuencoded, 5 figures included, Saclay
  preprint T/94018","Europhys. Lett. 26(6) (1994) 455-460","10.1209/0295-5075/26/6/010",,"cond-mat hep-th",,"  The problem of counting the different ways of folding the planar triangular
lattice is shown to be equivalent to that of counting the possible 3-colorings
of its bonds, a dual version of the 3-coloring problem of the hexagonal lattice
solved by Baxter. The folding entropy Log q per triangle is thus given by
Baxter's formula q=sqrt(3)(Gamma[1/3])^(3/2)/2pi =1.2087...
","[{""version"":""v1"",""created"":""Tue, 15 Feb 1994 04:43:00 GMT""}]","2015-06-25"
"gr-qc/9402027","Neil Cornish","N. J. Cornish, C. P. Dettmann and N. E. Frankel","Fractal basins and chaotic trajectories in multi-black hole space-times","9 pages, RevTeX, 4 figures (appended as a compressed tar file),
  UTPT-93-32, UM-P-94/18","Phys.Rev.D50:618-621,1994","10.1103/PhysRevD.50.R618",,"gr-qc",,"  We investigate the phase-space for trajectories in multi-black hole
spacetimes. We find that complete, chaotic geodesics are well described by
Lyapunov exponents, and that the attractor basin boundary scales as a fractal
in a diffeomorphism invariant manner.
","[{""version"":""v1"",""created"":""Mon, 14 Feb 1994 21:13:33 GMT""}]","2009-12-30"
"gr-qc/9402028","Jerome Martin","Jerome Martin","Hamiltonian quantization of General Relativity with the change of
  signature","32 pages, GCR-93/11/01, To appear in Phys. Rev. D","Phys.Rev.D49:5086-5095,1994","10.1103/PhysRevD.49.5086",,"gr-qc",,"  We show in this article how the usual hamiltonian formalism of General
Relativity should be modified in order to allow the inclusion of the Euclidean
classical solutions of Einstein's equations. We study the effect that the
dynamical change of signature has on the superspace and we prove that it
induces a passage of the signature of the supermetric from ($-+++++$) to
($+-----$). Next, all these features are more particularly studied on the
example of minisuperspaces. Finally, we consider the problem of quantization of
the Euclidean solutions. The consequences of different choices of boundary
conditions are examined.
","[{""version"":""v1"",""created"":""Tue, 15 Feb 1994 10:36:38 GMT""}]","2010-11-01"
"hep-ph/9402279","Mariusz Sadzikowski","H. Hogaasen and M. Sadzikowski","Isgur - Wise Functions for Confined Light Quarks in a Colour Electric
  Potential","9 pages, 1 figure (available upon request), Latex, TPJU - 4/94","Z.Phys. C64 (1994) 427-430","10.1007/BF01560103",,"hep-ph",,"  We explore the influence on the Isgur-Wise function of the colour electric
potential between heavy and light quarks in mesons. It is shown that in bag
models, its inclusion tends to restore light quark flavour symmetry relative to
the MIT bag predictions, and that relative to this model it flattens the
Isgur-Wise function. Results compare very well with observations.
","[{""version"":""v1"",""created"":""Mon, 14 Feb 1994 17:02:42 GMT""}]","2009-10-28"
"hep-ph/9402280","Ariel R. Zhitnitsky","A.Zhitnitsky","The Pion Form Factor. Where Does It Come From?","LATEX, 10 pgs. The basic, starting point of the entire approach is
  clarified. All numerical results are the same",,,,"hep-ph",,"  We discuss the nonleading, ``soft"" contribution to the pion form factor at
intermediate momentum transfer within operator product expansion approach. We
argue, that the corresponding contribution can temporarily {\bf simulate} the
leading twist behavior in the extent region of $ Q^2:~~3 GeV^2\leq Q^2\leq 35
GeV^2 $, where $Q^2 F(Q^2)\sim const.$
  Such a mechanism, if it is correct, would be an explanation of the
phenomenological success of the dimensional counting rules (which theoretically
correspond to the keeping of the asymptotically leading terms only) at
available, very modest $Q^2$. The relation with quark model calculation is also
discussed.
","[{""version"":""v1"",""created"":""Mon, 14 Feb 1994 18:58:58 GMT""},{""version"":""v2"",""created"":""Fri, 4 Mar 1994 18:43:12 GMT""},{""version"":""v3"",""created"":""Thu, 8 Sep 1994 23:07:43 GMT""}]","2009-09-25"
"hep-ph/9402281","K. Kurek","Krzysztof Kurek (Institute of Physics, Warsaw University Branch,
  Lipowa 41, 15-424 Bialystok, Poland)","Contribution of the elastic radiative tail to the deep inelastic muon
  scattering on heavy targets","19 pages e-mail: kurek@fuw.edu.pl","Z.Phys. C63 (1994) 561-568","10.1007/BF01557621",,"hep-ph",,"  Improvement of the radiative correction scheme for the deep inelastic
scattering on the heavy targets is discussed. Arguments that the contribution
of the radiative tail from the elastic peak should be calculated without use of
the Born approximation in the case of the heavy target scattering are
presented. The semianalytical approach based on the classical solution of the
old bremsstrahlung problem is shortly described. The numerical results for the
new correction factor are presented for the scattering on tin and lead.
","[{""version"":""v1"",""created"":""Mon, 14 Feb 1994 19:29:13 GMT""}]","2009-10-28"
"hep-ph/9402282",,"U.Baur (FSU), S. Errede (UIUC) and G. Landsberg (SUNY at Stony Brook)","Rapidity Correlations in $W\gamma$ Production at Hadron Colliders","33 pages, REVTEX2 file, 12 figures submitted separately as uuencoded
  tar-ed postscript files","Phys.Rev.D50:1917-1930,1994","10.1103/PhysRevD.50.1917","FSU-HEP-940214","hep-ph",,"  We study the correlation of photon and charged lepton pseudorapidities,
$\eta(\gamma)$ and $\eta(\ell)$, $\ell=e,\,\mu$, in $p\,\pbar \rightarrow
W^\pm\gamma+X\rightarrow \ell^\pm p\llap/_T\gamma+X$. In the Standard Model,
the $\Delta\eta(\gamma,\ell)= \eta(\gamma) - \eta(\ell)$ differential cross
section is found to exhibit a pronounced dip at $\Delta\eta(\gamma,\ell)
\approx \mp 0.3$ ($=0$)in $p\bar p$ ($pp$) collisions, which originates from
the radiation zero present in $q\bar q'\rightarrow W\gamma$. The sensitivity of
the $\Delta\eta(\gamma,\ell)$ distribution to higher order QCD corrections,
non-standard $WW\gamma$ couplings, the $W+$~jet ``fake'' background and the
cuts imposed is explored. At hadron supercolliders, next-to-leading order QCD
corrections are found to considerably obscure the radiation zero. The
advantages of the $\Delta\eta(\gamma,\ell)$ distribution over other quantities
which are sensitive to the radiation zero are discussed. We conclude that
photon lepton rapidity correlations at the Tevatron offer a {\it unique}
opportunity to search for the Standard Model radiation zero in hadronic
$W\gamma$ production.
","[{""version"":""v1"",""created"":""Mon, 14 Feb 1994 19:38:17 GMT""}]","2016-09-01"
"hep-ph/9402283","J. Gunion","Stanley J. Brodsky, L. Frankfurt, J. F. Gunion, A. H. Mueller, and M.
  Strikman","Diffractive Leptoproduction of Vector Mesons in QCD","32 pages, requires phyzzx.tex, figures can be obtained by sending
  preprint request to SLAC, minor clarifications and additional references
  incorporated in revised version, preprint SLAC-PUB-6412","Phys.Rev.D50:3134-3144,1994","10.1103/PhysRevD.50.3134",,"hep-ph",,"  We demonstrate that the distinctive features of the forward differential
cross section of diffractive leptoproduction of a vector meson can be
legitimately calculated in perturbative QCD in terms of the light-cone $q \bar
q$ wave function of the vector meson and the gluon distribution of the target.
In particular, we calculate the $Q^2$ and nuclear dependence of the diffractive
leptoproduction of vector mesons and estimate the cross section. The production
of longitudinally polarized vector mesons by longitudinally polarized virtual
photons is predicted to be the dominant component, yielding a cross section
behaving as $Q^{-6}$. The nuclear dependence of the diffractive cross sections,
which follows from a factorization theorem in perturbative QCD, provides
important tests of color transparency as well as constraints on the shadowing
of the gluon structure functions and the longitudinal structure functions of
nuclei.
","[{""version"":""v1"",""created"":""Mon, 14 Feb 1994 20:22:30 GMT""},{""version"":""v2"",""created"":""Thu, 28 Apr 1994 17:12:00 GMT""}]","2009-09-25"
"hep-ph/9402284","Q. Shafi","B. Ananthanarayan, K.S. Babu and Q. Shafi","Supersymmetric Models With Tan(beta) Close to Unity","13 pages in plain LaTeX, BA-94-02, 15 figures (available on request)","Nucl.Phys.B428:19-30,1994","10.1016/0550-3213(94)90189-9",,"hep-ph",,"  Within the framework of supersymmetric grand unification, estimates of the
$b$ quark mass based on the asymptotic relation $m_b \simeq m_\tau$ single out
the region with $\tan\beta$ close to unity, particularly if $m_t(m_t)
\stackrel{_<}{_\sim} 170\ GeV$. We explore the radiative breaking of the
electroweak symmetry and the associated sparticle and higgs spectroscopy in
models with $1 < \tan\beta \stackrel{_<}{_\sim} 1.6$. The lightest scalar higgs
is expected to have a mass below $100\ GeV$, while the remaining four higgs
masses exceed $300\ GeV$. The lower bounds on some of the sparticle masses are
within the range of LEP 200.
","[{""version"":""v1"",""created"":""Mon, 14 Feb 1994 21:27:41 GMT""}]","2011-05-12"
"hep-ph/9402286","Takayuki Shigetani","T. Shigetani, K. Suzuki, H. Toki","Pion Structure Function in the Nambu and Jona-Lasinio model","15 pages with 5 figures as uuencoded postscript files, TMU-NT-930301
  (plain LaTeX)","Phys.Lett.B308:383-388,1993","10.1016/0370-2693(93)91302-4",,"hep-ph",,"  The pion structure function is studied in the Nambu and Jona-Lasinio (NJL)
model. We calculate the forward scattering amplitude of a virtual photon from a
pion target in the Bjorken limit, and obtain valence quark distributions of the
pion at the low energy hadronic scale, where the NJL model is supposed to work.
The calculated distribution functions are evolved to the experimental momentum
scale using the Altarelli-Parisi equation. The resulting distributions are in a
reasonable agreement with experiment. We calculate also the kaon structure
function and compare the ratio of kaon to pion valence u-quark distributions
with experiment.
","[{""version"":""v1"",""created"":""Tue, 15 Feb 1994 07:37:09 GMT""}]","2014-11-17"
"hep-ph/9402287",,"Christian F. W\""ohler and Edward Shuryak","Two-loop Correction to the Instanton Density for the Double Well
  Potential",,"Phys.Lett. B333 (1994) 467-470","10.1016/0370-2693(94)90169-4",,"hep-ph hep-th",,"  Feynman diagrams in the instanton background are used for the calculation of
the tunneling amplitude, up to the two-loops order. Some mistakes made in the
previous works are corrected. The same method is applied to the next-order
corrections to the ground state wave function.
","[{""version"":""v1"",""created"":""Tue, 15 Feb 1994 15:38:11 GMT""}]","2016-08-14"
"hep-ph/9402288","Mannel Thomas","Thomas Mannel and Matthias Neubert","Resummation of Nonperturbative Corrections to the Lepton Spectrum in
  Inclusive $B\to X\,\ell\,\bar\nu$ Decays","22 pages, five figures appended after \end{document} as uu-encoded
  and compressed eps files, uses epsf, CERN-TH.7156/94","Phys.Rev.D50:2037-2047,1994","10.1103/PhysRevD.50.2037",,"hep-ph",,"  We apply the operator product expansion to resum the leading nonperturbative
corrections to the endpoint region of the lepton spectrum in inclusive
semileptonic $B\to X_q\,\ell\,\bar\nu$ decays, taking into account a finite
quark mass $m_q$ in the final state. We show that both for $b\to c$ and $b\to
u$ transitions, it is consistent to describe these effects by a convolution of
the parton model spectrum with a fundamental light-cone structure function. The
moments of this function are proportional to forward matrix elements of
higher-dimension operators. The prospects for an extraction of the structure
function from a measurement of the lepton spectrum are discussed.
","[{""version"":""v1"",""created"":""Tue, 15 Feb 1994 10:35:49 GMT""}]","2011-07-19"
"hep-th/9402081",,"M. Matone","Nonperturbative Model Of Liouville Gravity","11 pages, LaTex file","J.Geom.Phys. 21 (1997) 381-398","10.1016/S0393-0440(96)00028-9","DFPD/93/TH/72","hep-th alg-geom gr-qc math.AG",,"  We obtain nonperturbative results in the framework of continuous Liouville
theory. In particular, we express the specific heat ${\cal Z}$ of pure gravity
in terms of an expansion of integrals on moduli spaces of punctured Riemann
spheres. The integrands are written in terms of the Liouville action. We show
that ${\cal Z}$ satisfies the Painlev\'e I.
","[{""version"":""v1"",""created"":""Mon, 14 Feb 1994 18:00:37 GMT""}]","2016-09-06"
"hep-th/9402082",,"A.A. Tseytlin","String solutions with non-constant scalar fields","14 pages, harvmac, Imperial/TP/93-94/15",,,,"hep-th",,"  We discuss charged string solutions of the effective equations of D=4
heterotic string theory with non-constant dilaton and modulus fields. The
effective action contains a generic moduli-dependent coupling function in the
gauge field kinetic term and a non-perturbative scalar potential. This is a
review of hep-th/9307123 by M. Cvetic and the author. To be published in the
Proceedings of 27-th International Symposium on Theory of Elementary Particles,
Wendisch - Rietz, September 1993.
","[{""version"":""v1"",""created"":""Mon, 14 Feb 1994 19:47:31 GMT""}]","2007-05-23"
"hep-th/9402083","Elcio Abdalla","A. Zadra and E. Abdalla","Non-critical superstrings: a comparison between continuum and discrete
  approaches","25 pages, plain tex, prep CERN-TH-7161/94","Nucl.Phys.B432:163-186,1994","10.1016/0550-3213(94)90598-3",,"hep-th",,"  We review the relation between the matrix model and Liouville approaches to
two-dimensional gravity as elaborated by Moore, Seiberg and Staudacher. Then,
based on the supersymmetric Liouville formulation and the discrete eigenvalue
model proposed by Alvarez-Gaum\'e, Itoyama, Ma\~nes and Zadra, we extend the
previous relation to the supersymmetric case. The minisuperspace approximation
for the supersymmetric case is formulated, and the corresponding wave equation
is found.
","[{""version"":""v1"",""created"":""Tue, 15 Feb 1994 07:27:53 GMT""}]","2014-11-18"
"hep-th/9402084","Timothy Hollowood","T.J. Hollowood","The exact mass-gaps of the principal chiral models","11 pages, (macro included), CERN-TH.7164/94, SWAT/93-94/26","Phys.Lett. B329 (1994) 450-456","10.1016/0370-2693(94)91089-8",,"hep-th",,"  An exact expression for the mass-gap, the ratio of the physical particle mass
to the $\Lambda$-parameter, is found for the principal chiral sigma models
associated to all the classical Lie algebras. The calculation is based on a
comparison of the free-energy in the presence of a source coupling to a
conserved charge of the theory computed in two ways: via the thermodynamic
Bethe Ansatz from the exact scattering matrix and directly in perturbation
theory. The calculation provides a non-trivial test of the form of the exact
scattering matrix.
","[{""version"":""v1"",""created"":""Tue, 15 Feb 1994 12:58:16 GMT""}]","2009-10-28"
"hep-th/9402085",,"Alexander Vilenkin","Topological Inflation","10 pages","Phys.Rev.Lett.72:3137-3140,1994","10.1103/PhysRevLett.72.3137",,"hep-th gr-qc",,"  Inflation can occur in the cores of topological defects, where the scalar
field is forced to stay near the maximum of its potential. This topological
inflation does not require fine-tuning of the initial conditions.
","[{""version"":""v1"",""created"":""Tue, 15 Feb 1994 14:52:00 GMT""}]","2010-11-01"
"hep-th/9402086","Emili Elizalde","E. Elizalde and Yu. Kubyshin","Possible Evidences of Kaluza-Klein Particles in a Scalar Model with
  Spherical Compactification","22 pages, LaTeX file, 6 figures (available upon request), UB-ECM-PF
  94/4","J.Phys.A27:7533-7554,1994","10.1088/0305-4470/27/22/024",,"hep-th",,"  Possible experimental manifestations of the contribution of heavy
Kaluza-Klein particles, within a simple scalar model in six dimensions with
spherical compactification, are studied. The approach is based on the
assumption that the inverse radius $L^{-1}$ of the space of extra dimensions is
of the order of the scale of the supersymmetry breaking $M_{SUSY} \sim 1 \div
10$ TeV. The total cross section of the scattering of two light particles is
calculated to one loop order and the effect of the Kaluza-Klein tower is shown
to be noticeable for energies $\sqrt{s} \geq 1.4 L^{-1}$.
","[{""version"":""v1"",""created"":""Tue, 15 Feb 1994 15:48:20 GMT""}]","2010-11-01"
"math/9402213","Shelah Office","Peter Komjath, Saharon Shelah","On Taylor's problem",,"Acta Math. Hungar. 70 (1996), 217--225",,"Shelah [KoSh:346]","math.LO",,"  We describe some (countably many) classes K^{n,e} of finite graphs and prove
that if lambda^{aleph_0}= lambda then every lambda^+-chromatic graph of
cardinal lambda^+ contains, for some n, e, all members of K^{n,e} as subgraphs.
On the other hand, it is consistent for every regular infinite cardinal kappa
that there is a kappa^+-chromatic graph on kappa^+ that contains finite
subgraphs only from K^{n,e} .
","[{""version"":""v1"",""created"":""Tue, 15 Feb 1994 00:00:00 GMT""}]","2016-09-06"
"math/9402214","Shelah Office","Saharon Shelah, Lee Stanley","The combinatorics of combinatorial coding by a real",,"J. Symbolic Logic 60 (1995), 36--57",,"Shelah [ShSt:425]","math.LO",,"  We lay the combinatorial foundations for [ShSt:340] by setting up and proving
the essential properties of the coding apparatus for singular cardinals. We
also prove another result concerning the coding apparatus for inaccessible
cardinals.
","[{""version"":""v1"",""created"":""Tue, 15 Feb 1994 00:00:00 GMT""}]","2016-09-06"
