"hep-ph/9402296","Hajime Aoki","H.Aoki","Fermion Modes in Instanton-Anti-Instanton Background in
  (1+0)-dimensional Model","LaTeX, 7 pages 7 figures available on request, UT-658","Prog.Theor.Phys. 91 (1994) 171-176","10.1143/ptp/91.1.171",,"hep-ph",,"  We evaluate the eigenvalues of Dirac operator in the background of
instanton-anti-instanton configuration (I-$\bar{{\rm I}}$), in a simple
(1+0)-dimensional model, and find that quasi-zero-mode disappears for the
closely localized I-$\bar{{\rm I}}$ configurations. This result suggests that
the configurations which are dominant at high energy in the valley method are
actually non-anomalous ones and irrelevant to fermion number violation. Hence,
there seems to be no theoretical basis for expecting anomalous cross section to
become observable at energies of 10 Tev region in Weinberg-Salam theory.
","[{""version"":""v1"",""created"":""Wed, 16 Feb 1994 12:54:03 GMT""}]","2017-02-01"
"hep-ph/9402297",,"E.Kh. Akhmedov","Atmospheric Neutrinos","LaTex, 13 pages, 2 figures (not included by available upon request).
  Invited talk at the Intern. School on Cosmological Dark Matter, Valencia,
  Spain, October 4-8, 1993. Preprint FTUV/94-9, IFIC/94-6",,,,"hep-ph",,"  Recent results of atmospheric neutrino experiments are reviewed and their
possible interpretations are discussed, main emphasis being put on the neutrino
oscillation hypothesis.
","[{""version"":""v1"",""created"":""Wed, 16 Feb 1994 12:08:00 GMT""}]","2009-09-25"
"hep-ph/9402299","My Account","J. Lopez, D. Nanopoulos, A. Zichichi","Status of the superworld: from theory to experiment","90 pages, 41 figures (not included), latex. Send requests for hard
  copies to ""engsterj@cernvm.bitnet"". CERN-TH.7136/94, CTP-TAMU-80/93","Prog.Part.Nucl.Phys.33:303-395,1994","10.1016/0146-6410(94)90046-9",,"hep-ph",,"  Review to appear in Progress in Particle and Nuclear Physics. Contents:
{1}Introduction}{1} {2}High precision LEP data and convergence of couplings:
physics is not Euclidean geometry}{2} {3}Interconnections between the measured
quantities due to Unification}{7} {4}The origin of $M_{SUSY}$ and why it should
be abandoned: masses and spectra are needed}{13} {5}The new step forward:
Supergravity}{21} {6}The SU(5) Supergravity Model}{22} {7}SU(5)xU(1)
Supergravity}{32} {8}Detailed calculations for the Tevatron}{47} {9}Detailed
calculations for LEP}{48} {10}Detailed calculations for HERA}{53} {11}Detailed
calculations for Underground Labs and Underwater facilities}{55} {12}Detailed
calculations for indirect experimental detection}{65} {13}The problem of mass
and $m_t$}{73} {14}Conclusions}{77}
","[{""version"":""v1"",""created"":""Wed, 16 Feb 1994 14:53:43 GMT""}]","2010-01-11"
"hep-ph/9402309","Vladimir A. Saleev","V.A.Saleev","Intrinsic Charm In Proton and $J/\psi$ Photoproduction at High Energies","11 pages, submitted to Mod.Phys.Lett.A","Mod.Phys.Lett. A9 (1994) 1083-1092; Phys.Atom.Nucl. 58 (1995)
  450-455","10.1142/S0217732394000903",,"hep-ph",,"  Based on a perturbative theory of quantum chromodynamics and non-relativistic
quark model, associated $J/\psi$ plus open charm photoproduction on charm
quarks in a proton via partonic subprocess $\gamma c\to J/\psi c$ is discussed.
It is shown that the value and energy dependence of the cross section for such
process remarkably depends on the choice of charm distribution function in a
proton. In the region of small $z=E_J/E_{\gamma}<0.2$ the contribution of the
$\gamma c\to J/\psi c$ subprocess in the inelastic $J/\psi$ photoproduction
spectra is larger than the contribution of the photon-gluon fusion subprocess.
At the energy range of HERA collider intrinsic charm contribution in the total
inclusive $J/\psi$ photoproduction cross section may be equal to 4\% of the
dominant contribution of photon-gluon fusion mechanism.
","[{""version"":""v1"",""created"":""Wed, 16 Feb 1994 10:02:31 GMT""},{""version"":""v2"",""created"":""Tue, 24 May 1994 13:13:06 GMT""}]","2015-06-25"
"hep-th/9402087","Emili Elizalde","E. Elizalde, S.D. Odintsov, A. Romeo and Yu.I. Shil'nov","Schwinger-Dyson Equations and Chiral Symmetry Breaking in 2D Induced
  Gravity","9 pages, LaTeX file, 1 figure (appended, needs psfix), UB-ECM-PF 94/2","Mod.Phys.Lett.A10:451-456,1995","10.1142/S021773239500048X",,"hep-th",,"  The Schwinger-Dyson equations in the ladder approximation for $2D$ induced
gravity coupled to fermions on a flat background are obtained in conformal
gauge. A numerical study of these equations shows the possiblity of chiral
symmetry breaking in this theory.
","[{""version"":""v1"",""created"":""Tue, 15 Feb 1994 16:40:28 GMT""}]","2009-09-25"
"hep-th/9402088","Gerald B. Cleaver","Gerald B. Cleaver and Philip J. Rosenthal","String Cosmology and the Dimension of Spacetime","23 pages, OHSTPY-HEP-T-94-024 and CALT-68-1878. Updated references
  and figure captions. Use standard TeX. Seven figures not included. To receive
  figures please send request to gcleaver@ohstpy.bitnet","Nucl.Phys.B457:621-642,1995","10.1016/0550-3213(95)00415-7",,"hep-th",,"  The implications of string theory for understanding the dimension of
uncompactified spacetime are investigated. Using recent ideas in string
cosmology, a new model is proposed to explain why three spatial dimensions grew
large. Unlike the original work of Brandenberger and Vafa, this paradigm uses
the theory of random walks. A computer model is developed to test the
implications of this new approach. It is found that a four-dimensional
spacetime can be explained by the proper choice of initial conditions.
","[{""version"":""v1"",""created"":""Tue, 15 Feb 1994 18:02:50 GMT""},{""version"":""v2"",""created"":""Mon, 28 Feb 1994 23:55:03 GMT""}]","2010-11-01"
"hep-th/9402089","Mirjam Cvetic","Mirjam Cvetic","Extreme Domain Wall--Black Hole Complementarity in N=1SUPERGRAVITY with
  a General Dilaton Coupling","11 pages (3 figures available from
  ftp://dept.physics.upenn.edu/pub/UPR-600-T/), UPR-600-T revised to be
  compatible with the published version","Phys.Lett.B341:160-165,1994","10.1016/0370-2693(94)90305-0",,"hep-th gr-qc",,"  We study supersymmetric (extreme) domain walls in four-dimensional (4d) N=1
supergravity theories with a general dilaton coupling $\alpha > 0$. Type I
walls, which are static, planar (say, in ($x,y$) plane) configurations,
interpolate between Minkowski space-time and a vacuum with a varying dilaton
field. We classify their global space-time with respect to the value of the
coupling $\alpha$. $N=1$ supergravity with $\alpha =1$, an effective theory
from superstrings, provides a dividing line between the theories with
$\alpha>1$, where there is a naked (planar) singularity on one side of the
wall, and the theories with $\alpha<1$, where the singularity of the of the
wall is covered by the horizon. The global space-time (in $(t,z$) direction) of
the extreme walls with the coupling $\alpha$ is the same as the global
space-time (in ($t,r)$ direction) of the extreme magnetically charged black
holes with the coupling $1/\alpha$.
","[{""version"":""v1"",""created"":""Wed, 16 Feb 1994 05:13:19 GMT""},{""version"":""v2"",""created"":""Thu, 20 Oct 1994 19:32:07 GMT""}]","2009-09-25"
"hep-th/9402090","Rim Chai Ho","S. U. Park","Construction of Simple $q$-Deformed Algebras by Statistics","15pages, JUTP-94-1, hep-th/yymmnnn, LaTeX",,,,"hep-th",,"  The simple algebras of a dressed operator, which is composed of a dressing
and a residual operators, are averaged following a proper statistics of the
dressing one. In the Bose-Einstein statistics, a (fermionic) Calogero-Vasiliev
oscillator, $q$-boson (fermion), and (fermionic) $su_q(1,1)$ are obtained for
each bosonic (fermionic) residual operator. In the Fermi-Dirac statistics, new
similar algebras are derived for each residual operator. Constructions of dual
$q$-algebras, such as a dual Calogero-Vasiliev oscillator, a dual $q$-boson and
a $su_q(2)$, and prospects are discussed.
","[{""version"":""v1"",""created"":""Wed, 16 Feb 1994 09:01:26 GMT""}]","2007-05-23"
"hep-th/9402091","Krzysztof Gawedzki","Krzysztof Gawedzki","SU(2) WZW Theory at Higher Genera","44 pages, IHES/P/94/10, Latex file","Commun.Math.Phys. 169 (1995) 329-372","10.1007/BF02099476",,"hep-th",,"  We compute, by free field techniques, the scalar product of the SU(2)
Chern-Simons states on genus > 1 surfaces. The result is a finite-dimensional
integral over positions of ``screening charges'' and one complex modular
parameter. It uses an effective description of the CS states closely related to
the one worked out by Bertram. The scalar product formula allows to express the
higher genus partition functions of the WZW conformal field theory by
finite-dimensional integrals. It should provide the hermitian metric preserved
by the Knizhnik-Zamolodchikov-Bernard connection describing the variations of
the CS states under the change of the complex structure of the surface.
","[{""version"":""v1"",""created"":""Wed, 16 Feb 1994 09:21:55 GMT""}]","2009-10-28"
"hep-th/9402092","Masayuki Matsuzaki","Takanori Sugihara, Masayuki Matsuzaki, and Masanobu Yahiro","Two-dimensional SU(N) Gauge Theory on the Light Cone","34 pages, plain TeX, figures not included, available via conventional
  mail","Phys.Rev. D50 (1994) 5274-5288","10.1103/PhysRevD.50.5274",,"hep-th nucl-th",,"  Two-dimensional SU($N$) gauge theory is accurately analyzed with the
light-front Tamm-Dancoff approximation, both numerically and analytically. The
light-front Einstein-Schr\""odinger equation for mesonic mass reduces to the 't
Hooft equation in the large $N$ limit, $g^2N$ fixed, where $g$ is the coupling
constant. Hadronic masses are numerically obtained in the region of $m^2 \ll
g^2N$, where $m$ is the bare quark (q) mass. The lightest mesonic and baryonic
states are almost in valence. The second lightest mesonic state is highly
relativistic in the sense that it has a large 4-body ($ {\rm qq} \bar{\rm q}
\bar{\rm q} $) component in addition to the valence (${\rm q} \bar{\rm q}$)
one. In the strong coupling limit our results are consistent with the
prediction of the bosonization for ratios of the lightest and second lightest
mesonic masses to the lightest baryonic one. Analytic solutions to the lightest
hadronic masses are obtained, with a reasonable approximation, as
$\sqrt{2Cm}(1-1/N^2)^{1/4}$ in the mesonic case and
$\sqrt{CmN(N-1)}(1-1/N^2)^{1/4}$ in the baryonic case, where
$C=(g^2N\pi/6)^{1/2}$. The solutions well reproduce the numerical ones. The
$N$- and $m$-dependences of the hadronic masses are explicitly shown by the
analytical solutions.
","[{""version"":""v1"",""created"":""Wed, 16 Feb 1994 10:42:31 GMT""}]","2009-10-28"
"hep-th/9402093",,"J. M. F. Labastida and M. Mari\~no","The HOMFLY polynomial for torus links from Chern-Simons gauge theory","63 pages","Int.J.Mod.Phys.A10:1045-1089,1995","10.1142/S0217751X95000516","US-FT/9-93","hep-th math.QA",,"  Polynomial invariants corresponding to the fundamental representation of the
gauge group $SU(N)$ are computed for arbitrary torus knots and links in the
framework of Chern-Simons gauge theory making use of knot operators. As a
result, a formula for the HOMFLY polynomial for arbitrary torus links is
presented.
","[{""version"":""v1"",""created"":""Wed, 16 Feb 1994 05:22:13 GMT""}]","2011-07-19"
"hep-th/9402094","Uwe Gebhard Grimm","Uwe Grimm","Trigonometric R Matrices related to `Dilute' Birman--Wenzl--Murakami
  Algebra","5 pages","Lett.Math.Phys. 32 (1994) 183-188","10.1007/BF00750661","ITFA--94--02","hep-th math.QA",,"  Explicit expressions for three series of $R$ matrices which are related to a
``dilute'' generalisation of the Birman--Wenzl--Murakami are presented. Of
those, one series is equivalent to the quantum $R$ matrices of the
$D^{(2)}_{n+1}$ generalised Toda systems whereas the remaining two series
appear to be new.
","[{""version"":""v1"",""created"":""Wed, 16 Feb 1994 12:59:43 GMT""}]","2009-10-28"
"hep-th/9402095",,"A. Mikovic","Black Holes and Nonperturbative Canonical 2D Dilaton Gravity","20 pgs, Imperial-TP/93-94/16, LaTex, (Argument about the presence of
  the Hawking radiation in the semiclassical limit has been made more precise.)",,,,"hep-th gr-qc",,"  We investigate nonperturbative canonical quantization of two dimensional
dilaton gravity theories with an emphasis on the CGHS model. We use an approach
where a canonical transformation is constructed such that the constraints take
a quadratic form. The required canonical transformation is obtained by using a
method based on the B\""acklund transformation from the Liouville theory. We
quantize dilaton gravity in terms of the new variables, where it takes a form
of a bosonic string theory with background charges. Unitarity is then
established by going into a light-cone gauge. As a direct consequence, black
holes in this theory do not violate unitarity, and there is no information
loss. We argue that the information escapes during the evaporation process. We
also discuss the implications of this quantization scheme for the quantum fate
of real black holes. The main conclusion is that black holes do not have to
violate quantum mechanics.
","[{""version"":""v1"",""created"":""Wed, 16 Feb 1994 14:15:04 GMT""},{""version"":""v2"",""created"":""Thu, 17 Feb 1994 12:08:22 GMT""},{""version"":""v3"",""created"":""Wed, 11 May 1994 16:39:06 GMT""},{""version"":""v4"",""created"":""Tue, 28 Jun 1994 10:13:31 GMT""}]","2008-02-03"
"math/9402215","Tomasz Nowicki","Tomasz Nowicki, Sebastian van Strien","Polynomial maps with a Julia set of positive measure",,,,"Stony Brook IMS 1994/3","math.DS",,"  In this paper we shall show that there exists L_0 such that for each even
integer L >= L_0 there exists $c_1 \in \rz$ for which the Julia set of $z -->
z^L + c_1$ has positive Lebesgue measure. This solves an old problem.
  Editor's note: In 1997, it was shown by Xavier Buff that there was a serious
flaw in the argument, leaving a gap in the proof. Currently (1999), the
question of polynomials with a positive measure Julia sets remains open.
","[{""version"":""v1"",""created"":""Wed, 16 Feb 1994 00:00:00 GMT""}]","2009-09-25"
"nucl-th/9402021",,"David Seibert and Che Ming Ko","Hadron widths in mixed-phase matter","8 pages, latex, no figures, KSUCNR-002-94","Phys.Rev.C50:559-562,1994","10.1103/PhysRevC.50.R559",,"nucl-th hep-ph",,"  We derive classically an expression for a hadron width in a two-phase region
of hadron gas and quark-gluon plasma (QGP). The presence of QGP gives hadrons
larger widths than they would have in a pure hadron gas. We find that the
$\phi$ width observed in a central Au+Au collision at $\sqrt{s}=200$
GeV/nucleon is a few MeV greater than the width in a pure hadron gas. The part
of observed hadron widths due to QGP is approximately proportional to
$(dN/dy)^{-1/3}$.
","[{""version"":""v1"",""created"":""Tue, 15 Feb 1994 21:25:04 GMT""}]","2008-11-26"
