"hep-ph/9404351","Kyungsik Kang","Kyungsik Kang","High Energy Hadron-Hadron Scattering","21 pages, Latex, BROWN-HET-941, BROWN-TA-506 (Lectures at the 6th
  Summer School and Symposium on Nuclear Physics, 20-25 August 1993, Moojoo,
  Korea) with corrections of minor typographical errors and minor grammatical
  changes",,,,"hep-ph nucl-th",,"  The elastic hadron-hadron scattering at high energies is one of the most
fundamental subjects of all particle physics problems and yet is least
understood in spite of many advances in quantum chromodynamics (QCD) at the
conceptual level. We review here the recent theoretical and experimental status
of the subject as well as the rigorous results of the high energy hadron-hadron
scattering. Surprisingly enough, the high-energy models for the elastic and
diffractive scattering abstracted from the Regge-Pomeron field theory is still
{\it phenomenologically} successful to explain the high-energy scattering data
though no rigorous derivation out of the QCD is yet available.
","[{""version"":""v1"",""created"":""Thu, 28 Apr 1994 15:45:35 GMT""},{""version"":""v2"",""created"":""Sun, 8 May 1994 21:42:22 GMT""}]","2008-02-03"
"hep-th/9404164","Tony","R. Delbourgo and A. B. Waites","Induced Parity Violation in Odd Dimensions","10 pages, UTAS-PHYS-94-06","Austral.J.Phys.47:465-474,1994","10.1071/PH940465",,"hep-th",,"  One of the interesting features about field theories in odd dimensions is the
induction of parity violating terms and well-defined {\em finite} topological
actions via quantum loops if a fermion mass term is originally present and
conversely. Aspects of this issue are illustrated for electrodynamics in 2+1
and 4+1 dimensions. (3 uuencoded Postscript Files are appended at the end of
the TexFile.)
","[{""version"":""v1"",""created"":""Wed, 27 Apr 1994 17:20:04 GMT""}]","2015-06-26"
"hep-th/9404168","Alexander Balinsky","A. A. Balinsky","Weinstein -- Xu invariants and link group representations","10 pages",,,,"hep-th math.QA",,"  Topological interpretation of the link invariants associated with the
Weinstein--Xu classical solutions of the quantum Yang-Baxter equation are
provided.
","[{""version"":""v1"",""created"":""Wed, 27 Apr 1994 20:39:48 GMT""},{""version"":""v2"",""created"":""Tue, 21 Jun 1994 21:53:09 GMT""}]","2008-02-03"
"hep-th/9404169","Pablo Mora","Ricardo Doldan, Pablo Mora and Rodolfo Gambini","Quantum Mechanics for Totally Constrained Dynamical Systems and Evolving
  Hilbert Spaces","Significant revision, title/authors change, reflects published
  version","Int.J.Theor.Phys.35:2057-2074,1996",,"IF-FI 95/3","hep-th",,"  We analyze the quantization of dynamical systems that do not involve any
background notion of space and time. We give a set of conditions for the
introduction of an intrinsic time in quantum mechanics. We show that these
conditions are a generalization of the usual procedure of deparametrization of
relational theories with hamiltonian constraint that allow to include systems
with an evolving Hilbert Space. We apply our quantization procedure to the
parametrized free particle and to some explicit examples of dynamical system
with an evolving Hilbert space. Finally, we conclude with some considerations
concerning the quantum gravity case.
","[{""version"":""v1"",""created"":""Wed, 27 Apr 1994 23:15:29 GMT""},{""version"":""v2"",""created"":""Wed, 11 May 1994 21:28:34 GMT""},{""version"":""v3"",""created"":""Thu, 17 Aug 2000 13:31:01 GMT""}]","2011-08-19"
"hep-th/9404170","Chris Pope","R. Mohayaee, C.N. Pope, K.S. Stelle and K.W. Xu","Canonical BRST Quantisation of Worldsheet Gravities","27 pages. (Some factors of \hbar corrected)","Nucl.Phys.B433:712-736,1995","10.1016/0550-3213(94)00404-3","CTP TAMU-18/94, Imperial/TP/93-94/31","hep-th",,"  We reformulate the BRST quantisation of chiral Virasoro and $W_3$ worldsheet
gravities. Our approach follows directly the classic BRST formulation of
Yang-Mills theory in employing a derivative gauge condition instead of the
conventional conformal gauge condition, supplemented by an introduction of
momenta in order to put the ghost action back into first-order form. The
consequence of these simple changes is a considerable simplification of the
BRST formulation, the evaluation of anomalies and the expression of Wess-Zumino
consistency conditions. In particular, the transformation rules of all fields
now constitute a canonical transformation generated by the BRST operator $Q$,
and we obtain in this reformulation a new result that the anomaly in the BRST
Ward identity is obtained by application of the anomalous operator $Q^2$,
calculated using operator products, to the gauge fermion.
","[{""version"":""v1"",""created"":""Thu, 28 Apr 1994 06:07:14 GMT""},{""version"":""v2"",""created"":""Sat, 30 Apr 1994 14:09:42 GMT""}]","2009-10-07"
"hep-th/9404171","Aida","T. Aida, Y. Kitazawa, H. Kawai and M. Ninomiya","Conformal Invariance and Renormalization Group in Quantum Gravity Near
  Two Dimensions","32 pages, TIT-HEP-256, KEK-TH-395, YITP/U-94-13","Nucl.Phys.B427:158-180,1994","10.1016/0550-3213(94)90273-9",,"hep-th",,"  We study quantum gravity in $2+\epsilon$ dimensions in such a way to preserve
the volume preserving diffeomorphism invariance. In such a formulation, we
prove the following trinity: the general covariance, the conformal invariance
and the renormalization group flow to Einstein theory at long distance. We
emphasize that the consistent and macroscopic universes like our own can only
exist for matter central charge $0<c<25$. We show that the spacetime
singularity at the big bang is resolved by the renormalization effect and
universes are found to bounce back from the big crunch. Our formulation may be
viewed as a Ginzburg-Landau theory which can describe both the broken and the
unbroken phase of quantum gravity and the phase transition between them.
","[{""version"":""v1"",""created"":""Thu, 28 Apr 1994 08:57:18 GMT""}]","2011-08-17"
"hep-th/9404172",,"Michele Maggiore","Black holes as quantum membranes: path integral approach","12 pages, IFUP-TH 22/94, 2 figures available on request","Phys.Lett. B333 (1994) 39-45; Erratum-ibid. B341 (1995) 450-451","10.1016/0370-2693(94)91005-7",,"hep-th gr-qc",,"  We describe the horizon of a quantum black hole in terms of a dynamical
surface which defines the boundary of space-time as seen by external static
observers, and we define a path integral in the presence of this dynamical
boundary. Using renormalization group arguments, we find that the dynamics of
the horizon is governed by the action of the relativistic bosonic membrane.
{}From the thermodynamical properties of this bosonic membrane we derive the
entropy and the temperature of black holes, and we find agreement with the
standard results. With this formalism we can also discuss the corrections to
the Hawking temperature when the mass $M$ of the black hole approaches the
Planck mass $M_{\rm Pl}$. When $M$ becomes as low as $(10-100) M_{\rm Pl}$ a
phase transition takes place and the specific heat of the black hole becomes
positive.
","[{""version"":""v1"",""created"":""Thu, 28 Apr 1994 15:06:17 GMT""}]","2009-10-28"
"hep-th/9404174","Martin Harris","M.G. Harris and J.F. Wheater","Multiple Ising Spins Coupled to 2d Quantum Gravity","29 pages, Latex, OUTP 9407P","Nucl.Phys. B427 (1994) 111-138","10.1016/0550-3213(94)90271-2",,"hep-th",,"  We study a model in which p independent Ising spins are coupled to 2d quantum
gravity (in the form of dynamical planar phi-cubed graphs). Consideration is
given to the p tends to infinity limit in which the partition function becomes
dominated by certain graphs; we identify most of these graphs. A truncated
model is solved exactly providing information about the behaviour of the full
model in the limit of small beta. Finally, we derive a bound for the critical
value of the coupling constant, beta_c and examine the magnetization transition
in the limit p tends to zero.
","[{""version"":""v1"",""created"":""Thu, 28 Apr 1994 15:06:45 GMT""}]","2009-10-28"
"nucl-th/9404024",,"L. L. Kiang, T.-S. H. Lee, D. O. Riska","Two-body Pion Absorption on $^3He$ at Threshold","19, UHPHYDOR-94-2","Phys.Rev.C50:2703-2709,1994","10.1103/PhysRevC.50.2703",,"nucl-th",,"  It is shown that a satisfactory explanation of the ratio of the rates of the
reactions $^3He(\pi^-,nn)$ and $^3He(\pi^-,np)$ for stopped pions is obtained
once the effect of the short range two-nucleon components of the axial charge
operator for the nuclear system is taken into account. By employing realistic
models for the nucleon-nucleon interaction in the construction of these
components of the axial charge operator, the predicted ratios agree with the
empirical value to within 10-20\%.
","[{""version"":""v1"",""created"":""Thu, 28 Apr 1994 09:31:34 GMT""}]","2009-09-25"
"patt-sol/9404006","Yuji Kodama","Yuji Kodama","Normal Form, Symmetry and Infinite Dimensional Lie Algebra for System of
  Ode's","10 pages",,"10.1016/0375-9601(94)90130-9","OSUMRI94-4-xx","patt-sol nlin.PS",,"  The normal form for a system of ode's is constructed from its polynomial
symmetries of the linear part of the system, which is assumed to be
semi-simple. The symmetries are shown to have a simple structure such as
invariant function times symmetries of degree one called basic symmetries. We
also show that the set of symmetries naturally forms an infinite dimensional
Lie algebra graded by the degree of invariant polynomials. This implies that if
this algebra is non-commutative then the method of multiple scales with more
than two scaling variables fails to apply.
","[{""version"":""v1"",""created"":""Wed, 27 Apr 1994 20:54:46 GMT""}]","2009-10-28"
"patt-sol/9404007",,"B. Dey (Department of Physics, University of Poona, Ganeshkhind, Pune
  411 007, India) and C.N. Kumar (Centre for Theoretical Studies, Indian
  Institute of Science, Bangalore 560012, India)","New Sets of Kink Bearing Hamiltonians","7 Pages, Plain TeX, 2 Figures (hard copy available on request), to
  appear in Int. Journ. Mod. Phys. A",,"10.1142/S0217751X94001096","IISc-CTS-2/94","patt-sol nlin.PS",,"  Given a kink bearing Hamiltonian, Isospectral Hamiltonian approach is used in
generating new sets of Hamiltonains which also admit kink solutions. We use
Sine-Gordon model as a example and explicitly work out the new sets of
potentials and the solutions.
","[{""version"":""v1"",""created"":""Thu, 28 Apr 1994 03:18:49 GMT""}]","2009-10-28"
