"alg-geom/9411001","Takao Fujita","Takao Fujita","Towards a separation theorem of points by adjoint linear systems on
  polarized threefolds","5 pages, amstex",,,,"alg-geom math.AG",,"  Main Result:
  Let $(M,L)$ be a smooth complex polarized threefold. Then the linear system
$| K+tL|$ separates any two different points on $M$ for any $t\ge 6$, where $K$
is the canonical bundle of $M$. The argument in the proof is a variant of
Ein-Lazarsfeld method. Although it is less powerful, it is cheaper, i.e., needs
fewer pages. Unfortunately, at present, I cannot show the very ampleness
because of technical difficulties. Some related topics are also discussed. A
hard copy is available on request to the author.
","[{""version"":""v1"",""created"":""Tue, 8 Nov 1994 09:46:41 GMT""}]","2008-02-03"
"astro-ph/9411026","Heinz Andernach","H. Andernach","Extragalactic Databases: Present and Future","8 pages; compressed uuencoded PostScript; accepted for Proc. ""World
  of Galaxies - II"", Lyon Sept 5-7, 1994; Astrophysical Lett. & Comm. 1995,
  eds. G.Paturel & C.Petit",,,,"astro-ph",,"  Current extragalactic databases are reviewed, including object-oriented
databases, astronomical catalogues and compilations, as well as image archives
and object catalogues from large-scale surveys. One challenge of the future
will be to maintain the accessibility of all published information on
individual objects; the other will be the cross-identification between various
ongoing and planned large-scale surveys, some of them resulting in several
hundred million objects each. Powerful user interfaces are being developed to
tackle these tasks.
","[{""version"":""v1"",""created"":""Mon, 7 Nov 1994 17:31:18 GMT""}]","2007-05-23"
"astro-ph/9411027","Heinz Andernach","H. Andernach","How Complete is the Electronic Catalogue Archive at CDS in the
  Extragalactic Domain?","11 pages uuencoded tarred, compressed PostScript; 2 figures included;
  to appear in Bull.Inf. CDS vol. 45, 1994",,,,"astro-ph",,"  From the literature of 1987 to 1993 a representative sample was prepared of
500 papers with tabular information for >~50 supposedly extragalactic objects
each. Regardless of their scientific value, but corrected for redundancy, these
papers contain 842,000 entries. For the 374 papers with >100 entries each, the
CDS FTP-archive of catalogues contains tables for 21 % of them, increasing from
11 % for 1987 to 29 % for 1993. The coverage in terms of entries is much
higher, and half of all papers with >1500 entries are in the archive. Valuable
and/or large data sets are identified among the missing ones. Some of these can
be found in other archives, and it is argued that tabular material published in
future should be preserved more systematically in a collaborative effort
between authors, journal editors and data centres.
","[{""version"":""v1"",""created"":""Mon, 7 Nov 1994 17:51:36 GMT""}]","2007-05-23"
"astro-ph/9411028","Heinz Andernach","H.Andernach, R.J.Hanisch and F.Murtagh","Network Resources for Astronomers","53 pages; uuencoded compressed PostScript; includes one table, no
  figures; Lyon-41 (Aug'94) and ESO-1033 (Sept'94), to appear in PASP, November
  1994 issue","Publ.Astron.Soc.Pac. 106 (1994) 1190","10.1086/133497",,"astro-ph",,"  The amount of data produced by large observational facilities and space
missions has led to the archiving and on-line accessibility of much of this
data, available to the entire astronomical community. This allows a much wider
multi-frequency approach to astronomical research than previously possible.
Here we provide an overview of these services, and give a basic description of
their contents and possibilities for accessing them. Apart from services
providing observational data, many of those providing general information, e.g.
on addresses, bibliographies, software etc. are also described. The field is
rapidly growing with improved network technology, and our attempt to keep the
report as complete and up-to-date as possible will inevitably be outdated
shortly. We will endeavor to maintain an updated version of this document
on-line.
","[{""version"":""v1"",""created"":""Mon, 7 Nov 1994 18:00:24 GMT""}]","2009-10-22"
"astro-ph/9411029","Nick Kaiser","Nick Kaiser, Gordon Squires, Greg Fahlman, David Woods and Tom
  Broadhurst","Recent Developments in Weak Lensing","15 pages, latex no figs. postscript file including figs available by
  anonymous ftp at ftp://ftp.cita.utoronto/cita/nick/hx35.ps Proceedings of
  1994 Herstmonceux conference ""Wide Field Spectroscopy""",,,,"astro-ph",,"  Measurement of the gravitational distortion of images of distant galaxies is
rapidly becoming established as a powerful probe of the dark mass distribution
in clusters of galaxies. With the advent of large mosaics of CCD's these
methods should provide a composite total mass profile for galaxy haloes and
also measure the power spectrum of mass fluctuations on supercluster scales. We
describe how HST observations have been used to place the observational
measurement of the shear on a quantitative footing. By artifically stretching
and then degrading WFPC2 images to simulate ground based observing it is now
possible to directly calibrate the effect of atmospheric seeing. Similar
experiments show that one can remove the effect of artificial image anisotropy
arising in the atmosphere or telescope. There have also been important advances
in the interpretation of the shear: reconstruction techniques have been
extended to encompass the strong distortion regime of giant arcs etc., progress
has been made in removing a bias present in earlier reconstruction techniques,
and we describe new techniques for `aperture densitometry'. We present some new
results on clusters of galaxies, and discuss the intimate connections between
weak lensing and deep spectroscopy.
","[{""version"":""v1"",""created"":""Mon, 7 Nov 1994 18:18:02 GMT""}]","2007-05-23"
"astro-ph/9411031","Isaac Shlosman","D.M. Christodoulou, I. Shlosman, J.E. Tohline","A New Criterion for Bar-Forming Instability in Rapidly Rotating Gaseous
  and Stellar Systems. I. Axisymmetric Form","29 pages, postscript, compressed, uuencoded. Accepted by ApJ",,,,"astro-ph",,"  We analyze previous results on the stability of uniformly and differentially
rotating, self-gravitating, gaseous and stellar, axisymmetric systems to derive
a new stability criterion for the appearance of toroidal, m=2 Intermediate (I)
and bar modes. In the process, we demonstrate that the bar modes in stellar
systems and the m=2 I-modes in gaseous systems have many common physical
characteristics and only one substantial difference: because of the anisotropy
of the stress tensor, dynamical instability sets in at lower rotation in
stellar systems. This difference is reflected also in the new stability
criterion. The new stability parameter ""alpha"" is formulated first for
uniformly rotating systems and is based on the angular momentum content rather
than on the energy content of a system. For stability of stellar systems
""alpha"" = 0.254-0.258, while it is in the range of 0.341-0.354 for gaseous
systems. For uniform rotation, one can write ""alpha"" as a function of the total
(rotational) kinetic and gravitational energies, and of a parameter which is
characteristic of the topology/connectedness and the geometric shape of a
system. ""Alpha"" can be extended to and calculated for a variety of
differentially rotating, gaseous and stellar, axisymmetric disk and spheroidal
models whose equilibrium structures and stability characteristics are known. We
also estimate ""alpha"" for gaseous toroidal models and for stellar disk systems
embedded in an inert or responsive ""halo"". We find that the new stability
criterion holds equally well for all these previously published axisymmetric
models.
","[{""version"":""v1"",""created"":""Mon, 7 Nov 1994 21:40:57 GMT""}]","2007-09-24"
"astro-ph/9411034","Andrew Ulmer","Andrew Ulmer, Ralph A.M.J. Wijers, and Edward E. Fenimore","Constraints on the Gamma-ray Burst Luminosity Function from PVO and
  BATSE","10 pages latex + 2 uuencoded figures; APJL accepted",,"10.1086/187748","Princeton Observatory Preprint 599","astro-ph",,"  We examine the width of the gamma-ray burst luminosity function through the
distribution of GRB peak fluxes as detected by the Pioneer Venus Orbiter (PVO)
and the Burst and Transient Source Experiment (BATSE). The strength of the
analysis is greatly enhanced by using a merged catalog of peak fluxes from both
instruments with good cross-calibration of their sensitivities. The range of
peak fluxes is increased by approximately a factor of 20 relative to the BATSE
catalog. Thus, more sensitive investigations of the $\log N-\log P$
distribution are possible. We place constraints on the width of the luminosity
function of gamma-ray bursts brighter than the BATSE completeness limit by
comparing the intensity distribution in the merged catalog with those produced
by a variety of spatial density and luminosity functions. For the models
examined, $90\%$ of the {\em detectable\/} bursts have peak luminosities within
a range of 10, indicating that the peak luminosities of gamma-ray bursts span a
markedly less wide range of values than many other of their measurable
properties. We also discuss for which slopes of a power-law luminosity function
the observed width is at the upper end of the constrained range. This is
important in determining the power-law slopes for which luminosity-duration
correlations could be important.
","[{""version"":""v1"",""created"":""Tue, 8 Nov 1994 08:42:19 GMT""}]","2016-08-30"
"chao-dyn/9411004","Salman Habib","Fred Cooper, John Dawson, Salman Habib, Yuval Kluger, Dawn Meredith,
  and Harvey Shepard","Semiquantum Chaos and the Large N Expansion","30 pages, uuencoded LaTeX file (figures included)",,"10.1016/0167-2789(94)00251-K","LA-UR-94-2479","chao-dyn nlin.CD",,"  We consider the dynamical system consisting of a quantum degree of freedom
$A$ interacting with $N$ quantum oscillators described by the Lagrangian \bq L
= {1\over 2}\dot{A}^2 + \sum_{i=1}^{N} \left\{{1\over 2}\dot{x}_i^2 - {1\over
2}( m^2 + e^2 A^2)x_i^2 \right\}. \eq In the limit $N \rightarrow \infty$, with
$e^2 N$ fixed, the quantum fluctuations in $A$ are of order $1/N$. In this
limit, the $x$ oscillators behave as harmonic oscillators with a time dependent
mass determined by the solution of a semiclassical equation for the expectation
value $\VEV{A(t)}$. This system can be described, when $\VEV{x(t)}= 0$, by a
classical Hamiltonian for the variables $G(t) = \VEV{x^2(t)}$, $\dot{G}(t)$,
$A_c(t) = \VEV{A(t)}$, and $\dot{A_c}(t)$. The dynamics of this latter system
turns out to be chaotic. We propose to study the nature of this large-$N$ limit
by considering both the exact quantum system as well as by studying an
expansion in powers of $1/N$ for the equations of motion using the closed time
path formalism of quantum dynamics.
","[{""version"":""v1"",""created"":""Tue, 8 Nov 1994 09:21:56 GMT""}]","2015-06-24"
"chem-ph/9411005",,"Ulrich H.E. Hansmann and Yuko Okamoto","Comparative Study of Multicanonical and Simulated Annealing Algorithms
  in the Protein Folding Problem","to be published in Physica A, LATEX 32 pages, figures available on
  request",,"10.1016/0378-4371(94)90342-5","SC 94-20","chem-ph cond-mat hep-lat physics.chem-ph",,"  We compare a few variants of the recently proposed multicanonical method with
the well known simulated annealing for the effectiveness in search of the
energy global minimum of a biomolecular system. For this we study in detail
Met-enkephalin, one of the simplest peptides. We show that the new method not
only outperforms simulated annealing in the search of the energy groundstate
but also provides more statistical-mechanical information about the system.
","[{""version"":""v1"",""created"":""Tue, 8 Nov 1994 11:04:50 GMT""},{""version"":""v2"",""created"":""Wed, 9 Nov 1994 09:40:57 GMT""}]","2009-10-22"
"cmp-lg/9411014","Diana Peterson","Joseph Pentheroudakis and Lucy Vanderwende, Microsoft Corporation","Automatically Identifying Morphological Relations in = Machine-Readable
  Dictionaries","PostScript, 19 pages, 250kb; from Proceedings of the 9th Annual
  Conference of the UW Centre for the New OED and Text Research, 1993",,,"MSR-TR-93-06","cmp-lg cs.CL",,"  We describe an automated method for identifying classes of morphologically
related words in an on-line dictionary, and for linking individual senses in
the derived form to one or more senses in the base form by means of
morphological relation attributes. We also present an algorithm for computing a
score reflecting the system=92s certainty in these derivational links; this
computation relies on the content of semantic relations associated with each
sense, which are extracted automatically by parsing each sense definition and
subjecting the parse structure to automated semantic analysis. By processing
the entire set of headwords in the dictionary in this fashion we create a large
set of directed derivational graphs, which can then be accessed by other
components in our broad-coverage NLP system. Spurious or unlikely derivations
are not discarded, but are rather added to the dictionary and assigned a
negative score; this allows the system to handle non-standard uses of these
forms.
","[{""version"":""v1"",""created"":""Tue, 8 Nov 1994 00:39:33 GMT""},{""version"":""v2"",""created"":""Fri, 18 Nov 1994 21:01:50 GMT""}]","2008-02-03"
"cond-mat/9411030","Loic Turban","Dragi Karevski, G\'abor Pal\'agyi and Lo\""ic Turban","Local critical behaviour at aperiodic surface extended perturbation in
  the Ising quantum chain","13 pages, TeX file + 6 figures, epsf needed","J. Phys. A 28 (1995) 45-55","10.1088/0305-4470/28/1/011","LPSN-94-LT4","cond-mat hep-th",,"  The surface critical behaviour of the semi--infinite one--dimensional quantum
Ising model in a transverse field is studied in the presence of an aperiodic
surface extended modulation. The perturbed couplings are distributed according
to a generalized Fredholm sequence, leading to a marginal perturbation and
varying surface exponents. The surface magnetic exponents are calculated
exactly whereas the expression of the surface energy density exponent is
conjectured from a finite--size scaling study. The system displays surface
order at the bulk critical point, above a critical value of the modulation
amplitude. It may be considered as a discrete realization of the Hilhorst--van
Leeuwen model.
","[{""version"":""v1"",""created"":""Mon, 7 Nov 1994 16:00:48 GMT""},{""version"":""v2"",""created"":""Tue, 13 Dec 1994 16:41:57 GMT""}]","2016-08-14"
"cond-mat/9411031","Michael C. Martin","Michael C. Martin, Daniel Koller, A. Rosenberg, C. Kendziora, and L.
  Mihaly (SUNY at Stony Brook and Naval Research Laboratory)","Infrared and Raman Evidence for Dimers and Polymers in Rb1C60","Accepted for Phys. Rev. B, typeset in REVTEX v3.0 in LaTeX.
  Postscript file including figures is available at
  http://insti.physics.sunysb.edu/~mmartin/papers/poly2col2.ps File with
  figures will be e-mailed by request","Phys. Rev. B 51, 3210 (1995)","10.1103/PhysRevB.51.3210",,"cond-mat chem-ph",,"  The infrared- and Raman-active vibrational modes of C60 were measured in the
various structural states of Rb1C60. According to earlier studies, Rb1C60 has
an $fcc$ structure at temperatures above ~100C, a linear chain polymer
orthorhombic structure when slowly cooled, and an as yet undetermined structure
when very rapidly cooled (""quenched""). We show that the spectra obtained in the
polymer state are consistent with each C60 molecule having bonds to two
diametrically opposite neighbors. In the quenched state, we find evidence for
further symmetry breaking, implying a lower symmetry structure than the polymer
state. The spectroscopic data of the quenched phase are shown to be consistent
with Rb2(C60)2, a dimerization of C60.
","[{""version"":""v1"",""created"":""Mon, 7 Nov 1994 18:58:00 GMT""},{""version"":""v2"",""created"":""Mon, 7 Nov 1994 19:09:00 GMT""}]","2009-10-22"
"cond-mat/9411032","Michael C. Martin","Michael C. Martin, J. Fabian, J. Godard, P. Bernier, J.M. Lambert, and
  L. Mihaly (State Univ of New York at Stony Brook, Universite Paris-Sud Orsay,
  and Universite des Sciences et Techniques du Languedoc, Montpellier)","Vibrational Study of 13C-enriched C60 Crystals","Accepted for Phys. Rev. B, typeset in REVTEX v3.0 in LaTeX.
  Postscript file including figures is available at
  http://insti.physics.sunysb.edu/~mmartin/papers/c13twocol2.ps File with
  figures will be e-mailed by request","Phys. Rev. B 51, 2844 (1995)","10.1103/PhysRevB.51.2844","C13xtal2","cond-mat",,"  The infrared (IR) spectrum of solid C60 exhibits many weak vibrational modes.
Symmetry breaking due to 13C isotopes provides a possible route for optically
activating IR-silent vibrational modes. Experimental spectra and a
semi-empirical theory on natural abundance and 13C-enriched single crystals of
C60 are presented. By comparing the experimental results with the theoretical
results, we exclude this isotopic activation mechanism from the explanation for
weakly active fundamentals in the spectra.
","[{""version"":""v1"",""created"":""Mon, 7 Nov 1994 20:41:00 GMT""}]","2009-10-22"
"cond-mat/9411033","Jean-Bruno Erismann","N. Angelescu, S. Romano, V.A. Zagrebnov","On Long-Range Order in Low-Dimensional Lattice-Gas Models of Nematic
  Liquid Crystals","11 pages",,"10.1016/0375-9601(95)00204-G","CPT-94/P.3087","cond-mat",,"  The problem of the orientational ordering transition for lattice-gas models
of liquid crystals is discussed in the low-dimensional case $d=1,2$. For
isotropic short-range interactions, orientational long-range order at finite
temperature is excluded for any packing of molecules on the lattice $Z^d$; on
the other hand, for reflection-positive long-range isotropic interactions, we
prove existence of an orientational ordering transition for high packing ($\mu
> \mu_0$) and low temperatures ($\beta > \beta_c(\mu)$).
","[{""version"":""v1"",""created"":""Tue, 8 Nov 1994 09:09:33 GMT""}]","2009-10-22"
"dg-ga/9411003","Guofang Wei","Guofang Wei","Ricci Curvature and Betti Numbers","18pages, Latex",,,,"dg-ga math.DG",,"  We derive a uniform bound for the total betti number of a closed manifold in
terms of a Ricci curvature lower bound, a conjugate radius lower bound and a
diameter upper bound. The result is based on an angle version of Toponogov
comparison estimate for small triangles in a complete manifold with a Ricci
curvature lower bound. We also give a uniform estimate on the generators of the
fundamental group and prove a fibration theorem in this setting.
","[{""version"":""v1"",""created"":""Mon, 7 Nov 1994 20:49:39 GMT""}]","2008-02-03"
"gr-qc/9411015","J. L. Rosales","J.L. Rosales","Cosmological solution for the problem of rotation velocities in galaxies","7 pages, file 'curve.eps' is available from the author by e-mail",,,"FTUAM 94-25","gr-qc",,"  A solution for the problem of understanding observed rotation curves in
galaxies without the introduction of dark matter halos is presented. This
solution has been obtained upon considering the distribution of masses in the
expanding universe, then, having a cosmological character. A formal limiting
radius for galaxies depending on cosmological parameters is given. The
empirical conclusions derived from the theory of M. Milgrom and J. Bekenstein
arise as direct consequences of the present approach without any need of
drastically modifying newtonian dynamics.
","[{""version"":""v1"",""created"":""Mon, 7 Nov 1994 19:25:38 GMT""}]","2009-09-25"
"gr-qc/9411016","Jesus Barbero","J. Fernando Barbero","Solving the Constraints of General Relativity","8 pages, LATEX, no figures, Preprint CGPG-94/11-3","Class.Quant.Grav.12:L5-L10,1995","10.1088/0264-9381/12/2/001",,"gr-qc",,"  I show in this letter that it is possible to solve some of the constraints of
the $SO(3)$-ADM formalism for general relativity by using an approach similar
to the one introduced by Capovilla, Dell and Jacobson to solve the vector and
scalar constraints in the Ashtekar variables framework. I discuss the
advantages of using the ADM formalism and compare the result with similar
proposals for different Hamiltonian formulations of general relativity.
","[{""version"":""v1"",""created"":""Mon, 7 Nov 1994 20:58:12 GMT""}]","2017-03-24"
"gr-qc/9411017","Jorma Louko","Jorma Louko and Bernard F. Whiting","Hamiltonian thermodynamics of the Schwarzschild black hole","31 pages, REVTeX v3.0. (Minor presentational revisions; 10 added
  references.)","Phys.Rev.D51:5583-5599,1995","10.1103/PhysRevD.51.5583","UF-RAP-94-13, WISC-MILW-94-TH-24","gr-qc hep-th",,"  Kucha\v{r} has recently given a detailed analysis of the classical and
quantum geometrodynamics of the Kruskal extension of the Schwarzschild black
hole. In this paper we adapt Kucha\v{r}'s analysis to the exterior region of a
Schwarzschild black hole with a timelike boundary. The reduced Lorentzian
Hamiltonian is shown to contain two independent terms, one from the timelike
boundary and the other from the bifurcation two-sphere. After quantizing the
theory, a thermodynamical partition function is obtained by analytically
continuing the Lorentzian time evolution operator to imaginary time and taking
the trace. This partition function is in agreement with the partition function
obtained from the Euclidean path integral method; in particular, the
bifurcation two-sphere term in the Lorentzian Hamiltonian gives rise to the
black hole entropy in a way that is related to the Euclidean variational
problem. We also outline how Kucha\v{r}'s analysis of the Kruskal spacetime can
be adapted to the $\RPthree$ geon, which is a maximal extension of the
Schwarzschild black hole with $\RPthree \setminus \{p\}$ spatial topology and
just one asymptotically flat region.
","[{""version"":""v1"",""created"":""Tue, 8 Nov 1994 02:17:46 GMT""},{""version"":""v2"",""created"":""Mon, 20 Feb 1995 21:41:30 GMT""}]","2010-11-19"
"gr-qc/9411018","Shunya Mizoguchi","Shun'ya Mizoguchi","The Geroch group in the Ashtekar formulation","40 pages, revtex","Phys.Rev. D51 (1995) 6788-6802","10.1103/PhysRevD.51.6788","DESY 94-199","gr-qc hep-th",,"  We study the Geroch group in the framework of the Ashtekar formulation. In
the case of the one-Killing-vector reduction, it turns out that the third
column of the Ashtekar connection is essentially the gradient of the Ernst
potential, which implies that the both quantities are based on the ``same''
complexification. In the two-Killing-vector reduction, we demonstrate Ehlers'
and Matzner-Misner's SL(2,R) symmetries, respectively, by constructing two sets
of canonical variables that realize either of the symmetries canonically, in
terms of the Ashtekar variables. The conserved charges associated with these
symmetries are explicitly obtained. We show that the gl(2,R) loop algebra
constructed previously in the loop representation is not the Lie algebra of the
Geroch group itself. We also point out that the recent argument on the
equivalence to a chiral model is based on a gauge-choice which cannot be
achieved generically.
","[{""version"":""v1"",""created"":""Mon, 7 Nov 1994 16:08:54 GMT""}]","2009-10-22"
"gr-qc/9411019","Anzhong Wang","Anzhong Wang and Nilton O. Santos","Gravitational and Particle Radiation from Cosmic Strings","16 pages, Latex, no figures","Class.Quant.Grav.13:715-722,1996","10.1088/0264-9381/13/4/011",,"gr-qc",,"  Gravitational and massless particle radiation of straight cosmic strings with
finite thickness is studied analytically. It is found that the non-linear
interaction of the radiation fields emitted by a cosmic string with the ones of
the string always makes the spacetime singular at the symmetry axis. The
singularity is not removable and is a scalar one.
","[{""version"":""v1"",""created"":""Tue, 8 Nov 1994 12:16:53 GMT""}]","2009-07-07"
"gr-qc/9411020","Anzhong Wang","Anzhong Wang and Patricio S. Letelier","Local and global structure of a thick domain wall space-time","18 pages, Latex, one figure","Phys.Rev.D51:6612-6616,1995","10.1103/PhysRevD.51.6612",,"gr-qc",,"  The local and global properties of the Goetz thick plane domain wall
space-time are studied. It is found that when the surface energy of the wall is
greater than a critical value $\sigma_{c}$, the space-time will be closed by
intermediate singularities at a finite proper distance. A model is presented in
which these singularities will give rise to scalar ones when interacting with
null fluids. The maximum extension of the space-time of the wall whose surface
energy is less than $\sigma_{c}$ is presented. It is shown that for certain
choice of the free parameter the space-time has a black hole structure but with
plane symmetry.
","[{""version"":""v1"",""created"":""Tue, 8 Nov 1994 12:35:31 GMT""}]","2009-09-25"
