"math/9411220","Emanuel Knill","Emanuel Knill","Generalized degrees and densities for families of sets","106 pages",,,"LACES 05D-94-29","math.CO",,"  Let F be a family of subsets of {1,2,...,n}. The width-degree of an element x
in at least one member of F is the width of the family {U in F | x in U}. If F
has maximum width-degree at most k, then F is locally k-wide. Bounds on the
size of locally k-wide families of sets are established. If F is locally k-wide
and centered (every U in F has an element which does not belong to any member
of F incomparable to U), then |F| <= (k+1)(n-k/2); this bound is best possible.
Nearly exact bounds, linear in n and k, on the size of locally k-wide families
of arcs or segments are determined. If F is any locally k-wide family of sets,
then |F| is linearly bounded in n. The proof of this result involves an
analysis of the combinatorics of antichains. Let P be a poset and L a
semilattice (or an intersection-closed family of sets). The P-size of L is
|L^P|. For u in L, the P-density of u is the ratio |[u)^P|/|L^P|. The density
of u is given by the [1]-density of u. Let p be the number of filters of P. L
has the P-density property iff there is a join-irreducible a in L such that the
P-density of a is at most 1/p Which non-trivial semilattices have the P-density
property? For P=[1], it has been conjectured that the answer is: ""all"" (the
union-closed sets conjecture). Certain subdirect products of lower-semimodular
lattices and, for P=[n], of geometric lattices have the P-density property in a
strong sense. This generalizes some previously known results. A fixed lattice
has the [n]-density property if n is large enough. The density of a generator U
of a union-closed family of sets L containing the empty set is estimated. The
estimate depends only on the local properties of L at U. If L is generated by
sets of size at most two, then there is a generator U of L with estimated
density at most 1/2.
","[{""version"":""v1"",""created"":""Tue, 8 Nov 1994 00:00:00 GMT""}]","2016-09-06"
"nucl-th/9411003","Jacek Dobaczewski","J. Dobaczewski, W. Nazarewicz, and T.R. Werner","Closed shells at drip-line nuclei","19 pages, LaTeX, 8 uuencoded figures available upon request","Physica Scripta T56 (1995) 15","10.1088/0031-8949/1995/T56/002","IFT/20/94","nucl-th",,"  The shell structure of magic nuclei far from stability is discussed in terms
of the self-consistent spherical Hartree-Fock-Bogoliubov theory. In particular,
the sensitivity of the shell-gap sizes and the two-neutron separation energies
to the choice of particle-hole and particle-particle components of the
effective interaction is investigated.
","[{""version"":""v1"",""created"":""Mon, 7 Nov 1994 17:41:32 GMT""}]","2015-06-26"
"nucl-th/9411004",,"D. Makovoz and G.A. Miller","Color Transparency Assumptions","18 pages, latex, 8 figures","Phys.Rev.C51:2716-2722,1995","10.1103/PhysRevC.51.2716","DOE/ER/40427-25-N94","nucl-th",,"  An exactly solvable model is used to investigate the assumptions behind color
transparency.
","[{""version"":""v1"",""created"":""Mon, 7 Nov 1994 18:14:39 GMT""}]","2009-09-25"
"nucl-th/9411005","Herbert Muether","H. M\""uther, A. Polls and W.H. Dickhoff","Momentum and Energy Distributions of Nucleons in Finite Nuclei due to
  Short-Range Correlations","12 pages RevTeX, 7 figures postscript files appended",,"10.1103/PhysRevC.51.3040","TU 94-0811","nucl-th",,"  The influence of short-range correlations on the momentum and energy
distribution of nucleons in nuclei is evaluated assuming a realistic
meson-exchange potential for the nucleon-nucleon interaction. Using the
Green-function approach the calculations are performed directly for the finite
nucleus $^{16}$O avoiding the local density approximation and its reference to
studies of infinite nuclear matter. The nucleon-nucleon correlations induced by
the short-range and tensor components of the interaction yield an enhancement
of the momentum distribution at high momenta as compared to the Hartree-Fock
description. These high-momentum components should be observed mainly in
nucleon knockout reactions like $(e,e'p)$ leaving the final nucleus in a state
of high excitation energy. Our analysis also demonstrates that non-negligible
contributions to the momentum distribution should be found in partial waves
which are unoccupied in the simple shell-model. The treatment of correlations
beyond the Brueckner-Hartree-Fock approximation also yields an improvement for
the calculated ground-state properties.
","[{""version"":""v1"",""created"":""Tue, 8 Nov 1994 10:22:34 GMT""}]","2009-10-28"
"supr-con/9411002","Anders W. Sandvik","A.W. Sandvik and D.J. Scalapino, UC Santa Barbara","Spin Dynamics of La_2CuO_4 and the Two-Dimensional Heisenberg Model","Compressed & uuencoded Postscript file (4 pages with figures)",,"10.1103/PhysRevB.51.9403","UCSBTH-94-46","supr-con cond-mat.supr-con",,"  The spin-lattice relaxation rate $1/T_1$ and the spin echo decay rate
$1/T_{2G}$ for the 2D Heisenberg model are calculated using quantum Monte Carlo
and maximum entropy analytic continuation. The results are compared to recent
experiments on La$_2$CuO$_4$, as well as predictions based on the non-linear
$\sigma$-model.
","[{""version"":""v1"",""created"":""Tue, 8 Nov 1994 00:19:26 GMT""}]","2009-10-28"
