"astro-ph/9409036","Han Cheongho","Cheongho Han and Andrew Gould","The Mass Spectrum Of Machos From Parallax Measurements","14 pages, 8 figures, 3 tables, request hard copy of preprint to
  cheongho@payne.mps.ohio-state.edu, OSU-TA-19/94",,"10.1086/175856",,"astro-ph",,"  We demonstrate that by making satellite-based parallax measurements of Macho
events, it is possible to distinguish disk from bulge Machos and to determine
individual masses of disk Machos to an accuracy of $0.2$ in the log. This is at
least a 3-fold improvement over what can be done without parallaxes, i.e., just
from the observed time scale of the events. In addition, we show that the
physical distribution of disk Machos can be found from `reduced' velocities
determined by parallax measurements.
","[{""version"":""v1"",""created"":""Wed, 14 Sep 1994 17:31:50 GMT""}]","2009-10-22"
"astro-ph/9409037",,"Gregory D. Wirth, David C. Koo, and Richard G. Kron","HST Observations of the Distant Cluster 0016+16: Quantitative Morphology
  of Confirmed Cluster Members","11 pages, uuencoded compressed PostScript, accepted to ApJ Letters,
  LICK-32","Astrophys.J. 435 (1994) L105","10.1086/187605",,"astro-ph",,"  We present HST images of 24 confirmed members of the distant galaxy cluster
Cl0016+16 at redshift 0.55. The Balmer-strong (``E+A'') and emission- line
galaxies frequently show unusual visual morphology, implying that galaxian
interactions produce ``active'' galaxies in moderate-redshift clusters. We use
the image concentration index as a quantitative measure of morphology to show
that these unusual galaxies appear disklike, while the normal red galaxies
resemble E/S0s. Although consistent with HST observations by Dressler et al. in
Cl0939+4713 ($z=0.41$), our results differ from the Couch et al. finding that
most Balmer-strong galaxies in AC114 ($z=0.31$) resemble ellipticals. The
entire ``E+A'' sample is small, but if future studies confirm their diversity,
it will suggest that they have different origins.
","[{""version"":""v1"",""created"":""Wed, 14 Sep 1994 21:55:26 GMT""}]","2009-10-22"
"astro-ph/9409038","Max Tegmark","Max Tegmark, Benjamin Bromley","Real-space cosmic fields from redshift-space distributions: a Green
  function approach","22 pages, incl 3 figures. Stone-age postscript replaced by LATeX.
  Latest version at http://www.sns.ias.edu/~max/zspace.html (faster from the
  US), from http://www.mpa-garching.mpg.de/~max/zspace.html (faster from
  Europe) or from max@mppmu.mpg.de","Astrophys.J.453:533,1995","10.1086/176415",,"astro-ph",,"  We present a new method for reconstructing the cosmological density, peculiar
velocity and peculiar gravitational potential on large scales from redshift
data. We remove the distorting effects of line-of-sight peculiar motions by
using the linear theory of gravitational instability, in which the potential is
the solution to a linear partial differential equation first derived by Kaiser.
We solve this equation by deriving its Green function; the Green functions for
the peculiar velocity and the real-space density follow directly.
Reconstruction of the cosmic fields is thus reduced to integration over
redshift space with the appropriate Green function kernel. Our algorithm has a
single input parameter, beta=Omega^0.6/b, where b is the linear bias factor and
Omega is the cosmological density parameter. We discuss the virtues of this
method for error control, for estimating beta, and for constraining the bias
mechanism.
","[{""version"":""v1"",""created"":""Wed, 14 Sep 1994 21:57:51 GMT""},{""version"":""v2"",""created"":""Mon, 27 Nov 1995 18:30:48 GMT""},{""version"":""v3"",""created"":""Sun, 8 Sep 1996 16:41:32 GMT""}]","2009-10-07"
"astro-ph/9409039","Isaac Shlosman","D.M. Christodoulou, D. Kazanas, I. Shlosman & J.E. Tohline","Phase-Transition Theory of Instabilities.I.Second-Harmonic Instability
  and Bifurcation Points","Postscript, compressed, uuencoded. Submitted to ApJ",,"10.1086/175806",,"astro-ph",,"  A free-energy minimization approach is used to address the secular &
dynamical instabilities & the bifurcations along sequences of rotating,
self-gravitating fluid and stellar systems. Our approach stems from the
Landau-Ginzburg theory of phase transitions. We focus on the Maclaurin sequence
of oblate spheroids & on the effects of second-harmonic disturbances.
Second-order phase transitions appear on the Maclaurin sequence also at the
points of dynamical instability & of bifurcation of the Dedekind sequence.
Distinguishing characteristic of each second-order phase transition is the
(non)conservation of an integral of motion (e.g. circulation) which determines
the appearance of the transition. Circulation is not conserved in stellar
systems because the stress-tensor gradient terms that appear in the Jeans
equations of motion include viscosity-like off-diagonal terms of the same order
of magnitude as the conventional pressure gradient terms. This explains why the
Jacobi bifurcation is a point of dynamical instability in stellar systems but
only a point of secular instability in viscous fluids. The second-order phase
transitions are discussed in relation to the dynamical instability of stellar
systems, the lambda-transition of liquid He-4, the second-order phase
transition in superconductivity & the mechanism of spontaneous symmetry
breaking.
","[{""version"":""v1"",""created"":""Wed, 14 Sep 1994 23:37:49 GMT""}]","2009-10-22"
"astro-ph/9409040","Grant Gussie","G. T. Gussie","The Classification of M1-78","16 pages, Postscript",,"10.1017/S1323358000020014",,"astro-ph",,"  The published properties of M1-78 are discussed with the purpose to resolve
the object's classification as either a planetary nebula or an ultracompact HII
region. A classification as a planetary nebula is rejected primarily because of
the high luminosity of the object, but because of the chemical composition and
expansion velocity of the nebula, a novel classification is proposed instead:
that of an ultracompact HII region with a post-main sequence central star
(possibly a WN star). It must therefore follow that observable ultracompact HII
regions persist beyond the main sequence lifetimes of at least some massive
stars, and so cannot be transient phenomena that are seen only during pre-main
sequence or early main sequence evolution.
","[{""version"":""v1"",""created"":""Thu, 15 Sep 1994 02:21:10 GMT""}]","2021-10-13"
"astro-ph/9409041","Paul Steinhardt","Clifford M. Will and Paul J. Steinhardt","High frequency oscillations of Newton's constant induced by inflation","30 pages, Penn Preprint UPR-0628T, Wash. U. Preprint WUGRAV 94-10
  Four figures available by ftp (read comment at head of file)","Phys.Rev.D52:628-639,1995","10.1103/PhysRevD.52.628",,"astro-ph gr-qc",,"  We examine the possibility that an epoch of inflationary expansion induces
high-frequency oscillations of Newton's constant, $G$. The effect occurs
because inflation can shift the expectation value of a non-minimally coupled,
Brans-Dicke-like field away from the minimum of its effective potential. At
some time after inflation ends, the field begins to oscillate, resulting in
periodic variations in $G$. We find conditions for which the oscillation energy
would be sufficient to close the universe, consistent with all known
constraints from cosmology and local tests of general relativity.
","[{""version"":""v1"",""created"":""Thu, 15 Sep 1994 06:10:05 GMT""}]","2009-09-25"
"chao-dyn/9409003","Arjendu K. Pattanayak","Arjendu K. Pattanayak and William C. Schieve ( Prigogine Center, The
  University of Texas at Austin, TX 78712)","Gaussian Wavepacket Dynamics: semiquantal and semiclassical phase space
  formalism","REVTeX, 80 kb, to appear in Phys. Rev. E",,"10.1103/PhysRevE.50.3601",,"chao-dyn nlin.CD",,"  Gaussian wavepackets are a popular tool for semiclassical analyses of
classically chaotic systems. We demonstrate that they are extremely powerful in
the semiquantal analysis of such systems, too, where their dynamics can be
recast in an extended potential formulation. We develop Gaussian semiquantal
dynamics to provide a phase space formalism and construct a propagator with
desirable qualities. We qualitatively evaluate the behaviour of these
semiquantal equations, and show that they reproduce the quantal behavior better
than the standard Gaussian semiclassical dynamics. We also show that these
semiclassical equations arise as truncations to semiquantal dynamics
non-self-consistent in $\hbar$. This enables us to introduce an extended
semiclassical dynamics that retains the power of the Hamiltonian phase space
formulation. Finally, we show how to obtain approximate eigenvalues and
eigenfunctions in this formalism, and demonstrate with an example that this
works well even for a classically strongly chaotic Hamiltonian.
","[{""version"":""v1"",""created"":""Wed, 14 Sep 1994 18:40:59 GMT""}]","2009-10-22"
"cond-mat/9409060","Didier Poilblanc","Didier Poilblanc","Exact diagonalisation studies of strongly correlated 2D lattice fermions","uu-compressed file, 6 pages, figures included. Conference
  proceedings, Wuerzburg (1994)",,"10.1007/BF00752327",,"cond-mat",,"  The T=0 phase diagram of the planar t--J model with small doping is
investigated by exact diagonalisations of square clusters with up to 32 sites.
At half-filling, the single hole quasi-particule weight vanishes in the strong
correlation limit $J\rightarrow 0$ while the quasi-particle mass diverges (like
1/J). However, the spectral function shows weight distributed over a large
energy range ($\sim 7\, t$) and a pronounced structure in momentum space which
supports the composite particle picture of the hole. For $J/t>J/t|_{B,2}$ the
effective attractive force between holes leads to bound-pairs formation. The
hole-hole and hole pair-hole pair binding energies calculated on the
$\sqrt{26}\times\sqrt{26}$ cluster indicates that in the range $J/t\in
[0.16,0.45]$ a phase of separate pairs of d-wave internal symmetry is stable.
On the other hand, the d-wave pair spectral function exhibits a quasi-particle
peak down to very small J/t ratios suggesting that $J/t|_{B,2}$ could in fact
be as small as 0.05. Above $J/t|_{B,4}\sim 0.45$ the 2-holes pairs bind into
4-holes pairs. An abrupt change of the orbital symmetry of the 4-hole droplet
is also observed above $J/t\sim 2.7$. In the parameter range, $J/t|_{B,2} < J/t
< J/t|_{B,4}$, Bose condensation of the individual pairs is expected to lead to
d-wave superconductivity.
","[{""version"":""v1"",""created"":""Wed, 14 Sep 1994 16:18:58 GMT""}]","2009-10-22"
"cond-mat/9409061","Joseph Rudnick","Joseph Rudnick and Robijn Bruinsma","Shape of domains in two-dimensional systems: virtual singularities and a
  generalized Wulff construction","9 pages in REVTEX, two figures available on request",,"10.1103/PhysRevLett.74.2491",,"cond-mat",,"  This is a report on the derivation and application of a generalized version
of the Wulff construction in two dimensions. The construction is used to find
the shape of a domain containing an XY-like order parameter. In such a domain
the energy per unit length of a segment of the bounding curve depends not only
on the orientation of the segment, but also on the segment's position, and this
is why the Wulff construction must be generalized. When the domain is circular
in shape we find that the problem of finding the texture that minimizes the
bulk and boundary energies is exactly solvable in certain important cases.
Using the generalized Wulff construction and the exact textures, describable in
terms of virtual singularities, we find that, given reasonable assumptions
concerning the from of the boundary energy, the domain will necessarily develop
a cusp if it is sufficiently large. This result is in qualitative agreement
with recent experimental observations.
","[{""version"":""v1"",""created"":""Wed, 14 Sep 1994 17:43:00 GMT""}]","2009-10-22"
"cond-mat/9409062","Frank Tzschichholz","Frank Tzschichholz","Modelization of Crack Growth in Brittle, Disordered Materials","PhD-Thesis, Hamburg 1993, Germany, language: GERMAN, 122 pages, 30
  figures, 5 color figures, compressed postscript (1.9Mb)",,,,"cond-mat",,"  The thesis consists of four main chapters. In Ch.2 we discuss experimental
results concerning the scaling behavior and fractality of fracture surfaces. In
Ch.3 continuum and discrete models for fracture mechanics are reviewed and
partially extended. In Ch.4 we present numerical results for a finite size
scaling of the macroscopic fracture stress in the absence of any disorder in
the material. We discuss in Ch.5, the main chapter, the technological important
problem of hydraulic fracturing of heterogeneous solids. We have performed
intensive computer simulations on this problem and discuss the conditions under
which the resulting cracks may develop fractal patterns. We also determine the
opening volume of the crack and the elastic stress field in the bulk,
quantities that are accessible experimentally. postscript file 'ft_phd93.ps.gz'
(1.9Mb) only via ftp server 'ftp.gkss.de'.Login as 'ftp', password:
'your-email', cd /pub/doc, binary mode, get ft_phd93.ps.gz, quit, and then
decompress with 'gunzip ft_phd93.ps.gz'. The uncompressed postscript file is
around 25Mb large, but you can easily preview it with 'ghostview' for example.
Hardcopy upon request.
","[{""version"":""v1"",""created"":""Wed, 14 Sep 1994 19:42:33 GMT""}]","2007-05-23"
"cond-mat/9409063","Kusmartsev","F. V. Kusmartsev","Enhancement of Persistent Current on Multichannel Ring","14 pages (Latex,Revtex) 3 figures by request, in Technical Reports of
  ISSP , Ser. A, No.2857, August (1994)",,,,"cond-mat",,"  We study the effect of strong electron-electron interactions on the
persistent current in a multichannel ring with the aid of Bosonization and the
Bethe ansatz equation discussed by Sutherland and Tsvelik. The interaction acts
differently on a single and multichannel ring. If, in the first case, the
current is suppressed, then in the second case the current may be enhanced.
With the interaction the current is proportional to square of the number of
channels. The maximum effect corresponds to medium values of the interaction,
where $U\sim V_F$. The new phenomenon of the fractional p/q- Aharonov-Bohm
effect appears for interacting electrons on the multichannel ring.
","[{""version"":""v1"",""created"":""Thu, 15 Sep 1994 02:56:10 GMT""}]","2007-05-23"
"cond-mat/9409064","Hans Werner Diehl Phy300","H. W. Diehl and M. Shpot (U.Essen)","Surface critical behavior in fixed dimensions $d<4$: Nonanalyticity of
  critical surface enhancement and massive field theory approach","Latex with Revtex-Stylefiles, 4 pages",,"10.1103/PhysRevLett.73.3431",,"cond-mat",,"  The critical behavior of semi-infinite systems in fixed dimensions $d<4$ is
investigated theoretically. The appropriate extension of Parisi's massive field
theory approach is presented.Two-loop calculations and subsequent Pad\'e-Borel
analyses of surface critical exponents of the special and ordinary phase
transitions yield estimates in reasonable agreement with recent Monte Carlo
results. This includes the crossover exponent $\Phi (d=3)$, for which we obtain
the values $\Phi (n=1)\simeq 0.54$ and $\Phi (n=0)\simeq 0.52$, considerably
lower than the previous $\epsilon$-expansion estimates.
","[{""version"":""v1"",""created"":""Thu, 15 Sep 1994 14:07:42 GMT""}]","2009-10-22"
"gr-qc/9409031","Troy Schilling","Troy A. Schilling","Bibliography of Publications related to Classical and Quantum Gravity in
  terms of the Ashtekar Variables","18 pages, LaTeX",,,,"gr-qc",,"  This bibliography attempts to give a comprehensive overview of all the
literature related to the Ashtekar variables. The original version was compiled
by Peter H\""ubner in 1989, and it has been subsequently updated by Gabriela
Gonzalez, Bernd Br\""ugmann, and Troy Schilling. Information about additional
literature, new preprints, and especially corrections are always welcome.
","[{""version"":""v1"",""created"":""Wed, 14 Sep 1994 20:27:51 GMT""}]","2007-05-23"
"gr-qc/9409032","Rafael Ferraro","S.C.Beluardi and Rafael Ferraro","Extrinsic Time in Quantum Cosmology","14 pages (TeX manuscript). Revised and enlarged version","Phys.Rev. D52 (1995) 1963-1969","10.1103/PhysRevD.52.1963",,"gr-qc",,"  An extrinsic time is identified in most isotropic and homogeneous
cosmological models by matching them with the ideal clock - a parametrized
system whose only ""degree of freedom"" is time -. Once this matching is
established, the cosmological models are quantized in the same way as the ideal
clock. The space of solutions of the Wheeler-DeWitt equation is turned out into
a Hilbert space by inserting a time dependent operator in the inner product,
yielding a unitary theory equivalent to the phase space reduced theory.
","[{""version"":""v1"",""created"":""Wed, 14 Sep 1994 17:43:00 GMT""},{""version"":""v2"",""created"":""Wed, 26 Apr 1995 11:19:00 GMT""}]","2009-10-22"
"hep-lat/9409012",,"Maria Luigia Paciello, Silvano Petrarca, Bruno Taglienti, Anastassios
  Vladikas","Gribov Noise on the Lattice Axial Current Renormalisation Constant","17pp (including figures), LaTeX","Phys.Lett. B341 (1994) 187-194","10.1016/0370-2693(94)90309-3","Rome preprint 94/1034 - Sep 1994","hep-lat",,"  We study the influence of Gribov copies, in the Landau gauge, on the lattice
renormalisation constant of the axial current, obtained from a Ward identity on
quark state correlation functions, with the Clover action, in quenched SU(3)
gauge theory. A comparison between the gauge invariant determination of the
renorma= lization constant and the gauge dependent one is discussed. We find
that the residual gauge freedom associated to Gribov copies induces observable
effects, which, at the level of numerical accuracy of our simulation, are
included in the statistical uncertainty inherent in a Monte Carlo simulation.
Doubling the statistics suggests that the fluctuation due to the lattice Gribov
ambiguity scales down at least as fast as a pure statistical error.
","[{""version"":""v1"",""created"":""Thu, 15 Sep 1994 08:40:48 GMT""}]","2009-10-22"
"hep-ph/9409308","Klaus Kinder-Geiger","K. Geiger","Effective Field Theory Approach to Parton-Hadron Conversion in High
  Energy QCD Processes","CERN-TH. 7440/94, 34 pages, 10 figures, Latex file plus figures
  encoded with uufiles","Phys.Rev. D51 (1995) 3669-3687","10.1103/PhysRevD.51.3669",,"hep-ph",,"  A QCD based effective action is constructed to describe the dynamics of
confinement and symmetry breaking in the process of parton-hadron conversion.
The deconfined quark and gluon degrees of freedom of the perturbative QCD
vacuum are coupled to color singlet collective fields representing the
non-perturbative vacuum with broken scale and chiral symmetry. The effective
action recovers QCD with its scale and chiral symmetry properties at short
space-time distances, but yields at large distances (r > 1 fm) to the formation
of symmetry breaking gluon and quark condensates. The approach is applied to
the evolution of a fragmenting $q\bar q$ pair with its generated gluon
distribution, starting from a large hard scale $Q^2$. The modification of the
gluon distribution arising from the coupling to the non-perturbative collective
field results eventually in a complete condensation of gluons. Color flux tube
configurations of the gluons in between the $q\bar q$ pair are obtained as
solutions of the equations of motion. With reasonable parameter choice, the
associated energy per unit length (string tension) comes out $\simeq 1$ GeV/fm,
consistent with common estimates.
","[{""version"":""v1"",""created"":""Wed, 14 Sep 1994 17:47:23 GMT""}]","2009-10-28"
"hep-ph/9409313","Hnli","Hsiang-nan Li and Hoi-Lai Yu","Extraction of $V_{ub}$ from the Decay $B\to \pi l \nu$","10 pages, CCUTH-94-05, IP-ASTP-13-94","Phys.Rev.Lett.74:4388-4391,1995","10.1103/PhysRevLett.74.4388",,"hep-ph",,"  We develop the perturbative QCD formalism including Sudakov effects for
semi-leptonic $B$ meson decays. We evaluate the differential decay rate of
$B\to \pi l \nu$, and find that the perturbative calculation is reliable for
the energy fraction of the pion above 0.3. Combining predictions from the soft
pion theorems, we extract the value of the matrix element $|V_{ub}|$ which is
roughly $2.7\times 10^{-3}$.
","[{""version"":""v1"",""created"":""Thu, 15 Sep 1994 08:11:58 GMT""}]","2010-11-01"
"hep-ph/9409314","Matthias Steinhauser","A. Kwiatkowski, M. Steinhauser","${\cal O}(\alpha\as \ln m_t^2)$ Non-Universal Corrections to the Decay
  Rate $\Gamma(Z\rightarrow b\bar{b})$","10 pages, Latex [ uses epsfig.sty, 3 figures not included ] A
  complete postscript file, including figures, is available via anonymous ftp
  at ttpux2.physik.uni-karlsruhe.de (129.13.102.139) as /ttp94-14/ttp94-14.ps,
  Local preprint# TTP94-14","Phys.Lett.B344:359-364,1995","10.1016/0370-2693(94)01568-W",,"hep-ph",,"  The partial decay rate $\Gamma(Z\to b\bar{b})$ is significantly influenced by
the mass of the top quark due to electroweak radiative corrections. The leading
$\sim m_t^2$ and the next-to-leading contribution $\sim \ln m_t^2$ are known to
be numerically of similar size. In this work we calculate the QCD corrections
to the logarithmic correction using the heavy top mass expansion. The ${\cal O}
(\alpha\as \ln m_t^2)$ corrections are of the same order as the QCD corrections
to the quadratic top mass term, but of different sign.
","[{""version"":""v1"",""created"":""Wed, 14 Sep 1994 20:30:22 GMT""}]","2011-04-20"
"hep-ph/9409315",,"Christopher T. Hill and Xinmin Zhang","Z -> b\bar{b} Versus Dynamical Electroweak Symmetry Breaking involving
  the Top Quark","LaTex file, 19 pages + 2 Figs., Fermilab-Pub-94/231-T","Phys.Rev.D51:3563-3568,1995","10.1103/PhysRevD.51.3563",,"hep-ph",,"  In models of dynamical electroweak symmetry breaking which sensitively
involve the third generation, such as top quark condensation, the effects of
the new dynamics can show up experimentally in Z->b\bar{b}. We compare the
sensitivity of Z->b\bar{b} and top quark production at the Tevatron to models
of the new physics. Z->b\bar{b} is a relatively more sensitive probe to new
strongly coupled U(1) gauge bosons, while it is generally less sensitive a
probe to new physics involving color octet gauge bosons as is top quark
production itself. Nonetheless, to accomodate a significant excess in
Z->b\bar{b} requires choosing model parameters that may be ruled out within run
I(b) at the Tevatron.
","[{""version"":""v1"",""created"":""Wed, 14 Sep 1994 20:39:01 GMT""}]","2011-07-18"
"hep-ph/9409316","Sean Fleming Northwestern Univ.","E. Braaten, K. Cheung, S. Fleming, T.C. Yuan","Perturbative QCD Fragmentation Functions as a Model for Heavy-Quark
  Fragmentation","24 Pages (Figures can be obtained by request), FERMILAB-PUB-94-305-T,
  NUHEP-TH-94-16, UCD-94-28","Phys.Rev.D51:4819-4829,1995","10.1103/PhysRevD.51.4819",,"hep-ph",,"  The perturbative QCD fragmentation functions for a heavy quark to fragment
into heavy-light mesons are studied in the heavy-quark limit. The fragmentation
functions for S-wave pseudoscalar and vector mesons are calculated to
next-to-leading order in the heavy-quark mass expansion using the methods of
heavy-quark effective theory. The results agree with the $m_b\to \infty$ limit
of the perturbative QCD fragmentation functions for $\bar b$ into $B_c$ and
$B_c^*$. We discuss the application of the perturbative QCD fragmentation
functions as a model for the fragmentation of heavy quarks into heavy-light
mesons. Using this model, we predict the fraction $P_{V}$ of heavy-light mesons
that are produced in the vector meson state as functions of the longitudinal
momentum fraction $z$ and the transverse momentum relative to the jet axis. The
fraction $P_V$ is predicted to vary from about 1/2 at small $z$ to almost 3/4
near $z=1$.
","[{""version"":""v1"",""created"":""Thu, 15 Sep 1994 02:35:36 GMT""}]","2010-11-01"
"hep-ph/9409317","C. S. Kim","C.S. Kim (Yonsei Univ.) and A.D. Martin (Durham Univ.)","Determination of V_ub at the Z-boson resonance","11 pages including 3 figures (standard tex file)","Phys.Lett.B345:296-300,1995","10.1016/0370-2693(94)01594-3","DTP/94/68, YUMS 94-21, SNUTP 94-78","hep-ph",,"  We show that the observation of energetic charged leptons from semileptonic
$b$ becays at the LEP and SLC $Z$--boson factories offers a unique opportunity
to measure the quark mixing matrix element $V_{ub}$. We present various
distributions of the $b$ decay products to show that the $b \to u$ decays can
be cleanly separated from the $b \to c$ decays, with a signal of $O(100)$
events per million $Z$ bosons produced.
","[{""version"":""v1"",""created"":""Thu, 15 Sep 1994 06:57:39 GMT""}]","2010-11-01"
"hep-ph/9409318","Xing Zhi-Zhong","Zhi-zhong Xing","Isolating the Penguin-diagram Contribution to $CP$ Violation in
  $B^{0}_{d}$ vs $\bar{B}^{0}_{d}\rightarrow \pi^{+}\pi^{-}$","Latex file 11 pages; LMU-14/94 (August 1994)","Nuovo Cim.A108:1069-1078,1995","10.1007/BF02790316",,"hep-ph",,"  A reliable prediction for $CP$ violation in $B^{0}_{d}$ vs
$\bar{B}^{0}_{d}\rightarrow \pi^{+}\pi^{-}$ suffers from the penguin-diagram
induced uncertainty. With the help of SU(3) relations, we show that both the
magnitude and strong phase shift of the penguin amplitude can be approximately
determined only from the branching ratios of $B^{0}_{d}\rightarrow
\pi^{+}\pi^{-}$, $B^{0}_{d}\rightarrow K^{+}\pi^{-}$, and $B^{+}_{u}\rightarrow
K^{0}\pi^{+}$.
","[{""version"":""v1"",""created"":""Thu, 15 Sep 1994 08:21:07 GMT""}]","2010-11-01"
