"hep-ph/9409320",,"Paavo Helde, Katri Huitu, Jukka Maalampi and Martti Raidal","Vector boson pair production in e-e- collisions with polarized beams","17 pages+ 8 figures(uuencoded compressed ps-file appended), HU-SEFT R
  1994-09 (the original version of the file was unreproducable in some
  computers)","Nucl.Phys. B437 (1995) 305-318","10.1016/0550-3213(94)00590-B",,"hep-ph",,"  The $W$-boson pair production in $e^-e^-$ collisions with polarized beams is
investigated. The helicity amplitudes are derived for general couplings and the
conditions for a good high-energy behaviour of the cross-section are given. The
results are applied to the heavy vector boson production in the context of the
left-right symmetric model. The Ward identities and the equivalence theorem are
also discussed.
","[{""version"":""v1"",""created"":""Thu, 15 Sep 1994 11:00:07 GMT""},{""version"":""v2"",""created"":""Wed, 21 Sep 1994 11:24:06 GMT""}]","2009-10-28"
"hep-ph/9409321","Department of Theoretical Physics","A.V.Kuznetsov and N.V.Mikheev","Could Vector Leptoquarks be Rather Light?","(talk given at the VIII International Seminar ""Quarks-94"", Vladimir,
  Russia, May 11-18, 1994), 7 pages, LaTeX, uses world_sc.sty, Yaroslavl,
  Yaroslavl State University preprint YARU-HE-94/03",,,,"hep-ph",,"  A possible Standard Model extension of the Pati-Salam type with a lepton
number as the fourth color is reexamined. A new type of mixing in the
interaction of the $SU(4)_V$--leptoquark with quarks and leptons is shown to be
required. An additional arbitrariness of the mixing parameters could allow to
decrease noticeably the lower bound on the leptoquark mass $M_X$ originated
from the $\pi$ and $K$ decays and the $\mu e$ conversion. The only mixing
independent bound emerging from the cosmological limit on the $\pi^0
\rightarrow \nu \bar{\nu}$ decay width is $M_X > 18~TeV$.
","[{""version"":""v1"",""created"":""Thu, 15 Sep 1994 11:54:55 GMT""}]","2007-05-23"
"hep-ph/9409322","Alexander Yelkhovsky","E.A. Golosov, I.B. Khriplovich, A.I. Milstein and A.S. Yelkhovsky","Order $\alpha^4 (m/M) R_{\infty}$ corrections to hydrogen P levels","LaTeX, 11 pages, BudkerINP-94-79",,,,"hep-ph",,"  The order $\alpha^4 (m/M) R_{\infty}$ shift of hydrogen P levels is found.
The corrections are predominantly of relativistic origin. Our approach is a
straightforward extension of that developed and applied by us previously to
positronium P levels. The corrections to the Lamb shift in hydrogen constitute
numerically \delta E(2 P_{1/2})=0.55 kHz, \delta E(2 P_{3/2}) =0.44 kHz.
","[{""version"":""v1"",""created"":""Thu, 15 Sep 1994 10:18:28 GMT""}]","2007-05-23"
"hep-ph/9409323",,"Thomas R. Hemmert, Barry R. Holstein and Nimai C. Mukhopadhyay","NN,N\Delta Couplings and the Quark Model","22 pg. Latex file, figures available by request","Phys.Rev. D51 (1995) 158-167","10.1103/PhysRevD.51.158",,"hep-ph nucl-th",,"  We examine mass-corrected SU(6) symmetry predictions in the quark model
relating vector, axial-vector and strong NN and N\Delta couplings, and
demonstrate that the experimental N\Delta value is significantly higher than
predicted in each case. Nevertheless the Goldberger-Treiman relation is
satisfied in both sectors. Possible origins of the discrepancy of the quark
model predictions with experiment are discussed.
","[{""version"":""v1"",""created"":""Thu, 15 Sep 1994 15:21:07 GMT""}]","2009-10-28"
"hep-ph/9409324","Paul Frampton","Paul H. Frampton and Thomas W. Kephart","Minimal Family Unification","10 pages, IFP-701-UNC;VAND-TH-94-6","Phys.Rev.D51:1-4,1995","10.1103/PhysRevD.51.R1",,"hep-ph",,"  Absract It is proposed that there exist, within a new $SU(2)^{'}$, a gauged
discrete group $Q_6$ (the order 12 double dihedral group) acting as a family
symmetry. This nonabelian finite group can explain hierarchical features of
families, using an assignment for quarks and leptons dictated by the
requirements of anomaly cancellation and of no additional quarks.
","[{""version"":""v1"",""created"":""Thu, 15 Sep 1994 15:23:04 GMT""}]","2009-12-30"
"hep-ph/9409325",,"Barry R. Holstein","Symmetry Tests and Standard Model Backgrounds","12 pg. Latex file, contribution to International Symposium on
  Symmetry Tests in Subatomic Physics, Taipei, May, 1994, to be published","Chin.J.Phys.32:1051-1064,1994",,,"hep-ph nucl-th",,"  Symmetry tests provide an important probe for the structure of elementary
particle interactions and for the validity of the standard model. However, it
is pointed out that in the interpretation of such experiments one must keep in
mind that in many cases apparent ""violations"" of such tests are actually the
result of ordinary effects within the standard model.
","[{""version"":""v1"",""created"":""Thu, 15 Sep 1994 15:33:14 GMT""}]","2011-04-15"
"hep-th/9409082","Chi-Sing Lam","C.S. Lam","String Rearrangement of Gauge Theories","(Invited talk given at ICHEP, Glasgow, July 1994) 4 pages in LATEX
  (ichep style file appended to latex file), plus five postscript figures, also
  appended",,,,"hep-th hep-ph",,"  Feynman diagram expressions in ordinary field theories can be written in a
string-like manner. The methods and the advantages for doing so are briefly
discussed.
","[{""version"":""v1"",""created"":""Wed, 14 Sep 1994 19:49:39 GMT""}]","2009-09-25"
"hep-th/9409083","Chi-Sing Lam","Y.J. Feng and C.S. Lam","String Organization of Field Theories: Duality and Gauge Invariance","20 pages in Latex, including seven figures in postscript","Phys.Rev. D50 (1994) 7430-7439","10.1103/PhysRevD.50.7430",,"hep-th hep-ph",,"  String theories should reduce to ordinary four-dimensional field theories at
low energies. Yet the formulation of the two are so different that such a
connection, if it exists, is not immediately obvious. With the Schwinger
proper-time representation, and the spinor helicity technique, it has been
shown that field theories can indeed be written in a string-like manner, thus
resulting in simplifications in practical calculations, and providing novel
insights into gauge and gravitational theories. This paper continues the study
of string organization of field theories by focusing on the question of local
duality. It is shown that a single expression for the sum of many diagrams can
indeed be written for QED, thereby simulating the duality property in strings.
The relation between a single diagram and the dual sum is somewhat analogous to
the relation between a old- fashioned perturbation diagram and a Feynman
diagram. Dual expressions are particularly significant for gauge theories
because they are gauge invariant while expressions for single diagrams are not.
","[{""version"":""v1"",""created"":""Wed, 14 Sep 1994 19:53:02 GMT""}]","2009-10-28"
"hep-th/9409084","Heinzl Thomas","Thomas Heinzl","Light Front Quantisation of Gauge Theories in a Finite Volume","4 pages, Latex; talk presented at QCD 94, Montpellier, France, July
  7-13, and at the Fourth International Workshop on Light Cone Quantization and
  Non- Perturbative Dynamics, Polana Zgorzelisko, Poland, August 15-25, TPR
  94-24","Nucl.Phys.Proc.Suppl. 39BC (1995) 217-219","10.1016/0920-5632(95)00071-G",,"hep-th hep-ph",,"  We discuss the light-front formulation of SU(2) Yang-Mills theory on a torus.
The gauge choice we use allows for an exact and unambiguous solution of Gauss's
law.
","[{""version"":""v1"",""created"":""Thu, 15 Sep 1994 14:16:01 GMT""}]","2009-10-28"
"hep-th/9409085",,"C.M.Na\'on, M.C.von Reichenbach and M.L.Trobo","Path-Integral bosonization of a non-local interaction and its
  application to the study of 1-d many-body systems","26 pages LATEX, La Plata 94-09","Nucl.Phys. B435 (1995) 567-584","10.1016/0550-3213(94)00534-L",,"hep-th",,"  We extend the path-integral approach to bosonization to the case in which the
fermionic interaction is non-local. In particular we obtain a completely
bosonized version of a Thirring-like model with currents coupled by general
(symmetric) bilocal potentials. The model contains the Tomonaga-Luttinger model
as a special case; exploiting this fact we study the basic properties of the
1-d spinless fermionic gas: fermionic correlators, the spectrum of collective
modes, etc. Finally we discuss the generalization of our procedure to the
non-Abelian case, thus providing a new tool to be used in the study of 1-d
many-body systems with spin-flipping interactions.
","[{""version"":""v1"",""created"":""Thu, 15 Sep 1994 15:06:00 GMT""}]","2009-10-28"
"hep-th/9409091","R. Kantowski","H. T. Cho and R. Kantowski","A Measure on a Subspace of FRW Solutions and ``The Flatness Problem"" of
  Standard Cosmology","revtex 16 pages, 1 figure included","Phys.Rev. D50 (1994) 6144-6149","10.1103/PhysRevD.50.6144",,"hep-th",,"  We use the metric on the space of gravity fields given by DeWitt to construct
a unique kinematic measure on the space of FRW simple fluids and show that when
the mass parameter $\Omega$ is used as a coordinate this measure is singular at
$\Omega = 1$. This singularity, combined with the time evolution of $\Omega$,
distorts distributions of $\Omega$ values to be concentrated in the
neighborhood of 1 at early times. It is a distorted distribution of $\Omega$
values that sometimes misleads the casual observer to conclude that $\Omega$
must be exactly equal to 1.
","[{""version"":""v1"",""created"":""Thu, 15 Sep 1994 15:30:33 GMT""}]","2009-10-28"
"nucl-th/9409013",,"Gerald A. Miller and Willem T.H. van Oers","Charge Independence and Charge Symmetry","41 pages, report # DOE/ER/40427-17-N94, Chapter for a book titled
  ""Symmetries and Fundamental Interactions in Nuclei"" eds. E.M. Henley and W.
  Haxton, to be published by World Scientific",,"10.1142/9789812831446_0005",,"nucl-th",,"  Charge independence and charge symmetry are approximate symmetries of nature,
violated by the perturbing effects of the mass difference between up and down
quarks and by electromagnetic interactions. The observations of the symmetry
breaking effects in nuclear and particle physics and the implications of those
effects are reviewed.
","[{""version"":""v1"",""created"":""Wed, 14 Sep 1994 20:19:41 GMT""}]","2016-11-03"
"nucl-th/9409014","Sabine Jeschonnek","A. Bianconi, S. Jeschonnek, N.N.Nikolaev, B.G.Zakharov","Final state interaction effects in $D(e,e'p)$ scattering","LATEX, 11 pages, 5 figures available from the authors on request,
  KFA-IKP(TH)-1994-34","Phys.Lett. B343 (1995) 13-18","10.1016/0370-2693(94)01436-G",,"nucl-th",,"  We present a systematic study of the final-state interaction (FSI) effects in
$D(e,e'p)$ scattering in the CEBAF energy range with particular emphasis on the
phenomenon of the angular anisotropy of the missing momentum distribution. We
find that FSI effects dominate at missing momentum $p_m \gsim 1.5 $fm$^{-1}$.
FSI effects in the excitation of the $S$-wave state are much stronger than in
the excitation of the $D$-wave.
","[{""version"":""v1"",""created"":""Thu, 15 Sep 1994 14:32:25 GMT""}]","2009-10-28"
