"hep-ph/9409402",,"Eric D'Hoker and Steven Weinberg","General Effective Actions","15 pages, UCLA/94/TEP/25 and UTTG-12-94","Phys.Rev. D50 (1994) 6050-6053","10.1103/PhysRevD.50.R6050",,"hep-ph hep-th",,"  We investigate the structure of the most general actions with symmetry group
$G$, spontaneously broken down to a subgroup $H$. We show that the only
possible terms in the Lagrangian density that, although not $G$-invariant,
yield $G$-invariant terms in the action, are in one to one correspondence with
the generators of the fifth cohomology classes. For the special case of
$G=SU(N)_L \times SU(N)_R$ broken down to the diagonal subgroup $H=SU(N)_V$,
there is just one such term for $N\geq 3$, which for $N=3$ is the original
Wess-Zumino-Witten term.
","[{""version"":""v1"",""created"":""Fri, 23 Sep 1994 15:20:46 GMT""}]","2009-10-28"
"hep-th/9409133","Edwin Lombridas","Kurt Haller and Edwin Lim-Lombridas (University of Connecticut)","Maxwell-Chern-Simons Theory in Covariant and Coulomb Gauges","UCONN-94-6, REVTeX, 39 pages","Annals Phys. 246 (1996) 1-48; Erratum-ibid. 257 (1997) 205-206","10.1006/aphy.1996.0019",,"hep-th",,"  We quantize Quantum Electrodynamics in $2+1$ dimensions coupled to a
Chern-Simons (CS) term and a charged spinor field, in covariant gauges and in
the Coulomb gauge. The resulting Maxwell-Chern-Simons (MCS) theory describes
charged fermions interacting with each other and with topologically massive
propagating photons. We impose Gauss's law and the gauge conditions and
investigate their effect on the dynamics and on the statistics of $n$-particle
states. We construct charged spinor states that obey Gauss's law and the gauge
conditions, and transform the theory to representations in which these states
constitute a Fock space. We demonstrate that, in these representations, the
nonlocal interactions between charges and between charges and transverse
currents, as well as the interactions between currents and massive propagating
photons, are identical in the different gauges we analyze in this and in
earlier work. We construct the generators of the Poincar\'e group, show that
they implement the Poincar\'e algebra, and explicitly demonstrate the effect of
rotations and Lorentz boosts on the particle states. We show that the
imposition of Gauss's law does not produce any ``exotic'' fractional
statistics. In the case of the covariant gauges, this demonstration makes use
of unitary transformations that provide charged particles with the gauge fields
required by Gauss's law, but that leave the anticommutator algebra of the
spinor fields untransformed. In the Coulomb gauge, we show that the
anticommutators of the spinor fields apply to the Dirac-Bergmann constraint
surfaces, on which Gauss's law and the gauge conditions obtain. We examine MCS
theory in the large CS coupling constant limit, and compare that limiting form
with CS theory, in which the Maxwell kinetic energy term is not included in the
","[{""version"":""v1"",""created"":""Thu, 22 Sep 1994 20:31:27 GMT""}]","2015-06-26"
"hep-th/9409134","D. V. Ahluwalia, Lanl","D. V. Ahluwalia (LAMPF, Los Alamos National Laboratory)","Theory of Neutral Particles: Mclennan-Case Construct for Neutrino, Its
  Generalization, and a New Wave Equation","Revised and re-written version to appear in Int. J. Mod. Phys. A. At
  present violations of various symmetries, such as C, P, and T, are assumed to
  arise from interactions. It is argued that the violation is more fundamental
  than that and is to be found at basic level of the representations of the
  Lorentz group. Revtex 3.0 (20 pages)","Int.J.Mod.Phys.A11:1855-1874,1996","10.1142/S0217751X96000973","LA-UR-94-3118","hep-th hep-ph",,"  Continuing our recent argument where we constructed a FNBWW-type spin-$1$
boson having opposite relative intrinsic parity to that of the associated
antiparticle, we now study eigenstates of the Charge Conjugation operator.
Based on the observation that if $\phi_{_{L}}(p^\mu)$ transforms as a $(0,\,j)$
spinor under Lorentz boosts, then $\Theta_{[j]}\,\phi_{_{L}}^\ast(p^\mu)$
transforms as a $(j,\,0)$ spinor (with a similar relationship existing between
$\phi_{_{R}}(p^\mu)$ and $\Theta_{[j]}\,\phi_{_{R}}^\ast(p^\mu)$; where $
\Theta_{[j]}\,{\bf J}\,\Theta_{[j]}^{-1}\,=\,-\,{\bf J}^\ast $ with
$\Theta_{[j]}$ the well known Wigner matrix involved in the operation of time
reversal) we introduce McLennan-Case type $(j,\,0)\oplus(0,\,j)$ spinors.
Relative phases between $\phi_{_{R}}(p^\mu)$ and
$\Theta_{[j]}\,\phi_{_{R}}^\ast(p^\mu)$, and
$\Theta_{[j]}\,\phi_{_{L}}^\ast(p^\mu)$ and $\phi_{_{L}}(p^\mu)$, turn out to
have physical significance and are fixed by appropriate requirements. Explicit
construction, and a series of physically relevant properties, for these spinors
are obtained for spin-$1/2$ and spin-$1$ culminating in the construction of a
new wave equation and introduction of Dirac-like and Majorana-like quantum
fields.
","[{""version"":""v1"",""created"":""Thu, 22 Sep 1994 21:54:48 GMT""},{""version"":""v2"",""created"":""Tue, 18 Jul 1995 20:29:54 GMT""}]","2008-11-26"
"hep-th/9409135","Hugo Compean","H. Garcia-Compean and T. Matos (CINVESTAV-Ipn, Mexico)","Solutions in Self-Dual Gravity Constructed Via Chiral Equations","Plain Latex, 13 Pages, major revisions of style in the above proof,
  several Comments added. Version to appear in Physical Review D","Phys.Rev. D52 (1995) 4425-4429","10.1103/PhysRevD.52.4425","CINVESTAV-FIS 95/11","hep-th gr-qc",,"  The chiral model for self-dual gravity given by Husain in the context of the
chiral equations approach is discussed. A Lie algebra corresponding to a finite
dimensional subgroup of the group of symplectic diffeomorphisms is found, and
then use for expanding the Lie algebra valued connections associated with the
chiral model. The self-dual metric can be explicitly given in terms of harmonic
maps and in terms of a basis of this subalgebra.
","[{""version"":""v1"",""created"":""Thu, 22 Sep 1994 22:41:15 GMT""},{""version"":""v2"",""created"":""Tue, 18 Jul 1995 23:40:08 GMT""}]","2009-10-28"
"hep-th/9409136","Bernhard Drabant","Bernhard Drabant","Braided Supersymmetry and (CO-)HOMOLOGY","15 pages, plain TEX (with input of amssym.def, amssym.tex and local
  amstex), UVA-FWI-Report 94-18",,,,"hep-th",,"  Within the framework of braided or quasisymmetric monoidal categories braided
Q-supersymmetry is investigated, where Q is a certain functorial isomorphism in
a braided symmetric monoidal category. For an ordinary (co-)quasitriangular
Hopf algebra (H,R) a braided monoidal category of H-(co-)modules with braiding
induced by the R-matrix is considered. It can be shown for a specific class of
Q-supersymmetries in this category that every braided Q-super-Hopf algebra B
admits an ordinary Q-super-Hopf algebra structure on the cross product BxH such
that H is a sub-Hopf algebra and B is a subalgebra in BxH. Applying this
Q-bosonization to the quantum Koszul complex (K(q,g),d) of the quantum
enveloping algebra Uq(g) for Lie algebras g associated with the root systems A,
B, C and D one obtains a classical super-Hopf algebra structure on (K(q,g),d)
where the structure maps are morphisms of modules with differentiation.
","[{""version"":""v1"",""created"":""Fri, 23 Sep 1994 07:14:40 GMT""}]","2007-05-23"
"hep-th/9409137","Armen Nersessian","A. Nersessian","From Antibracket to Equivariant Characteristic Classes","5 pages. The introduction of the paper is revised","Turk.J.Phys. 24 (2000) 429-434",,"JINR E2-94-377","hep-th math.DG",,"  We construct the odd symplectic structure and the equivariant even
(pre)symplectic one from it on the space of differential forms on the Riemann
manifold. The Poincare -- Cartan like invariants of the second structure define
the equivariant generalizations of the Euler classes on the surfaces.
","[{""version"":""v1"",""created"":""Fri, 23 Sep 1994 08:12:04 GMT""},{""version"":""v2"",""created"":""Mon, 28 Nov 1994 12:46:44 GMT""}]","2008-02-03"
"hep-th/9409138","Hitoshi Konno","Takeo Inami and Hitoshi Konno","Integrable XYZ Spin Chain with Boundaries","9 pages","J.Phys. A27 (1994) L913-L918","10.1088/0305-4470/27/24/002","YITP/K-1084","hep-th cond-mat",,"  We consider a general class of boundary terms of the open XYZ spin-1/2 chain
compatible with integrability. We have obtained the general elliptic solution
of $K$-matrix obeying the boundary Yang-Baxter equation using the $R$-matrix of
the eight vertex model and derived the associated integrable spin-chain
Hamiltonian.
","[{""version"":""v1"",""created"":""Fri, 23 Sep 1994 08:49:39 GMT""}]","2009-10-28"
"hep-th/9409139","Jan Willem v. Holten","J.W. van Holten (NIKHEF-H)","Supersymmetry and the Geometry of Taub-NUT","9 pages, NIKHEF-H/94-29","Phys.Lett. B342 (1995) 47-52","10.1016/0370-2693(94)01358-J",,"hep-th",,"  The supersymmetric extension of Taub-NUT space admits 4 standard
supersymmetries plus several additional non-standard ones. The geometrical
origin of these symmetries is traced. The result has applications to fermion
modes in gravitational instantons as well as in long-range monopole dynamics.
","[{""version"":""v1"",""created"":""Fri, 23 Sep 1994 09:08:04 GMT""}]","2009-10-28"
"hep-th/9409140","Jan Willem v. Holten","J.W. van Holten","Killing-Yano tensors and generalized supersymmetries in black-hole and
  monopole geometries","12 pages, NIKHEF-H/94-29",,,,"hep-th",,"  New kinds of supersymmetry arise in supersymmetric $\sg$-models describing
the motion of spinning point-particles in classical backgrounds, for example
black-holes, or the dynamics of monopoles. Their geometric origin is the
existence of Killing-Yano tensors. The relation between these concepts is
explained and examples are given. --- Contribution to Proceedings Quarks-94;
Vladimir, Russia (1994).
","[{""version"":""v1"",""created"":""Fri, 23 Sep 1994 09:09:21 GMT""}]","2007-05-23"
"hep-th/9409141","Timothy Hollowood","Jonathan M. Evans and Timothy J. Hollowood","The Exact Mass-Gap of the Supersymmetric O(N) Sigma Model","Plain TeX (macro included), CERN-TH.7426/94, SWAT/93-94/39","Phys.Lett. B343 (1995) 189-197","10.1016/0370-2693(94)01477-T",,"hep-th",,"  A formula for the mass-gap of the supersymmetric O($N$) sigma model ($N>4$)
in two dimensions is derived: $m/\Lambda_{\overline{\rm
MS}}=2^{2\Delta}\sin(\pi\Delta)/(\pi\Delta)$, where $\Delta=1/(N-2)$ and $m$ is
the mass of the fundamental vector particle in the theory. This result is
obtained by comparing two expressions for the free-energy density in the
presence of a coupling to a conserved charge; one expression is computed from
the exact S-matrix of Shankar and Witten via the the thermodynamic Bethe ansatz
and the other is computed using conventional perturbation theory. These
calculations provide a stringent test of the S-matrix, showing that it
correctly reproduces the universal part of the beta-function and resolving the
problem of CDD ambiguities.
","[{""version"":""v1"",""created"":""Fri, 23 Sep 1994 09:50:46 GMT""}]","2009-10-28"
"hep-th/9409142","Timothy Hollowood","Jonathan M. Evans and Timothy J. Hollowood","The Exact Mass-Gap of the Supersymmetric CP^{n-1} Sigam Model","Plain TeX (macro included), CERN-TH.7426/94, SWAT/93-94/42","Phys.Lett. B343 (1995) 198-206","10.1016/0370-2693(94)01478-U",,"hep-th",,"  A formula for the mass-gap of the supersymmetric $\CP^{n-1}$ sigma model ($n
> 1$) in two dimensions is derived: $m/\Lambda_{\overline{\rm
MS}}=\sin(\pi\Delta)/(\pi\Delta)$ where $\Delta=1/n$ and $m$ is the mass of the
fundamental particle multiplet. This result is obtained by comparing two
expressions for the free-energy density in the presence of a coupling to a
conserved charge; one expression is computed from the exact S-matrix of
K\""oberle and Kurak via the thermodynamic Bethe ansatz and the other is
computed using conventional perturbation theory. These calculations provide a
stringent test of the S-matrix, showing that it correctly reproduces the
universal part of the beta-function and resolving the problem of CDD
ambiguities.
","[{""version"":""v1"",""created"":""Fri, 23 Sep 1994 09:55:12 GMT""}]","2009-10-28"
"hep-th/9409143",,"John F. Donoghue","The ideas of gravitational effective field theory","Talk presented at the XXVIII International Conference on High Energy
  Physics, ICHEP94, Glasgow, July 1994, to be published in the proceedings.]
  Latex, 5 pages, no figures, UMHEP-413",,,,"hep-th gr-qc",,"  I give a very brief introduction to the use of effective field theory
techniques in quantum calculations of general relativity. The gravitational
interaction is naturally organized as a quantum effective field theory and a
certain class of quantum corrections can be calculated.
","[{""version"":""v1"",""created"":""Fri, 23 Sep 1994 15:45:06 GMT""}]","2007-05-23"
"math/9409208",,"Luchezar L. Avramov, Ragnar-Olaf Buchweitz, Judith D. Sally","Laurent coefficients and Ext of finite graded modules",,,,"Formerly com-alg/940003","math.AC",,"  Let $R=\bigoplus_{n\ges0}R_n$ be a graded commutative ring generated over a
field $K=R_0$ by homogeneous elements $x_1,\dots,x_e$ of positive degrees
$d_1,\dots,d_e$. The Hilbert-Serre Theorem shows that for each finite graded
$R$--module $M=\bigoplus_{n\in\BZ}M_n$ the {\it Hilbert series\/}
$\sum_{n\in\BZ}(\rank_K M_n)t^n$ is the Laurent expansion around $0$ of a
rational function
  $$ H_M(t)=\frac{q_M(t)}{\prod_{i=1}^e(1-t^{d_i})} $$
  with $q_M(t)\in\BZ[t,\ti]$. We demonstrate that Laurent expansions
$\left[M\right]_z$ of $H_M(t)$ around other points $z$ of the extended complex
plane $\overline\BC$ also carry important structural information.
","[{""version"":""v1"",""created"":""Fri, 23 Sep 1994 00:00:00 GMT""}]","2016-09-06"
"nucl-th/9409019","Dmitri Fedorov","D.V.Fedorov, A.S.Jensen and K.Riisager (IFA, Aarhus University,
  DK-8000 Aarhus C, Denmark)","Three-Body Halos. II. from Two- to Three-Body Asymptotics","16 pages, compressed and uuencoded PosrScript file, IFA-94/31","Phys.Rev.C50:2372-2383,1994","10.1103/PhysRevC.50.2372",,"nucl-th",,"  The large distance behavior of weakly bound three-body systems is
investigated. The Schr\""{o}dinger equation and the Faddeev equations are
reformulated by an expansion in eigenfunctions of the angular part of a
corresponding operator. The resulting coupled set of effective radial equations
are then derived. Both two- and three-body asymptotic behavior are possible and
their relative importance is studied for systems where subsystems may be bound.
The system of two nucleons outside a core is studied numerically in detail and
the character of possible halo structure is pointed out and investigated.
","[{""version"":""v1"",""created"":""Thu, 22 Sep 1994 19:26:00 GMT""}]","2008-11-26"
"patt-sol/9409005","Martin Treiber","Martin Treiber and Lorenz Kramer (Physikalisches Institut,
  Universitaet Bayreuth, Postfach 101251, D-95440 Bayreuth, Germany)","Bipolar Electrodiffusion model for Electroconvection in Nematics","15 pages, 3 figures (postscript)",,,,"patt-sol nlin.PS",,"  The common description of the electrical behavior of a nematic liquid crystal
as an anisotropic dielectric medium with (weak) ohmic conductivity is extended
to an electrodiffusion model with two active ionic species. Under appropriate,
but rather general conditions the additional effects can lead to a distinctive
change of the threshold behavior of the electrohydrodynamic instability, namely
to travelling patterns instead of static ones. This may explain the
experimentally observed phenomena.
","[{""version"":""v1"",""created"":""Fri, 23 Sep 1994 14:43:40 GMT""}]","2008-02-03"
"solv-int/9409003","Dr ""P. A"" Clarkson","Peter A. Clarkson and Elizabeth L. Mansfield (Department of
  Mathematics, University of Exeter, Exeter, U.K.)","Symmetry Reductions and Exact Solutions of Shallow Water Wave Equations","Tex file 19 pages, figures available from author",,,"M94/36, Department of Mathematics, University of Exeter","solv-int nlin.SI",,"  In this paper we study symmetry reductions and exact solutions of the shallow
water wave (SWW) equation $$u_{xxxt} + \alpha u_x u_{xt} + \beta u_t u_{xx} -
u_{xt} - u_{xx} = 0,\eqno(1)$$ where $\alpha$ and $\beta$ are arbitrary,
nonzero, constants, which is derivable using the so-called Boussinesq
approximation. Two special cases of this equation, or the equivalent nonlocal
equation obtained by setting $u_x=U$, have been discussed in the literature.
The case $\alpha=2\beta$ was discussed by Ablowitz, Kaup, Newell and Segur
[{\it Stud.\ Appl.\ Math.}, {\bf53} (1974) 249], who showed that this case was
solvable by inverse scattering through a second order linear problem. This case
and the case $\alpha=\beta$ were studied by Hirota and Satsuma [{\it J.\ Phys.\
Soc.\ Japan}, {\bf40} (1976) 611] using Hirota's bi-linear technique. Further
the case $\alpha=\beta$ is solvable by inverse scattering through a third order
linear problem. In this paper a catalogue of symmetry reductions is obtained
using the classical Lie method and the nonclassical method due to Bluman and
Cole [{\it J.\ Math.\ Mech.\/}, {\bf 18} (1969) 1025]. The classical Lie method
yields symmetry reductions of (1) expressible in terms of the first, third and
fifth \p\ transcendents and Weierstrass elliptic functions. The nonclassical
method yields a plethora of exact solutions of (1) with $\alpha=\beta$ which
possess a rich variety of qualitative behaviours. These solutions all like a
two-soliton solution for $t<0$ but differ radically for $t>0$ and may be viewed
as a nonlinear superposition of two solitons, one travelling to the left with
arbitrary speed and the other to the right with equal and opposite speed.
","[{""version"":""v1"",""created"":""Fri, 23 Sep 1994 13:14:21 GMT""}]","2008-02-03"
