"hep-ph/9405257","Ronald Kleiss","R.Kleiss and R.Pittau","Weight optimization in multichannel Monte Carlo","8 pages in LaTeX (figure file apwfig.eps appended), NIKHEF/Leiden
  preprint NIKHEF-H-94/17, INLO-PUB-4/94","Comput.Phys.Commun. 83 (1994) 141-146","10.1016/0010-4655(94)90043-4",,"hep-ph",,"  We discuss the improvement in the accuracy of a Monte Carlo integration that
can be obtained by optimization of the `a-priori weights' of the various
channels. These channels may be either the strata in a stratified-sampling
approach, or the several `approximate' distributions such as are used in event
generators for particle phenomenology. The optimization algorithm does not
require any initialization, and each Monte Carlo integration point can be used
in the evaluation of the integral. We describe our experience with this method
in a realistic problem, where an effective increase in program speed by almost
an order of magnitude is observed.
","[{""version"":""v1"",""created"":""Tue, 10 May 1994 10:47:07 GMT""},{""version"":""v2"",""created"":""Wed, 11 May 1994 12:23:15 GMT""}]","2009-10-28"
"hep-ph/9405258","John McCurry","J. McCurry","Monoslepton production in hadronic collisions","SHEP-93/94-18. 20 pages including 10 uuencoded postscript figures.
  Uses LaTeX, epsf",,,,"hep-ph",,"  Single sparticle creation in high energy collisions as a consequence explicit
$R$-parity breaking, could be a rich source of highly spectacular signals at
future colliders. One particular process, which could lead to a highly exotic
leptonic signal at the LHC, is monoslepton production. In this paper we
qualitatively discuss the constraints on the signal for this process and
calculate the hadronic monoslepton production cross section, taking into
account leading QCD corrections. Our results show the leading corrections could
be quite significant at the proposed LHC operating energy.
","[{""version"":""v1"",""created"":""Tue, 10 May 1994 12:37:06 GMT""}]","2007-05-23"
"hep-ph/9405259",,"Gerhard Buchalla and Andrzej J. Buras","$\sin 2\beta$ from $K\to\pi\nu\bar\nu$","9 pages, MPI-PhT/94-19","Phys.Lett.B333:221-227,1994","10.1016/0370-2693(94)91034-0",,"hep-ph",,"  We point out that the measurement of just the two branching fractions
\linebreak $B(K^+\to\pi^+\nu\bar\nu)$ and $B(K_L\to\pi^0\nu\bar\nu)$ can in a
theoretically clean manner determine $\sin 2\beta$ almost independently of
$m_t$ and $V_{cb}$. This allows to obtain an interesting relation between the
CP asymmetry $A_{CP}(\psi K_S)$ in B physics and the branching ratios for these
two rare K decays. The recently calculated next-to-leading order QCD
corrections improve the accuracy of this analysis. We find typically
$\Delta\sin 2\beta=\pm 0.11$ provided $B(\kpn)$ and $B(\klpn)$ are measured
within $\pm 10\%$ accuracy. With decreasing uncertainty in
$\Lambda_{\overline{MS}}$ and $m_c$ this error could be reduced to $\Delta\sin
2\beta < \pm 0.10$. The determination of $\sin 2\alpha$ and $\sin 2\gamma$ on
the other hand is rather poor. However respectable determinations of the
Wolfenstein parameter $\eta$ and of $\mid V_{td}\mid$ can be obtained.
","[{""version"":""v1"",""created"":""Tue, 10 May 1994 14:38:00 GMT""}]","2009-10-09"
"hep-th/9405054",,"S.L. Adler and Yong-Shi Wu","Algebraic and geometric aspects of generalized quantum dynamics","10pages,revtex, IASSNSHEP-93/52","Phys.Rev. D49 (1994) 6705-6708","10.1103/PhysRevD.49.6705",,"hep-th",,"  \noindent We briefly discuss some algebraic and geometric aspects of the
generalized Poisson bracket and non--commutative phase space for generalized
quantum dynamics, which are analogous to properties of the classical Poisson
bracket and ordinary symplectic structure.
","[{""version"":""v1"",""created"":""Mon, 9 May 1994 19:16:29 GMT""}]","2009-10-28"
"hep-th/9405055","Wei Chen","Wei Chen (Univ of North Carolina at Chapel Hill)","Renormalization Group Flow of Four-fermi with Chern-Simons Interaction","23 pages, IFT-485-UNC. The is the version to appear in Nucl Phys B","Nucl.Phys. B435 (1995) 673-689","10.1016/0550-3213(94)00376-P",,"hep-th cond-mat hep-ph",,"  We introduce Chern-Simons interaction into the three dimensional four-fermi
theory, ad suggest a possible line of non-Gaussian infrared stable fixed points
of the four-fermi operator, this line is characterized by the Chern-Simons
coupling.
","[{""version"":""v1"",""created"":""Mon, 9 May 1994 20:00:24 GMT""},{""version"":""v2"",""created"":""Thu, 25 Aug 1994 17:32:03 GMT""}]","2015-06-26"
"hep-th/9405056","Bumsig Kim","Bumsig Kim","Quantum Cohomology of Partial Flag Manifolds and a Residue Formula for
  Their Intersection Parings","13 pages",,,,"hep-th math.QA",,"  As a generalization of our previous paper [GK], we formulate a residue
formula and some simple behaviors of equivariant quantum cohomology applying to
compute the quantum cohomology of partial flag manifolds $F_{k_1,\cdots , k_l}
$with a try to give a rigorous definition of equivariant quantum cohomology.
","[{""version"":""v1"",""created"":""Tue, 10 May 1994 03:44:28 GMT""},{""version"":""v2"",""created"":""Tue, 18 Oct 1994 23:23:22 GMT""}]","2008-02-03"
"hep-th/9405057",,"Dimitra Karabali","$W_{\infty}$ Algebras in the Quantum Hall Effect","18 pages, SU-4240-580 (correction in equation (4.2))","Nucl.Phys. B428 (1994) 531-544","10.1016/0550-3213(94)90364-6",,"hep-th cond-mat",,"  We show that a large class of incompressible quantum Hall states correspond
to different representations of the \Winf algebra by explicit construction of
the second quantized generators of the algebra in terms of fermion and vortex
operators. These are parametrized by a set of integers which are related to the
filling fraction. The class of states we consider includes multilayer Hall
states and the states proposed by Jain to explain the hierarchical filling
fractions. The corresponding second quantized order parameters are also given.
","[{""version"":""v1"",""created"":""Mon, 9 May 1994 23:33:36 GMT""},{""version"":""v2"",""created"":""Wed, 18 May 1994 18:12:08 GMT""},{""version"":""v3"",""created"":""Fri, 20 May 1994 16:24:44 GMT""}]","2009-10-28"
"hep-th/9405058","Rinat Kedem","O. Foda, K. Iohara, M. Jimbo, R. Kedem, T. Miwa and H. Yan","Notes on highest weight modules of the elliptic algebra ${\cal
  A}_{q,p}\left(\widehat{sl}_2\right)$","Nonstandard macro package eliminated","Prog.Theor.Phys.Suppl.118:1-34,1995","10.1143/PTPS.118.1",,"hep-th",,"  We discuss a construction of highest weight modules for the recently defined
elliptic algebra ${\cal A}_{q,p}(\widehat{sl}_2)$, and make several conjectures
concerning them. The modules are generated by the action of the components of
the operator $L$ on the highest weight vectors. We introduce the vertex
operators $\Phi$ and $\Psi^*$ through their commutation relations with the
$L$-operator. We present ordering rules for the $L$- and $\Phi$-operators and
find an upper bound for the number of linearly independent vectors generated by
them, which agrees with the known characters of $\widehat{sl}_2$-modules.
","[{""version"":""v1"",""created"":""Tue, 10 May 1994 09:21:21 GMT""}]","2008-11-26"
"hep-th/9405059","Jun Nishimura","Jun Nishimura, Shinya Tamura and Asato Tsuchiya","$R^2$ Gravity in $(2+\epsilon)$--Dimensional Quantum Gravity","12 pages; KEK-TH-394, KEK Preprint 94-15, ICRR-Report-318-94-13,
  UT-Komaba/94-11","Mod.Phys.Lett. A9 (1994) 3565-3574","10.1142/S0217732394003403",,"hep-th",,"  We study $R^2$ gravity in $(2+\epsilon)$--dimensional quantum gravity. Taking
care of the oversubtraction problem in the conformal mode dynamics, we perform
a full order calculation of string susceptibility in the $\epsilon \rightarrow
0$ limit. The result is consistent with that obtained through Liouville
approach.
","[{""version"":""v1"",""created"":""Tue, 10 May 1994 07:29:03 GMT""}]","2015-06-26"
"hep-th/9405060","Shtykov Nikolay","N.Shtykov","The finite vacuum energy for spinor, scalar and vector fields","15 pages, Latex, TIT/HEP-257","Int.J.Mod.Phys. A10 (1995) 2333-2348","10.1142/S0217751X95001133",,"hep-th",,"  We compute the one-loop potential (the Casimir energy) for scalar, spinor and
vectors fields on the spaces $\,R^{m+1}\, \times\,Y$ with $\,Y=\,S^N\,,CP^2$.
As a physical model we consider spinor electrodynamics on four-dimensional
product manifolds. We examine the cancelation of a divergent part of the
Casimir energy on even-dimensional spaces by means of including the parameter
$\,M$ in original action. For some models we compare our results with those
found in the literature.
","[{""version"":""v1"",""created"":""Tue, 10 May 1994 08:40:50 GMT""}]","2015-06-26"
"hep-th/9405061","R. Padma","G. H. Gadiyar","Quantum Optimal Control Theory","(Latex file 9 pages) e-mail : padma@imsc.ernet.in - IITM-TH-94-01",,,,"hep-th",,"  The possibility of control of phenomena at microscopic level compatible with
quantum mechanics and quantum field theory is outlined. The theory could be
used in nanotechnology.
","[{""version"":""v1"",""created"":""Tue, 10 May 1994 14:39:07 GMT""}]","2007-05-23"
"hep-th/9405062","Hideaki Hiro-Oka","Hideaki Hiro-Oka and Hisakazu Minakata","Solitons in Nonlinear Schr\""{o}dinger Model and the Collective Ground
  State of One-Dimensional Delta-Function Gas","TMUP-HEL-9406(LaTeX 9pp)",,"10.1016/0375-9601(94)90153-8",,"hep-th",,"  We examine one-dimensional Bose gas interacting with delta-function potential
using the large-$N$ collective field theory. We show that in the case of
attractive potential the uniform ground state is unstable to small
perturbations and the instability is cured by formation of a collective ground
state, \lq\lq bright soliton'' configuration in corresponding nonlinear
Schr\""odinger field theory.
","[{""version"":""v1"",""created"":""Tue, 10 May 1994 10:03:21 GMT""}]","2009-10-28"
"hep-th/9405063","R. Padma","G.H.Gadiyar","The Geometry of Electric Charge: The Charge Characteristic Class","(Latex file 6 pages) e-mail: padma@imsc.ernet.in -IITM-TH-94-02",,,,"hep-th",,"  It is well known that magnetic monopoles are related to the first Chern
class. In this note electric charge is used to construct an analogous
characteristic class: the charge class.
","[{""version"":""v1"",""created"":""Tue, 10 May 1994 11:11:31 GMT""}]","2007-05-23"
"hep-th/9405064","Friedemann Brandt","Friedemann Brandt","B\""acklund Transformations an Zero-Curvature Representations of Systems
  of Partial Differential Equations","25 pages","J.Math.Phys. 35 (1994) 2463-2484","10.1063/1.530517","NIKHEF-H 93-23","hep-th math.AP",,"  It is shown that B\""acklund transformations (BTs) and zero-curvature
representations (ZCRs) of systems of partial differential equations (PDEs) are
closely related. The connection is established by nonlinear representations of
the symmetry group underlying the ZCR which induce gauge transformations
relating different BTs. This connection is used to construct BTs from ZCRs (and
vice versa). Furthermore a procedure is outlined which allows a systematic
search for ZCRs of a given system of PDEs.
","[{""version"":""v1"",""created"":""Tue, 10 May 1994 12:37:21 GMT""}]","2009-10-28"
"hep-th/9405065",,"Sergio Ferrara","Supergravity and the quest for a unified theory","15 pages, latex",,,,"hep-th",,"  A recollection of some theoretical developments that preceded and followed
the first formulation of supergravity theory is presented. Special emphasis is
placed on the impact of supergravity on the search for a unified theory of
fundamental interactions.
","[{""version"":""v1"",""created"":""Tue, 10 May 1994 15:55:33 GMT""}]","2007-05-23"
"hep-th/9405066","Ramy Brustein","R. Brustein","The role of the superstring dilaton in cosmology and particle physics","Latex, 12 pages, preprint CERN-TH.7255/94",,,,"hep-th astro-ph",,"  Superstring theory predicts the existence of a scalar field, the dilaton. I
review some basic features of the dilaton interactions and explain their
possible consequences in cosmology and particle physics.
","[{""version"":""v1"",""created"":""Tue, 10 May 1994 15:16:04 GMT""}]","2007-05-23"
"hep-th/9405068",,"C. Bachas, C. de Calan and P.M.S. Petropoulos","Quenched Random Graphs","9 pages, report CPTH-A264.1093","J.Phys. A27 (1994) 6121-6128","10.1088/0305-4470/27/18/020",,"hep-th",,"  Spin models on quenched random graphs are related to many important
optimization problems. We give a new derivation of their mean-field equations
that elucidates the role of the natural order parameter in these models.
","[{""version"":""v1"",""created"":""Tue, 10 May 1994 15:20:42 GMT""}]","2009-10-28"
"nucl-th/9405009","Kouichi Saito","K. Saito and A. W. Thomas","The Nolen-Schiffer anomaly and isospin symmetry breaking in nuclear
  matter","13 pages","Phys.Lett.B335:17-23,1994","10.1016/0370-2693(94)91551-2","University of Adelaide ADP-94-4/T146","nucl-th",,"  The quark-meson coupling model which we have developed previously is extended
to incorporate the $\delta$ meson. It is then used to study the Nolen-Schiffer
anomaly and isospin symmetry breaking in nuclear matter. We find that, in
combination with the {\it u-d\/} mass difference, the difference between quark
scalar densities in protons and neutrons generates an effective neutron-proton
mass difference of the right magnitude. Finally we find that isospin symmetry
breaking in the quark condensates can be directly related to the $\delta$ meson
field.
","[{""version"":""v1"",""created"":""Tue, 10 May 1994 07:21:10 GMT""}]","2010-02-17"
"nucl-th/9405010",,"T. Engeland, M. Hjorth-Jensen, A. Holt and E. Osnes","Comment on ""No-core calculations"" of the spectra of light nuclei","11 pages, Revtex 3.0, UIO/PHYS report 94-10",,,,"nucl-th",,"  We comment upon a recent work by Zheng, Barrett, Jaqua, Vary and McCarthy,
concerning calculations of spectra of light nuclei with no core. It is
demonstrated that the omission of particle-particle ladder diagrams in their
calculations, explains the large differences between results obtained with
various model spaces.
","[{""version"":""v1"",""created"":""Tue, 10 May 1994 15:14:47 GMT""}]","2009-09-25"
