"hep-th/9405107",,"Shahn Majid and Henri Ruegg","Bicrossproduct structure of $\kappa$-Poincare group and non-commutative
  geometry","12 pages. Revision: minor typos corrected","Phys.Lett. B334 (1994) 348-354","10.1016/0370-2693(94)90699-8",,"hep-th math.QA",,"  We show that the $\kappa$-deformed Poincar\'e quantum algebra proposed for
elementary particle physics has the structure of a Hopf agebra bicrossproduct
$U(so(1,3))\cobicross T$. The algebra is a semidirect product of the classical
Lorentz group $so(1,3)$ acting in a deformed way on the momentum sector $T$.
The novel feature is that the coalgebra is also semidirect, with a backreaction
of the momentum sector on the Lorentz rotations. Using this, we show that the
$\kappa$-Poincar\'e acts covariantly on a $\kappa$-Minkowski space, which we
introduce. It turns out necessarily to be deformed and non-commutative. We also
connect this algebra with a previous approach to Planck scale physics.
","[{""version"":""v1"",""created"":""Tue, 17 May 1994 11:36:00 GMT""},{""version"":""v2"",""created"":""Fri, 20 May 1994 11:12:48 GMT""}]","2009-10-28"
"hep-th/9405108","Danny Birmingham","Danny Birmingham and Mark Rakowski","State Sum Models and Simplicial Cohomology","28 pages, Latex, ITFA-94-13, (Expanded version with two new sections)","Commun.Math.Phys. 173 (1995) 135-154","10.1007/BF02100184",,"hep-th",,"  We study a class of subdivision invariant lattice models based on the gauge
group $Z_{p}$, with particular emphasis on the four dimensional example. This
model is based upon the assignment of field variables to both the $1$- and
$2$-dimensional simplices of the simplicial complex. The property of
subdivision invariance is achieved when the coupling parameter is quantized and
the field configurations are restricted to satisfy a type of mod-$p$ flatness
condition. By explicit computation of the partition function for the manifold
$RP^{3} \times S^{1}$, we establish that the theory has a quantum Hilbert space
which differs from the classical one.
","[{""version"":""v1"",""created"":""Tue, 17 May 1994 10:19:51 GMT""},{""version"":""v2"",""created"":""Thu, 29 Sep 1994 10:45:29 GMT""}]","2009-10-28"
"hep-th/9405109","Coussaert Olivier","G. Barnich, F. Brandt and M. Henneaux","Local BRST cohomology in the antifield formalism: I. General theorems","48 pages LaTeX file, ULB-PMIF-94/06 NIKEF-H 94-13 (minor changes in
  section 10)","Commun.Math.Phys.174:57-92,1995","10.1007/BF02099464",,"hep-th",,"  We establish general theorems on the cohomology $H^*(s|d)$ of the BRST
differential modulo the spacetime exterior derivative, acting in the algebra of
local $p$-forms depending on the fields and the antifields (=sources for the
BRST variations). It is shown that $H^{-k}(s|d)$ is isomorphic to $H_k(\delta
|d)$ in negative ghost degree $-k\ (k>0)$, where $\delta$ is the Koszul-Tate
differential associated with the stationary surface. The cohomological group
$H_1(\delta |d)$ in form degree $n$ is proved to be isomorphic to the space of
constants of the motion, thereby providing a cohomological reformulation of
Noether theorem. More generally, the group $H_k(\delta|d)$ in form degree $n$
is isomorphic to the space of $n-k$ forms that are closed when the equations of
motion hold. The groups $H_k(\delta|d)$ $(k>2)$ are shown to vanish for
standard irreducible gauge theories. The group $H_2(\delta|d)$ is then
calculated explicitly for electromagnetism, Yang-Mills models and Einstein
gravity. The invariance of the groups $H^{k}(s|d)$ under the introduction of
non minimal variables and of auxiliary
","[{""version"":""v1"",""created"":""Tue, 17 May 1994 13:09:31 GMT""},{""version"":""v2"",""created"":""Mon, 13 Jun 1994 13:22:11 GMT""}]","2008-11-26"
"hep-th/9405110","Thomas Strobl","Peter Schaller and Thomas Strobl","Poisson Structure Induced (Topological) Field Theories","6 pages, LaTeX, TUW9403","Mod.Phys.Lett. A9 (1994) 3129-3136","10.1142/S0217732394002951",,"hep-th",,"  A class of two dimensional field theories, based on (generically degenerate)
Poisson structures and generalizing gravity-Yang-Mills systems, is presented.
Locally, the solutions of the classical equations of motion are given. A
general scheme for the quantization of the models in a Hamiltonian formulation
is found.
","[{""version"":""v1"",""created"":""Tue, 17 May 1994 13:36:36 GMT""}]","2015-06-26"
"hep-th/9405149",,"Dmitri Vassilevich","Comment on gauge choices and physical variables in QED","4 pages, SPbU-IP-94-8, Latex","NuovoCim.A108:123-126,1995","10.1007/BF02814863",,"hep-th",,"  We consider possible definitions of physical variables in QED. We demonstrate
that the condition $\partial_i A_i$$=0$ is the most convenient one because it
leads to path integral over physical components with local action. However,
other choices, as $A_3=0$, are also possible. The standard expression for
configuration space path integral in $A_3=0$ gauge is obtained starting with
reduced phase space formulation. Contrary to the claims of the paper [M.Lavelle
and D.McMullan,Phys. Lett. B316 (1993)172] the $A_3=0$ gauge is not
overconstrained.
","[{""version"":""v1"",""created"":""Tue, 17 May 1994 11:51:19 GMT""}]","2008-11-26"
"nucl-th/9405017","Sidney H. Kahana","David E. Kahana, Declan Keane, Yang Pang, Tom Schlagel and Shan Wang","Collective Flow from the Intranuclear Cascade Model","9 pages, 2 figures included","Phys.Rev.Lett. 74 (1995) 4404-4407","10.1103/PhysRevLett.74.4404",,"nucl-th",,"  The phenomenon of collective flow in relativistic heavy ion collisions is
studied using the hadronic cascade model ARC. Direct comparison is made to data
gathered at the Bevalac, for Au+Au at $p=1-2$ GeV/c. In contrast to the
standard lore about the cascade model, collective flow is well described
quantitatively without the need for explicit mean field terms to simulate the
nuclear equation of state. Pion collective flow is in the opposite direction to
nucleon flow as is that of anti-nucleons and other produced particles. Pion and
nucleon flow are predicted at AGS energies also, where, in light of the higher
baryon densities achieved, we speculate that equation of state effects may be
observable.
","[{""version"":""v1"",""created"":""Tue, 17 May 1994 02:41:32 GMT""}]","2009-10-28"
"nucl-th/9405018","Dao-Chen Zheng","D. C. Zheng, J. P. Vary, and B. R. Barrett","Large-space shell-model calculations for light nuclei","prepared using LaTex, 21 manuscript pages, no figures","Phys.Rev.C50:2841-2849,1994","10.1103/PhysRevC.50.2841","The University of Arizona AZPH-TH/94-14","nucl-th",,"  An effective two-body interaction is constructed from a new Reid-like $NN$
potential for a large no-core space consisting of six major shells and is used
to generate the shell-model properties for light nuclei from $A$=2 to 6. (For
practical reasons, the model space is partially truncated for $A$=6.) Binding
energies and other physical observables are calculated and compare favorably
with experiment.
","[{""version"":""v1"",""created"":""Tue, 17 May 1994 13:57:54 GMT""}]","2008-11-26"
"nucl-th/9405019",,"Sadhan K. Adhikari, T. Frederico, I. D. Goldman, and S. S. Sharma","Model for asymptotic $D$-state parameters of light nuclei: Application
  to $^4He$","20 pages, text and one postscript figure included","Phys.Rev.C50:822-830,1994","10.1103/PhysRevC.50.822","Preprint#ift-93","nucl-th",,"  A simple method for calculating the asymptotic $D$ state observables for
light nuclei is suggested. The method exploits the dominant clusters of the
light nuclei. The method is applied to calculate the $^4He$ asymptotic $D$ to
$S$ normalization ratio $\rho^\alpha$ and the closely related $D$ state
parameter $D_2^\alpha$. The study predicts a correlation between $D_2^\alpha$
and $B_\alpha$, and between $\rho^\alpha$ and $B_\alpha$, where $B_\alpha$ is
the binding energy of $^4He$. The present study yields $\rho^\alpha \simeq
-0.14$ and $D_2^\alpha \simeq -0.12$ fm$^2$ consistent with the correct
experimental $\eta^D$ and the binding energies of the deuteron, triton, and the
$\alpha$ particle, where $\eta^d$ is the deuteron $D$ state to $S$ state
normalization ratio.
","[{""version"":""v1"",""created"":""Tue, 17 May 1994 13:40:00 GMT""}]","2009-09-25"
