"hep-ph/9405340","Jan Bolz","J. Bolz, R. Jakob, P. Kroll, M. Bergmann, N.G. Stefanis","A Critical Analysis of the Proton Form Factor with Sudakov Suppression
  and Intrinsic Transverse Momentum","31 pages (RevTex) + 6 figures in PS-file; preprint BUGH Wuppertal
  WU-B-94-06, preprint Ruhr-Universit\""at Bochum RUB-TPII-01/94","Z.Phys.C66:267-278,1995","10.1007/BF01496601",,"hep-ph",,"  The behavior of the proton magnetic form factor is studied within the
modified hard scattering picture, which takes into account gluonic radiative
corrections in terms of transverse separations. We parallel the analysis given
previously by Li and make apparent a number of serious objections. The
appropriate cut-off needed to render the form-factor calculation finite is both
detailed and analyzed by considering different cut-off prescriptions. The use
of the maximum interquark separation as a common infrared cut-off in the
Sudakov suppression factor is proposed, since it avoids difficulties with the
$\alpha _{s}$-singularities and yields a proton form factor insensitive to the
inclusion of the soft region which therefore can be confidently attributed to
perturbative QCD. Results are presented for a variety of proton wave functions
including also their intrinsic transverse momentum. It turns out that the
perturbative contribution, although theoretically self-consistent for $Q^{2}$
larger than about $6$~GeV${}^{2}$ to $10$~GeV${}^{2}$, is too small compared to
the data.
","[{""version"":""v1"",""created"":""Fri, 20 May 1994 12:20:23 GMT""}]","2009-09-25"
"hep-ph/9405341","Urech","R. Urech","Virtual Photons in Chiral Perturbation Theory","19 pages , LaTex, 1 figure appended as PostScript file, (little
  corrections on the pages 8 and 17 - the physical results are not affected),
  BUTP-94/9","Nucl.Phys. B433 (1995) 234-254","10.1016/0550-3213(95)90707-N",,"hep-ph",,"  In the framework of chiral perturbation theory virtual photons are included.
We calculate the divergences of the generating functional to one loop and
determine the structure of the local action that incorporates the counterterms
which cancel the divergences. As an application we discuss the corrections to
Dashen's theorem at order [e^2*m(quark)].
","[{""version"":""v1"",""created"":""Fri, 20 May 1994 11:08:05 GMT""},{""version"":""v2"",""created"":""Mon, 27 Jun 1994 09:52:55 GMT""}]","2009-10-28"
"hep-th/9405127","Roberto Fiore","V.S. Fadin, R. Fiore, A. Quartarolo","Quark contribution to the reggeon-reggeon-gluon vertex in QCD","19 pages + 2 figures(appended as a postscript file), Latex","Phys.Rev. D50 (1994) 5893-5901","10.1103/PhysRevD.50.5893","BUDKERINP/94-46,DF-UNICAL/94-14","hep-th hep-ph",,"  The quark loop contribution to the reggeon-reggeon-gluon vertex is calculated
in QCD, where the reggeon is the reggeized gluon. Compared with the vertex in
the Born approximation, this contribution exhibits a new spin structure as well
as the gluon loop one. A remarkable but not complete cancellation between gluon
and quark contributions to this new spin structure takes place for the case of
three massless quark flavours.
","[{""version"":""v1"",""created"":""Thu, 19 May 1994 16:58:47 GMT""}]","2019-08-17"
"hep-th/9405128",,"G. Mussardo","Spectral Representation of Correlation Functions in two-dimensional
  Quantum Field Theories","9 pages, ISAS/60/94/EP",,,,"hep-th cond-mat",,"  The non-perturbative mapping between different Quantum Field Theories and
other features of two-dimensional massive integrable models are discussed by
using the Form Factor approach. The computation of ultraviolet data associated
to the massive regime is illustrated by taking as an example the scattering
theory of the Ising Model with boundary.
","[{""version"":""v1"",""created"":""Thu, 19 May 1994 18:36:18 GMT""}]","2007-05-23"
"hep-th/9405129","Jeroen Snippe","Jeroen Snippe","Tunneling Through Sphalerons: The O(3) Sigma-Model on a Cylinder","10 pages, LaTeX, 1 figure appended (uuencoded), Leiden preprint
  INLO-PUB-5/94","Phys.Lett.B335:395-402,1994","10.1016/0370-2693(94)90370-0",,"hep-th hep-lat",,"  We construct all instantons for the \nlsig\ on a cylinder, known not to exist
on a finite time interval. We show that the widest instantons go through
sphalerons. A re-interpretation of moduli-space transforms the scale parameter
$\rho$ to a boundary condition in time. This may give a handle on the
$\rho\rightarrow0$ divergent instanton gas.
","[{""version"":""v1"",""created"":""Fri, 20 May 1994 00:08:09 GMT""}]","2008-11-26"
"hep-th/9405130","Kenji Hamada","Ken-ji Hamada and Hiroshi Ishikawa","Non-linear Structures in Non-critical NSR String","22 pages, Latex file, YITP/U-94-16, UT-Komaba/94-12","Commun.Math.Phys. 176 (1996) 401-420","10.1007/BF02099555",,"hep-th",,"  We investigate the Ward identities of the $\W_{\infty}$ symmetry in the
super-Liouville theory coupled to the super-conformal matter of central charge
${\hat c}_M = 1-2(p-q)^2 /pq$. The theory is classified into two chiralities.
For the positive chirality, all gravitationally dressed scaling operators are
generated from the $q-1$ gravitational primaries by acting one of the ring
generators in the R-sector on them repeatedly. After fixing the normalizations
of the dressed scaling operators, we find that the Ward identities are
expressed in the form of the {\it usual} $\W_q$ algebra constraints as in the
bosonic case: $\W^{(k+1)}_n \tau =0$, $(k=1,\cdots,q-1 ;~ n \in {\bf Z}_{\geq
1-k})$, where the equations for even and odd $n$ come from the currents in the
NS- and the R-sector respectively. The non-linear terms come from the anomalous
contributions at the boundaries of moduli space. The negative chirality is
defined by interchanging the roles of $p$ and $q$. Then we get the $\W_p $
algebra constraints.
","[{""version"":""v1"",""created"":""Fri, 20 May 1994 07:03:47 GMT""}]","2015-06-26"
"hep-th/9405131","Parashar Preeti","Ludwik Dabrowski and Preeti Parashar","Left Regular Representation of $sl_q(3)$: Reduction and Intertwiners","17 pages. References added typographical errors corrected","J.Phys. A28 (1995) 2833-2846","10.1088/0305-4470/28/10/014","SISSA 57/94/FM","hep-th math.QA",,"  Reduction of the left regular representation of quantum algebra $sl_q(3)$ is
studied and ~$q$-difference intertwining operators are constructed. The
irreducible representations correspond to the spaces of local sections of
certain line bundles over the q-flag manifold.
","[{""version"":""v1"",""created"":""Fri, 20 May 1994 08:56:17 GMT""},{""version"":""v2"",""created"":""Fri, 27 May 1994 14:30:48 GMT""}]","2009-10-28"
"hep-th/9405132",,"S.N.Solodukhin","On Higher Derivative Gravity in Two Dimensions","24p., (5 figures, available upon request), JINR E2-94-185, Latex","Phys.Rev. D51 (1995) 591-602","10.1103/PhysRevD.51.591",,"hep-th",,"  The 2D gravity described by the action which is an arbitrary function of the
scalar curvature $f(R)$ is considered. The classical vacuum solutions are
analyzed. The one-loop renormalizability is studied. For the function $f=R \ln
R$ the model coupled with scalar (conformal) matter is exactly integrated and
is shown to describe a black hole of the 2D dilaton gravity type. The influence
of one-loop quantum corrections on a classical black hole configuration is
studied by including the Liouville-Polyakov term. The resulting model turns out
to be exactly solvable. The general solution is analyzed and shown to be free
from the space-time singularities for a certain number of scalar fields.
","[{""version"":""v1"",""created"":""Fri, 20 May 1994 10:20:32 GMT""}]","2009-10-28"
"hep-th/9405133","Otmar Moritsch","O. Moritsch and M. Schweda","On the Algebraic Structure of Gravity with Torsion including Weyl
  symmetry","55 pages, report REF. TUW 94-08","Helv.Phys.Acta 67 (1994) 289-344",,,"hep-th",,"  The BRST transformations for gravity with torsion including Weyl symmetry are
discussed by using the so-called Maurer-Cartan horizontality conditions. Also
the coupling of scalar matter fields to gravity is incorporated in this
analysis. With the help of an operator $\d$ which allows to decompose the
exterior space-time derivative as a BRST commutator we solve the Wess-Zumino
consistency condition corresponding to invariant Lagrangians and anomalies for
the cases with and without Weyl symmetry.
","[{""version"":""v1"",""created"":""Fri, 20 May 1994 14:18:28 GMT""}]","2007-05-23"
"hep-th/9405134",,"Mark Wexler","From Trees to Galaxies: The Potts Model on a Random Surface","25 pp. (voodoo PostScript replaced by original LaTeX), NBI-HE-94-28","Nucl.Phys.B438:629-648,1995","10.1016/0550-3213(95)94690-A",,"hep-th",,"  The matrix model of random surfaces with c = inf. has recently been solved
and found to be identical to a random surface coupled to a q-states Potts model
with q = inf. The mean field-like solution exhibits a novel type of tree
structure. The natural question is, down to which--if any--finite values of c
and q does this behavior persist? In this work we develop, for the Potts model,
an expansion in the fluctuations about the q = inf. mean field solution. In the
lowest--cubic--non-trivial order in this expansion the corrections to mean
field theory can be given a nice interpretation in terms of structures (trees
and ``galaxies'') of spin clusters. When q drops below a finite q_c, the
galaxies overwhelm the trees at all temperatures, thus suppressing mean field
behavior. Thereafter the phase diagram resembles that of the Ising model, q=2.
","[{""version"":""v1"",""created"":""Fri, 20 May 1994 14:27:23 GMT""},{""version"":""v2"",""created"":""Mon, 30 May 1994 12:49:35 GMT""}]","2010-11-30"
"hep-th/9405135",,"O. Steinmann (Universitaet Bielefeld, Fakultaet fuer Physik, D-33501
  Bielefeld, Germany)","Perturbative Quantum Field Theory at Positive Temperatures: An Axiomatic
  Approach","17pages LateX","Commun.Math.Phys. 170 (1995) 405-416","10.1007/BF02108335",,"hep-th",,"  It is shown that the perturbative expansions of the correlation functions of
a relativistic quantum field theory at finite temperature are uniquely
determined by the equations of motion and standard axiomatic requirements,
including the KMS condition. An explicit expression as a sum over generalized
Feynman graphs is derived. The canonical formalism is not used, and the
derivation proceeds from the beginning in the thermodynamic limit. No doubling
of fields is invoked. An unsolved problem concerning existence of these
perturbative expressions is pointed out.
","[{""version"":""v1"",""created"":""Fri, 20 May 1994 14:52:22 GMT""}]","2009-10-28"
"math/9405202","Andreas Blass","Andreas Blass","Simple Cardinal Characteristics of the Continuum","The published version contains some typographical errors and was
  printed on a machine that failed to distinguish boldface and lightface
  capital Greek letters","Israel Math. Conf. Proc. 6 (1993) 63-90",,"Logic E-prints May 20, 1994","math.LO",,"  We classify many cardinal characteristics of the continuum according to the
complexity, in the sense of descriptive set theory, of their definitions. The
simplest characteristics (boldface Sigma^0_2 and, under suitable restrictions,
Pi^0_2) are shown to have pleasant properties, related to Baire category. We
construct models of set theory where (unrestricted) boldface
Pi^0_2-characteristics behave quite chaotically and no new characteristics
appear at higher complexity levels. We also discuss some characteristics
associated with partition theorems and we present, in an appendix, a simplified
proof of Shelah's theorem that the dominating number is less than or equal to
the independence number.
","[{""version"":""v1"",""created"":""Fri, 20 May 1994 00:00:00 GMT""}]","2009-09-25"
"math/9405203","Andreas Blass","Andreas Blass","Baire Category for Monotone Sets",,,,"Logic E-prints May 20, 1994","math.LO",,"  We study Baire category for subsets of 2^omega that are downward-closed with
respect to the almost-inclusion ordering (on the power set of the natural
numbers, identified with 2^omega). We show that it behaves better in this
context than for general subsets of 2^omega. In the downward-closed context,
the ideal of meager sets is prime and b-complete (where b is the bounding
number), while the complementary filter is g-complete (where g is the groupwise
density cardinal). We also discuss other cardinal characteristics of this ideal
and this filter, and we show that analogous results for measure in place of
category are not provable in ZFC.
","[{""version"":""v1"",""created"":""Fri, 20 May 1994 00:00:00 GMT""}]","2009-09-25"
"math/9405204","Andreas Blass","Andreas Blass","An Induction Principle and Pigeonhole Principles for K-Finite Sets",,,,"Logic E-prints May 20, 1994","math.LO",,"  We establish a course-of-values induction principle for K-finite sets in
intuitionistic type theory. Using this principle, we prove a pigeonhole
principle conjectured by Benabou and Loiseau. We also comment on some variants
of this pigeonhole principle.
","[{""version"":""v1"",""created"":""Fri, 20 May 1994 00:00:00 GMT""}]","2008-02-03"
"math/9405205","Andreas Blass","Andreas Blass","Seven Trees in One","Version 2 has the same content as version 1 but improved formatting.
  The last line or two of each page will no longer be deleted","Journal of Pure and Applied Algebra 103 (1995) 1-21",,"Logic E-prints May 20, 1994","math.LO","http://arxiv.org/licenses/nonexclusive-distrib/1.0/","  Following a remark of Lawvere, we explicitly exhibit a particularly
elementary bijection between the set T of finite binary trees and the set T^7
of seven-tuples of such trees. ""Particularly elementary"" means that the
application of the bijection to a seven-tuple of trees involves case
distinctions only down to a fixed depth (namely four) in the given seven-tuple.
We clarify how this and similar bijections are related to the free commutative
semiring on one generator X subject to X=1+X^2. Finally, our main theorem is
that the existence of particularly elementary bijections can be deduced from
the provable existence, in intuitionistic type theory, of any bijections at
all.
","[{""version"":""v1"",""created"":""Fri, 20 May 1994 00:00:00 GMT""},{""version"":""v2"",""created"":""Fri, 23 Aug 2019 19:01:01 GMT""}]","2019-08-27"
"nucl-th/9405024","Murray Moinester","Murray A. Moinester","Two-Meson and Multi-Pion Final States from 600 Gev Pion Interactions","19 pages text (latex). This replaced paper has minor grammatical and
  proofreading changes",,,"TAUP-2154-94","nucl-th hep-ph",,"  This report describes the transitions pion -> meson_1 + meson_2 and also pion
-> multi-pion for high energy pions interacting with target nuclei (Z,A). The
physics interests are: A) Nuclear inelastic coherent diffraction cross sections
for pions, for studies of size fluctuations in the pion wave function. B)
Radiative widths of excited meson states, for tests of vector dominance and
quark models. C) Experimental determination of the pi- + rho -> pi- + gamma
total reaction rate for gamma production above 0.7 GeV, needed for background
studies of quark-gluon plasma formation experiments. D) Investigation of the
gamma ->3 pi vertex in pion pair production by a pion, for a significantly
improved test of the hypothesis of chiral anomalies. The physics interest and
associated bibliography are summarized here; with particular reference to the
200-600 GeV beams available at FNAL and CERN. Complementary GEANT simulations
and trigger studies are needed.
","[{""version"":""v1"",""created"":""Fri, 20 May 1994 14:10:21 GMT""},{""version"":""v2"",""created"":""Sun, 22 May 1994 16:25:17 GMT""}]","2016-09-08"
