"astro-ph/9406059","Andrew P. Gould","Andrew Gould","Analytic Error Estimates","13 pages, phyzzx","Astrophys.J. 440 (1995) 510","10.1086/175292","OSU-TA-8/94","astro-ph",,"  I present an analytic method for estimating the errors in fitting a
distribution. A well-known theorem from statistics gives the minimum variance
bound (MVB) for the uncertainty in estimating a set of parameters $\l_i$, when
a distribution function $F(z;\l_1 ... \l_m)$ is fit to $N$ observations of the
quantity(ies) $z$. For example, a power-law distribution (of two parameters $A$
and $\gaml$) is $F(z;A,\gaml) = A z^{-\gaml}$. I present the MVB in a form
which is suitable for estimating uncertainties in problems of astrophysical
interest. For many distributions, such as a power-law distribution or an
exponential distribution in the presence of a constant background, the MVB can
be evaluated in closed form. I give analytic estimates for the variances in
several astrophysical problems including the gallium solar-neutrino experiments
and the measurement of the polarization induced by a weak gravitational lens. I
show that it is possible to make significant improvements in the accuracy of
these experiments by making simple adjustments in how they are carried out or
analyzed. The actual variance may be above the MVB because of the form of the
distribution function and/or the number of observations. I present simple
methods for recognizing when this occurs and for obtaining a more accurate
estimate of the variance than the MVB when it does.
","[{""version"":""v1"",""created"":""Tue, 21 Jun 1994 21:23:26 GMT""}]","2009-10-22"
"astro-ph/9406061",,"J. W. Moffat","Gravitational Wave Signatures of Superdense Objects in a Nonsingular
  Solution of Gravity Theory","Plain TeX. 9 pages, UTPT-94-14",,,,"astro-ph",,"  A massive gravitationally bound object with a radius $r \leq 2GM/c^2$, which
occurs in the non-singular version of the nonsymmetric gravitational theory
(NGT), replaces the black hole in Einstein gravity theory. This object is kept
stable by the attractive and repulsive forces generated by NGT, as well as
standard matter pressures, and is called a superdense object (SDO). The
luminosity of gravitational waves emitted by a SDO with a red-shift of order
unity is calculated and it is found that it could be a strong source of
gravitational radiation at low frequencies. The active galactic nucleus of M87
is identified with a SDO and the recent observational results obtained by the
Hubble Space Telesope are used to estimate the amplitude of gravitational
radiation.
","[{""version"":""v1"",""created"":""Wed, 22 Jun 1994 08:50:51 GMT""}]","2007-05-23"
"astro-ph/9406062",,"F.R. Ferraro, F. Fusi Pecci, M. Bellazzini","Blue Stragglers in Galactic Globular Clusters: Playing with Specific
  Quantities","18 p. plus 2 tables, plain tex, accepted by Astronomy & Astrophisics,
  6 June 1994, figures upon request, ask to bellazzini@stars.astro.bo.it","Astron.Astrophys.294:80-88,1995",,,"astro-ph",,"  We present preliminary results obtained from the comparison of the specific
frequencies of Blue Straggler Stars (BSS) detected so far in a sample of 26
Galactic globular clusters. The number of BSS seems to increase almost linearly
with increasing the amount of sampled light in loose clusters, while it drops
abruptly for clusters having intermediate-high central densities. In
particular, a simple interpretative scenario where the BSS in loose clusters
are produced from primordial binaries and those detected in high density
globulars are due to star interactions leading to binary formation, merging.
etc. seems compatible with these early results. The possibility that this
observational evidence could be ascribed to systematic biases mostly related to
the increasing difficulty to detect BSS candidates with increasing cluster
concentration, is also discussed.
","[{""version"":""v1"",""created"":""Wed, 22 Jun 1994 15:17:00 GMT""}]","2011-05-23"
"astro-ph/9406063","Bengt Edvardsson","Helena Andersson and Bengt Edvardsson","Carbon Abundances in F and G Dwarfs","9 pages, A&A plain TeX, UAO-94-P89","Astron. Astrophys. 290 (1994) 590",,,"astro-ph",,"  We have determined carbon abundances or upper limits from the forbidden [C I]
line at 8727.13 A for 85 F and early G type main sequence stars, with
metallicities ranging between [Fe/H] = -1.0 and [Fe/H] = +0.25. The [C I] line
has not been previously used for a study of this size. We find that the C/Fe
abundance ratio is slowly decreasing with time and increasing metallicity in
the disk, but with considerable observational scatter. A discussion of results
in the literature supports this result. Our data do not reveal any gradients
with galactocentric birth distance for our stars, but more accurate
observations are desirable since possible gradients should be important to the
question of the synthesis of C and Fe in the disk. (Accepted for publication in
A&A. Postscript text and figures available via anonymous ftp to
""chiron.astro.uu.se"", in directory ""pub/articles/atmos/P89"")
","[{""version"":""v1"",""created"":""Wed, 22 Jun 1994 15:41:54 GMT""}]","2007-05-23"
"chao-dyn/9406008","Jean Bricmont","J.Bricmont (UCL, Physique Th\'eorique, B-1348, Louvain-la-Neuve,
  Belgium), A.Kupiainen (Helsinki University, Department of Mathematics,
  Helsinki 00014, Finland)","Coupled Analytic Maps","22 pages, Latex",,"10.1088/0951-7715/8/3/005","94-204","chao-dyn nlin.CD",,"  We consider a lattice of weakly coupled expanding circle maps. We construct,
via a cluster expansion of the Perron-Frobenius operator, an invariant measure
for these infinite dimensional dynamical systems which exhibits
space-time-chaos.
","[{""version"":""v1"",""created"":""Wed, 22 Jun 1994 09:29:57 GMT""},{""version"":""v2"",""created"":""Fri, 24 Jun 1994 11:42:02 GMT""}]","2009-10-22"
"cmp-lg/9406033","Wu Zhibiao","Zhibiao Wu (National University of Singapore) and Martha Palmer
  (University of Pennsylvania)","Verb Semantics and Lexical Selection","6 pages, Figures and bib files are in part 2","Proceedings of ACL 94",,,"cmp-lg cs.CL",,"  This paper will focus on the semantic representation of verbs in computer
systems and its impact on lexical selection problems in machine translation
(MT). Two groups of English and Chinese verbs are examined to show that lexical
selection must be based on interpretation of the sentence as well as selection
restrictions placed on the verb arguments. A novel representation scheme is
suggested, and is compared to representations with selection restrictions used
in transfer-based MT. We see our approach as closely aligned with
knowledge-based MT approaches (KBMT), and as a separate component that could be
incorporated into existing systems. Examples and experimental results will show
that, using this scheme, inexact matches can achieve correct lexical selection.
","[{""version"":""v1"",""created"":""Wed, 22 Jun 1994 01:51:05 GMT""},{""version"":""v2"",""created"":""Thu, 23 Jun 1994 03:31:01 GMT""},{""version"":""v3"",""created"":""Fri, 24 Jun 1994 03:05:36 GMT""}]","2008-02-03"
"cond-mat/9406085","Piers Coleman","P. Coleman (Rutgers) E. Miranda (Rutgers) and A. Tsvelik (Oxford)","Three Body bound-states and the development of odd frequency pairing",,,"10.1103/PhysRevLett.74.1653",,"cond-mat",,"  We propose that the development of odd-frequency superconductivity is driven
by the collective formation of neutral three body bound-states. Using a
three-body bound-state ansatz we develop a mean-field theory for odd-frequency
pairing within the Kondo Lattice model. Three body bound-state formation leads
to the formation of a gapless band of fermions with a neutral, spinless Fermi
surface. We discuss the low energy excitations of these modes, suggesting them
as a possible explanation for the absence of anisotropy in the thermal
conductivity of heavy fermion superconductors.
","[{""version"":""v1"",""created"":""Tue, 21 Jun 1994 23:01:04 GMT""}]","2009-10-22"
"cond-mat/9406086","John Neergaard","John Neergaard and Marcel den Nijs","Crossover Scaling Functions in One Dimensional Dynamic Growth Models","11 pages, TeX, figures upon request",,"10.1103/PhysRevLett.74.730",,"cond-mat",,"  The crossover from Edwards-Wilkinson ($s=0$) to KPZ ($s>0$) type growth is
studied for the BCSOS model. We calculate the exact numerical values for the
$k=0$ and $2\pi/N$ massgap for $N\leq 18$ using the master equation. We predict
the structure of the crossover scaling function and confirm numerically that
$m_0\simeq 4 (\pi/N)^2 [1+3u^2(s) N/(2\pi^2)]^{0.5}$ and $m_1\simeq 2 (\pi/N)^2
[1+ u^2(s) N/\pi^2]^{0.5}$, with $u(1)=1.03596967$. KPZ type growth is
equivalent to a phase transition in meso-scopic metallic rings where attractive
interactions destroy the persistent current; and to endpoints of facet-ridges
in equilibrium crystal shapes.
","[{""version"":""v1"",""created"":""Tue, 21 Jun 1994 23:57:19 GMT""}]","2009-10-22"
"cond-mat/9406087","Dick van der Marel","Jae H. Kim, H. S. Somal, and D. van der Marel","Damping mechanism for the strongly renormalized $c$-axis charge
  transport in high-$T_c$ cuprate superconductors","4 pages, figures on request. Revtex, version 2, Materials Science
  Center Internal Report Number VSGD.94.6.1","Physica C 247 (1995), 297","10.1016/0921-4534(95)00198-0",,"cond-mat",,"  We analyze the $c$-axis infrared reflectivity of
La$_{1.85}$Sr$_{0.15}$CuO$_4$ single crystals. The plasma edge near 6 meV,
observed below $T_c$, is due to Cooper-pair tunneling. This low value of the
plasma edge is consistent with the $c$-axis plasma frequency ($\nu_p$) obtained
from LDA calculations ($>0.1$ eV) if we take into account that the
single-particle charge transport along the $c$ axis is strongly incoherent both
above and below $T_c$. We find no evidence for a reduction of the $c$-axis
scattering rate ($\gamma$) below $T_c$. Our investigation suggests
$h\gamma>h\nu_{p}\gg 3.5k_BT_c$, which is exactly opposite to the clean limit.
VSGD.94.6.1
","[{""version"":""v1"",""created"":""Wed, 22 Jun 1994 12:05:10 GMT""}]","2009-10-22"
"gr-qc/9406036",,"Chris M. Chambers and Ian G. Moss","A Cosmological No-Hair Theorem","9 pages, NCL94 -TP4, (Revtex)","Phys.Rev.Lett. 73 (1994) 617-620","10.1103/PhysRevLett.73.617",,"gr-qc",,"  A generalisation of Price's theorem is given for application to Inflationary
Cosmologies. Namely, we show that on a Schwarzschild--de Sitter background
there are no static solutions to the wave or gravitational perturbation
equations for modes with angular momentum greater than their intrinsic spin.
","[{""version"":""v1"",""created"":""Tue, 21 Jun 1994 16:27:56 GMT""}]","2009-10-22"
"gr-qc/9406037","Valery P. Frolov","Valeri P.Frolov","Why the Entropy of a Black Hole is $A/4$?","11 pages, Alberta Univ. Preprint Alberta-Thy-22-94","Phys.Rev.Lett.74:3319-3322,1995","10.1103/PhysRevLett.74.3319",,"gr-qc",,"  A black hole considered as a part of a thermodynamical system possesses the
Bekenstein-Hawking entropy $S_H =A_H /(4l_{\mbox{\scriptsize{P}}}^2)$, where
$A_H$ is the area of a black hole surface and $l_{\,\mbox{\scriptsize{P}}}$ is
the Planck length. Recent attempts to connect this entropy with dynamical
degrees of freedom of a black hole generically did not provide the universal
mechanism which allows one to obtain this exact value. We discuss the relation
between the 'dynamical' contribution to the entropy and $S_H$, and show that
the universality of $S_H$ is restored if one takes into account that the
parameters of the internal dynamical degrees of freedom as well as their number
depends on the black hole temperature.
","[{""version"":""v1"",""created"":""Tue, 21 Jun 1994 21:50:20 GMT""}]","2011-05-05"
"hep-ex/9406003","Caren Marzban","R. Kantowski and Caren Marzban","A Neural Network for Locating the Primary Vertex in a Pixel Detector","10 pages in Latex, and now with 9 figures as uufiles, OKHEP-94-11","Nucl.Instrum.Meth.A355:582-588,1995","10.1016/0168-9002(94)01133-8",,"hep-ex",,"  Using simulated collider data for $p+p\rightarrow 2{\rm Jets}\ $ interactions
in a 2-barrel pixel detector, a neural network is trained to construct the
coordinate of the primary vertex to a high degree of accuracy. Three other
estimates of this coordinate are also considered and compared to that of the
neural network. It is shown that the network can match the best of the
traditional estimates.
","[{""version"":""v1"",""created"":""Tue, 21 Jun 1994 22:00:31 GMT""},{""version"":""v2"",""created"":""Thu, 23 Jun 1994 22:13:23 GMT""}]","2010-11-01"
"hep-ph/9406348","W. S. Hou","George W. S. Hou","Direct $CP$ Violation in a Variety of $B$ Decays","7 pages, LaTeX (requires espcrc2.sty, contact: crc@elsevier.nl),
  NTUTH--94--05","Nucl.Phys.Proc.Suppl.37A:35-42,1994","10.1016/0920-5632(94)90731-5",,"hep-ph",,"  We give a brief review of direct $CP$ violation effects in charmless $B$
decays, both at the inclusive and at the exclusive level. It is emphasized that
typical exclusive final states are composed of 2--4 $K$ or $\pi$'s, hence
particle identification (in terms of $K/\pi$ separation) is of crucial
importance for studying $CP$ violation in these modes. Another kind of
``charmless"" final state is also emphasized: $b\to dc\bar c$. The decay rate is
tree dominant, while ``$q^2$"" is necessarily above $c\bar c$ threshold hence in
the domain of perturbative QCD. The $CP$ asymmetry is therefore relatively
clean and reliable. Theoretically, a few $\times 10^7$ $B$'s would suffice if
one could accumulate modes like $B^+\to D^{+\left(*\right)} \bar
D^{0\left(*\right)}$. [To appear in proceedings of ``The Third KEK Topical
Conference on
  CP Violation --- Its Implications to Particle Physics and Cosmology'',
  16--18 November, 1993, KEK, Tsukuba, Japan (Eds. Y. Kuno and Y. Okada).]
","[{""version"":""v1"",""created"":""Tue, 21 Jun 1994 19:35:08 GMT""}]","2015-06-25"
"hep-ph/9406352","Abada","As. Abada","Heavy Flavours Leptonic and Semi-leptonic Decays on the Lattice","7 pages, talk given at the XXIXth Rencontre de Moriond, ``QCD and
  High Energy Hadronic Interactions'', march 1994, M\'eribel France, preprint
  LPTHE Orsay-94/57",,,,"hep-ph",,"  We present some results of the {\bf{ELC}} (European Lattice Collaboration)
study of leptonic and semi-leptonic decays of heavy-light mesons.
  Results on the decay constants $f_D, f_{D_s}$ and $f_B, f_{B_s}$, the
semi-leptonic form factors of $D\longrightarrow K (K^*)$ and some preliminary
estimates of form factors relevant for the $B\longrightarrow \pi , \rho$ are
summarized. The $1/M$ corrections to asymptotic scaling laws are discussed.
","[{""version"":""v1"",""created"":""Tue, 21 Jun 1994 16:35:45 GMT""}]","2007-05-23"
"hep-ph/9406353",,"T.Barnes (Physics Division, Oak Ridge National Laboratory and
  Department of Physics and Astronomy, University of Tennessee)","Hadronic Molecules and Low-Energy Hadron-Hadron Scattering Amplitudes","(Expanded version of results presented at Few Body XIV, Williamsburg,
  Virginia, 26-31 May 1994), LATEX using epsfig and wrapfig. postscript file
  incorporating figures available by anonymous ftp to
  COMPSCI.CAS.VANDERBILT.EDU, subdirectory QSM, file fbpp.ps",,"10.1063/1.48152",,"hep-ph",,"  Recently there has been considerable interest in the subject of molecules,
which are weakly bound states of hadron pairs. The question of the existence of
molecules is closely related to the more general problem of the determination
of low energy hadron-hadron scattering amplitudes, which is widely believed to
require nonperturbative methods. In this contribution we report on quark model
calculations using a simple perturbative scattering mechanism, one gluon
exchange followed by constituent interchange. We refer to the associated
diagrams as ``quark Born diagrams"". For the cases chosen to isolate this
mechanism, I=2 $\pi\pi$, I=3/2 K$\pi$ and KN the results are usually in good
agreement with experimental S-wave scattering amplitudes given standard
potential model parameters, and for NN we find perturbative results very
similar to the nonperturbative hard cores of Oka and Yazaki. We also discuss
our findings for other less familiar channels; these include predictions of
vector-vector bound states, one of which may be the $\theta(1710)$.
","[{""version"":""v1"",""created"":""Tue, 21 Jun 1994 16:10:16 GMT""}]","2015-06-25"
"hep-ph/9406354",,"Gautam Bhattacharyya, John Ellis and K. Sridhar","Bounds on the Masses and Couplings of Leptoquarks from Leptonic Partial
  Widths of the Z","11 pages + 3 Figures (available upon request), Latex file, CERN
  preprint CERN-TH.7280/94","Phys.Lett.B336:100-106,1994; ERRATUM-ibid.B338:522-523,1994","10.1016/0370-2693(94)00927-9",,"hep-ph",,"  The vertex corrections to the leptonic partial widths of the $Z$ induced by
leptoquarks that couple leptons to the top quark are considered. We obtain
stringent bounds on the parameter space of the masses and Yukawa couplings of
these leptoquarks, using the latest information on the $Z \rightarrow l^+l^-$
decay widths measured at LEP. Leptoquarks coupling with electroweak strength to
top quarks are constrained to be heavier than several hundred GeV, at 95$\%$
C.L. As a consequence, such leptoquarks cannot make a significant contribution
to lepton asymmetries, $\tau$ polarisation asymmetries or $A_{LR}$.
","[{""version"":""v1"",""created"":""Tue, 21 Jun 1994 17:08:42 GMT""}]","2009-09-25"
"hep-ph/9406355","Mark Trodden","A.C. Davis (DAMTP, Cambridge), R. Brandenberger and M. Trodden (Brown
  University)","Electroweak Baryogenesis with Topological Defects","13 pages, 1 figure (available from the authors), uses phyzzx,
  BROWN-HET-950, DAMTP 94-46",,,,"hep-ph astro-ph",,"  Electroweak baryogenesis has become a topic of much recent activity [1]. Here
we discuss a new scenario which has the advantage of being insensitive to the
order of the electroweak phase transition. We briefly review a mechanism [2]
using unstable electroweak strings [3] and discuss in detail a mechanism [4]
using topological defects (in particular cosmic strings) left behind after a
previous phase transition.
","[{""version"":""v1"",""created"":""Tue, 21 Jun 1994 17:28:06 GMT""}]","2009-09-25"
"hep-ph/9406356","Michael Joyce","Michael Joyce","A Note on Spontaneous Baryogenesis","4 pages, LaTeX, Princeton University preprint PUHEP-1475 (1994)",,,,"hep-ph",,"  The original calculation of `spontaneous' baryogenesis overlooked the role
played by transport of particles onto the bubbles wall. For typical `adiabatic'
wall thicknesses and velocities one can model the problem in a fluid
approximation and the mechanism is best understood as another limit of `charge
transport' baryogenesis, and can produce a similar non-local effect in front of
the wall. (Based on a talk given at the Workshop on ELECTROWEAK PHYSICS AND THE
EARLY UNIVERSE held at Sintra, Portugal from March 22 to 27, 1994.)
","[{""version"":""v1"",""created"":""Tue, 21 Jun 1994 21:08:47 GMT""}]","2007-05-23"
"hep-ph/9406357",,"A. Arhrib, M. Capdequi Peyranere and G. Moultaka","Fermion and Sfermion Effects in $e^+ e^-$ charged Higgs pair production","latex, 16 pages and 9 figures (appended as a postscript file)
  SLAC--PUB--6529, PM/94-17","Phys.Lett. B341 (1995) 313-324","10.1016/0370-2693(94)01328-A",,"hep-ph",,"  Top and bottom one loop corrections to $e^+e^-\rightarrow H^+ H^-$ are
considered at NLC energies and found to be significantly large and negative
over the full range of $tan \, \beta$. Moreover, loop effects of moderately
heavy squarks and sleptons in the minimal supersymmetric extension of the
standard model, tend to cancel partly or fully these large corrections, thus
providing a useful indirect information about the supersymmetric sector. The
overall effect can still range between $-25 \%$ and $+25 \%$, however lies
typically around $-10 \%$ in a wide range of the model parameters.
","[{""version"":""v1"",""created"":""Wed, 22 Jun 1994 04:41:00 GMT""}]","2009-10-28"
"hep-ph/9406358",,"J. Bernab\'eu, S.M. Bilenky, F.J. Botella, J.A. Pe\~narrocha and J.
  Segura","Neutrino Mass and Magnetic Moment from Neutrino-Electron Scattering","13 pages (+6 figures, available upon request),Standard Latex,
  FTUV/94-29,Submitted to ICHEP94",,,,"hep-ph",,"  We study both the elastic ($\nu e \rightarrow \nu e$) and the radiative
process ($\nu e \rightarrow \nu e \gamma$) and discuss how these processes can
shed light on some current topics in neutrino physics such as a neutrino
magnetic moment and neutrino oscillations. The radiative process allows to
reach low values of $Q^2$ without the need to operate at very small energies of
recoil electrons, a favourable scenario to search for a neutrino magnetic
moment. The elastic cross section contains a dynamical zero at $E_{\nu}=m/(4
sin^2\theta_{W})$ and forward electrons for the electron antineutrino channel,
which is reachable at reactor facilities and accessible after the convolution
with the antineutrino spectrum. The implication for lepton flavour changing
transitions in that energy region searched for in neutrino oscillation
experiments, which combine disappearance and appearance rates, is discussed.
","[{""version"":""v1"",""created"":""Wed, 22 Jun 1994 09:57:13 GMT""}]","2016-08-14"
"hep-ph/9406359","Annette Holtkamp","J.G. Koerner, D. Pirjol, M. Kraemer","Heavy baryons","93 pages, 18 figures not included, latex, DESY 94-095, MZ-THEP-94-08","Prog.Part.Nucl.Phys.33:787-868,1994","10.1016/0146-6410(94)90053-1",,"hep-ph",,"  We review the experimental and theoretical status of baryons containing one
heavy quark. The charm and bottom baryon states are classified and their mass
spectra are listed. The appropriate theoretical framework for the description
of heavy baryons is the Heavy Quark Effective Theory, whose general ideas and
methods are introduced and illustrated in specific examples. We present simple
covariant expressions for the spin wave functions of heavy baryons including
p--wave baryons. The covariant spin wave functions are used to determine the
Heavy Quark Symmetry structure of flavour--changing current--induced
transitions between heavy baryons as well as one--pion and one--photon
transitions between heavy baryons of the same flavour. We discuss $1/m_Q$
corrections to the current--induced transitions as well as the structure of
heavy to light baryon transitions. Whenever possible we attempt to present
numbers to compare with experiment by making use of further model--dependent
assumptions as e.g. the constituent picture for light quarks. We highlight
recent advances in the theoretical understanding of the inclusive decays of
hadrons containing one heavy quark including polarization. For exclusive
semileptonic decays we discuss rates, angular decay distributions and
polarization effects. We provide an update of the experimental and theoretical
status of lifetimes of heavy baryons and of exclusive nonleptonic two body
decays of charm baryons.
","[{""version"":""v1"",""created"":""Wed, 22 Jun 1994 09:43:14 GMT""}]","2011-01-25"
"hep-ph/9406360","Robert Peschanski","A. Bialas and R. Peschanski","Intermittency and Exotic Channels","5 p., plain tex, preprint T94/078(Saclay), LPTHE 94/58(Orsay)","Phys.Rev.D50:6003-6004,1994","10.1103/PhysRevD.50.6003",,"hep-ph",,"  It is pointed out that accurate measurements of short-range two-particle
correlations in like-charge $ K\pi $ and in $ \pi^ 0\pi^ 0$ channels should be
very helpful in determining the origin of the \lq\lq intermittency\rq\rq\
phenomenon observed recently for the like-charge pion pairs.
","[{""version"":""v1"",""created"":""Wed, 22 Jun 1994 09:42:57 GMT""}]","2008-11-26"
"hep-ph/9406361",,"C.H. Jin, W.F. Palmer, and E.A. Paschos","Semileptonic B-Meson Decays in the Parton Model","8 pages (7 figures available upon request), Latex file, talk given at
  the XXIXth Rencontres de Moriond, ``Electroweak Interactions and Unified
  Theories'', M\'eribel, France, March 12--19, 1994, DO-TH 94/12",,,,"hep-ph",,"  We study the inclusive semileptonic B decays in the parton model. The model
gives a decay spectrum which is in excellent agreement with experiment and
makes several predictions to be tested in the forseeable future.
","[{""version"":""v1"",""created"":""Wed, 22 Jun 1994 11:55:00 GMT""}]","2009-09-25"
"hep-ph/9406362","Dam Thanh Son","V. A. Rubakov and D. T. Son","Renormalization Group for Multiparticle Production in (2+1) Dimensions
  Around the Threshold","based on talk at International Seminar Quarks-94, 11-18 May 1994,
  Vladimir, Russia, REVTEX 3.0, 13pp, 3 figures included (use bezier.sty)",,,,"hep-ph",,"  Multiparticle production in (2+1) dimensions is investigated. We show that in
a small region around the threshold the perturbation theory becomes
unapplicable due to infrared divergencies in a class of Feynman graphs with
rescattering in final state. We develop a technique based on renormalization
group for summing up leading logarithms and apply it to the $\phi^4$ models
with and without symmetry breaking and to the $O(N)$ $\phi^4$ theory.
","[{""version"":""v1"",""created"":""Wed, 22 Jun 1994 13:02:11 GMT""}]","2007-05-23"
