"hep-ph/9406363","Oleg Tarasov","L. Avdeev, J. Fleischer, S. Mikhailov, O. Tarasov","$O(\alpha \alpha_s^2)$ correction to the electroweak $\rho$ parameter","9 pages, LaTeX. This is the corrected version with $\zeta(4)$
  coefficient fixed","Phys.Lett.B336:560-566,1994; ERRATUM-ibid.B349:597-598,1995","10.1016/0370-2693(94)90573-8","BI-TP-93/60, Phys. Lett. B 336 (1994) 560","hep-ph",,"  The three-loop QCD contributions to the vacuum polarization functions of the
$Z$ and $W$ bosons at zero momentum are calculated. The top quark is considered
to be massive and the other quarks massless. Using these results, we calculate
the correction to the electroweak $\rho$ parameter. All computations are done
in the framework of dimensional regularization as well as regularization by
dimensional reduction. We use recurrence relations obtained by the method of
integration by parts to reduce all integrals to a small set of master
integrals. A comparison of the two-loop and three-loop QCD corrections to the
$\rho$ parameter is performed.
","[{""version"":""v1"",""created"":""Wed, 22 Jun 1994 14:48:38 GMT""},{""version"":""v2"",""created"":""Wed, 15 Feb 1995 10:04:13 GMT""}]","2011-01-13"
"hep-ph/9406364","Paco del Aguila","F. del Aguila, M. Masip and L. da Mota","Patterns of quark mass matrices in a class of Calabi-Yau models","30 (including Tables and Figures), UG-FT-38/94","Nucl.Phys. B440 (1995) 3-23","10.1016/0550-3213(94)00596-7",,"hep-ph",,"  We study a class of superstring models compactified in the 3-generation
Calabi-Yau manifold of Tian and Yau. Our analysis includes the complete
$E_6$-singlet sector, which has been recently evaluated using techniques of
spectral and exact sequences. We use the discrete symmetries of the models to
find flat directions of symmetry breaking that leave unbroken a low energy
matter parity and make all leptoquarks heavy while preserving light Higgs
fields. Then we classify the patterns of ordinary quark mass matrices and show
that (without invoking effects due to nonrenormalizable terms) only one
structure can accommodate the observed value of fermion masses and mixing
angles, with preference for a heavy {\it top} quark ( $m_t\ge 170$ GeV for
$V_{13}\le 0.013$ ). The model, which unifies perturbatively and predicts a
realistic structure of quark mass matrices with texture zeroes, is one of the
many possible string vacua. However, in contrast with what is often assumed in
the search for realistic unified scenarios, it is highly nonminimal near the
unification scale and the predicted mass matrices have no simple symmetry
properties.
","[{""version"":""v1"",""created"":""Wed, 22 Jun 1994 14:39:06 GMT""}]","2009-10-28"
"hep-ph/9406366","Stephen S. Kelley","John S. Hagelin, S. Kelley, and Veronique Ziegler","Using Gauge Coupling Unification and Proton Decay to Test Minimal
  Supersymmetric SU(5)","10 pages (2 figures not included, available upon request),
  MIU-THP-94/68","Phys.Lett.B342:145-151,1995","10.1016/0370-2693(94)01331-6",,"hep-ph",,"  We derive a one-loop expression, including all thresholds, for the mass of
the proton decay mediating color triplets, $M_{D^c}$, in minimal supersymmetric
SU(5). The result for $M_{D^c}$ does not depend on other heavy thresholds or
extra representations with SU(5) invariant masses which might be added to the
minimal model. We numerically correct our result to two-loop accuracy. Choosing
inputs to maximize $M_{D^c}$ and $\tau_P$, within experimental limits on the
inputs and a $1~TeV$ naturalness bound, we derive a strict bound
$\alpha_3>0.117$. We discuss how this bound will change as experimental limits
improve. Measurements of $\alpha_3$ from deep inelastic scattering and the
charmonium spectrum are below the bound $\alpha_3>0.117$ by more than
$3\sigma$. We briefly review several ideas of how to resolve the discrepancy
between these low values of $\alpha_3$ and the determinations of $\alpha_3$
from LEP event shapes.
","[{""version"":""v1"",""created"":""Wed, 22 Jun 1994 03:38:51 GMT""}]","2011-07-19"
"hep-th/9406137",,"Cesar Gomez, Henri Ruegg, and Philippe Zaugg","Lattice Poincare as a quantum deformed algebra","plain.tex, 10 pages, shortened harvmac macros included",,,,"hep-th",,"  We propose a definition of a Poincar\'e algebra for a two dimensional
space--time with one discretized dimension. This algebra has the structure of a
Hopf algebra. We use the link between Onsager's uniformization of the Ising
model and the dispersion relation of a free particle in this space--time,
together with the rapidity representation of the quantum deformation of the
Poincar\'e enveloping algebra.
","[{""version"":""v1"",""created"":""Tue, 21 Jun 1994 16:50:01 GMT""}]","2007-05-23"
"hep-th/9406138","Desmond Johnston","D. Johnston","Frustrating and Diluting Dynamical Lattice Ising Spins","7pages, LaTex , LPTHE-ORSAY-94-56","Phys.Lett. B336 (1994) 229-236","10.1016/0370-2693(94)90243-7",,"hep-th cond-mat",,"  We investigate what happens to the third order ferromagnetic phase transition
displayed by the Ising model on various dynamical planar lattices (ie coupled
to 2D quantum gravity) when we introduce annealed bond disorder in the form of
either antiferromagnetic couplings or null couplings. We also look at the
effect of such disordering for the Ising model on general $\phi^3$ and $\phi^4$
Feynman diagrams.
","[{""version"":""v1"",""created"":""Tue, 21 Jun 1994 16:48:09 GMT""}]","2009-10-28"
"hep-th/9406139","Desmond Johnston","D. Johnston","A Remark on the Renormalization Group Equation for the Penner Model","LaTeX, 5 pages, LPTHE-Orsay-94-59","Phys.Rev. D51 (1995) 2014-2017","10.1103/PhysRevD.51.2014",,"hep-th",,"  It is possible to extract values for critical couplings and gamma_string in
matrix models by deriving a renormalization group equation for the variation of
the of the free energy as the size N of the matrices in the theory is varied.
In this paper we derive a ``renormalization group equation'' for the Penner
model by direct differentiation of the partition function and show that it
reproduces the correct values of the critical coupling and gamma_string and is
consistent with the logarithmic corrections present for g=0,1.
","[{""version"":""v1"",""created"":""Tue, 21 Jun 1994 16:59:10 GMT""}]","2009-10-28"
"hep-th/9406140","Simeon Vishik","Maxim Kontsevich, Simeon Vishik","Geometry of determinants of elliptic operators","25 pages",,,,"hep-th math.DG",,"  This paper is essentially a short version of hep-th/9404046. We compute
multiplicative anomaly det(AB)/(detA detB) =F(A,B) for elliptic
pseudo-differential operators (PDOs) A, B on a closed manifold M in terms of
their symbols. We prove that F(A,B)=1 for elliptic differential operators close
to positive-definite ones on an odd-dimensional M. For such M we introduce a
holomorphic determinant. Its monodromy lies in a finite group of roots of
unity.
  In general case, we relate the multiplicative anomaly with a central
extension of the group of elliptic symbols and with an invariant quadratic form
on this extension. We compute the Lie algebra of the central extension in terms
of logarithmic symbols. The main tool is a new trace-type functional defined on
classical PDOs of non-integer orders. A canonical det of elliptic PDOs
generalizing the zeta-regularized det is introduced.
","[{""version"":""v1"",""created"":""Tue, 21 Jun 1994 16:29:17 GMT""}]","2016-09-06"
"hep-th/9406141","Costas Efthimiou","Costas Efthimiou","Form Factors of 2-D Integrable Models Using Radial Quantization","(talk given at the MRST meeting, held at McGill University) Cornell
  preprint CLNS 94/1289",,,,"hep-th",,"  We review some ideas from a recent construction which introduced the notion
of vertex operators and form factors as vacuum expectation values of related
vertex operators in the space of fields. The vertex operators are constructed
explicitly in radial quantization. These ideas are explained at the
free-fermion point of the sine-Gordon theory.
","[{""version"":""v1"",""created"":""Wed, 22 Jun 1994 00:09:22 GMT""}]","2009-09-25"
"hep-th/9406142",,"A. Isar","Damped quantum harmonic oscillator: density operator and related
  quantities","11 pages, IFA-FT-396-1994, LaTex","Helv.Phys.Acta 68 (1995) 225-234",,,"hep-th",,"  A closed expression for the density operator of the damped harmonic
oscillator is extracted from the master equation based on the Lindblad theory
for open quantum systems. The entropy and effective temperature of the system
are subsequently calculated and their temporal behaviour is surveyed by showing
how these quantities relax to their equilibrium values. The entropy for a state
characterized by a Wigner distribution function which is Gaussian in form is
found to depend only on the variance of the distribution function.
","[{""version"":""v1"",""created"":""Wed, 22 Jun 1994 06:42:00 GMT""}]","2007-05-23"
"hep-th/9406143",,"V.V.Dodonov, I.M.Dremin, V.I.Man'ko, P.G. Polynkin","Strong oscillations of cumulants of photon distribution function in
  slightly squeezed states","LATEX, 16 pages,5 figures, INFN-NA-IV-94/22, DSF-T-94/22","Phys.Lett. A193 (1994) 209-217","10.1016/0375-9601(94)90585-1",,"hep-th",,"  The cumulants and factorial moments of photon distribution for squeezed and
correlated light are calculated in terms of Chebyshev, Legendre and Laguerre
polynomials. The phenomenon of strong oscillations of the ratio of the cumulant
to factorial moment is found.
","[{""version"":""v1"",""created"":""Wed, 22 Jun 1994 08:44:14 GMT""}]","2009-10-28"
"hep-th/9406144",,"J.S.Dowker","Effective actions with fixed points, (error in derivation of coefficient
  corrected)","10p,uses JyTeX,MUTP/94/14","Phys.Rev.D50:6369-6373,1994","10.1103/PhysRevD.50.6369",,"hep-th gr-qc",,"  The specific form of the constant term in the asymptotic expansion of the
heat-kernel on an axially-symmetric space with a codimension two fixed-point
set of conical singularities is used to determine the associated conformal
change of the effective action in four dimensions. Another derivation of the
relevant coefficient is presented.
","[{""version"":""v1"",""created"":""Wed, 22 Jun 1994 11:22:50 GMT""},{""version"":""v2"",""created"":""Tue, 28 Jun 1994 07:59:20 GMT""}]","2011-07-19"
"hep-th/9406145",,"Sergei D. Odintsov, August Romeo and Robin W. Tucker","Dynamical Generation of Spacetime Signature by Massive Quantum Fields on
  a Topologically Non-Trivial Background",,"Class.Quant.Grav.11:2951-2960,1994","10.1088/0264-9381/11/12/010",,"hep-th",,"  The effective potential for a dynamical Wick field (dynamical signature)
induced by the quantum effects of massive fields on a topologically non-trivial
$D$ dimensional background is considered. It is shown that when the radius of
the compactified dimension is very small compared with $\Lambda^{1/2}$ (where
$\Lambda$ is a proper-time cutoff), a flat metric with Lorentzian signature is
preferred on ${\bf R}^4 \times {\bf S}^1$. When the compactification radius
becomes larger a careful analysis of the 1-loop effective potential indicates
that a Lorentzian signature is preferred in both $D=6$ and $D=4$ and that these
results are relatively stable under metrical perturbations.
","[{""version"":""v1"",""created"":""Wed, 22 Jun 1994 13:21:50 GMT""}]","2010-04-06"
"hep-th/9406147","Chris Eilbeck","A.C. Scott, J.C. Eilbeck, and H. Gilh{\o}j","Quantum Lattice Solitons","21 pages, 1 figure",,"10.1016/0167-2789(94)90115-5",,"hep-th",,"  The number state method is used to study soliton bands for three anharmonic
quantum lattices: i) The discrete nonlinear Schr\""{o}dinger equation, ii) The
Ablowitz-Ladik system, and iii) A fermionic polaron model. Each of these
systems is assumed to have $f$-fold translational symmetry in one spatial
dimension, where $f$ is the number of freedoms (lattice points). At the second
quantum level $(n=2)$ we calculate exact eigenfunctions and energies of pure
quantum states, from which we determine binding energy $(E_{\rm b})$, effective
mass $(m^{*})$ and maximum group velocity $(V_{\rm m})$ of the soliton bands as
functions of the anharmonicity in the limit $f \to \infty$. For arbitrary
values of $n$ we have asymptotic expressions for $E_{\rm b}$, $m^{*}$, and
$V_{\rm m}$ as functions of the anharmonicity in the limits of large and small
anharmonicity. Using these expressions we discuss and describe wave packets of
pure eigenstates that correspond to classical solitons.
","[{""version"":""v1"",""created"":""Wed, 22 Jun 1994 15:24:06 GMT""}]","2009-10-28"
"hep-th/9406148",,"A. Chamorro and K. S. Virbhadra","A radiating dyon solution","9 pages, LaTex","Pramana - J. Phys. 45 181 (1995)","10.1007/BF02848261",,"hep-th astro-ph gr-qc",,"  We give a non-static exact solution of the Einstein-Maxwell equations (with
null fluid), which is a non-static magnetic charge generalization to the
Bonnor-Vaidya solution and describes the gravitational and electromagnetic
fields of a nonrotating massive radiating dyon. In addition, using the
energy-momentum pseudotensors of Einstein and Landau and Lifshitz we obtain the
energy, momentum, and power output of the radiating dyon and find that both
prescriptions give the same result.
","[{""version"":""v1"",""created"":""Wed, 22 Jun 1994 15:41:00 GMT""},{""version"":""v2"",""created"":""Thu, 16 May 1996 06:24:00 GMT""}]","2009-10-28"
"hep-th/9406152",,"M.V.Terentiev","Dual Supergravity in D=10, N=1 Superspace with Tree-Level Superstring
  Corrections","11 pages, report 55-94 ITEP","Phys.Lett. B325 (1994) 96-102","10.1016/0370-2693(94)90077-9",,"hep-th",,"  The dual version of the D=10 N=1 supergravity (SUGRA) is considered in the
superspace approach. The superstring (anomaly compensating) corrections are
described by the 3-form superfield $A_{abc}$ . The complete set of dynamical
equations for the $A$-field and for physical fields of the theory are
presented. The solution of the $A$-field equations as a finite order polynomial
in terms of curvature and graviphoton superfields is given. It makes possible
to incorporate some of the superstring corrections in the dual supergravity in
the explicit, supersymmetric and closed form.
","[{""version"":""v1"",""created"":""Wed, 22 Jun 1994 15:02:56 GMT""}]","2009-10-28"
"nucl-th/9406026",,"Kevin Haglin","Photons from axial-vector radiative decay in a hadron gas","10 pages + 7 figures uuencoded in separate file, MSUCL-926","Phys.Rev.C50:1688-1694,1994","10.1103/PhysRevC.50.1688",,"nucl-th hep-ph",,"  Strange and non-strange axial-vector meson radiative decays contribute to
photon production in hadron gas. One- and two-hadron radiative decay modes of
$b_{1}(1235)$, $a_{1}(1260)$ and $K_{1}(1270)$ are studied. At 200 MeV
temperature and for a narrow range in photon energies they contribute more to
the net thermal photon production rate than $\pi\rho\rightarrow \pi\gamma$,
$\pi\pi\rightarrow \rho\gamma$ or $\rho\rightarrow\pi\pi\gamma$. They provide
significant contribution to the rate for photon energies as high as 1.5--2.0
GeV. For higher energies they are less important.
","[{""version"":""v1"",""created"":""Tue, 21 Jun 1994 20:45:00 GMT""}]","2009-09-25"
