"hep-th/9410062",,"M.Pitk\""anen","p-Adic description of Higgs mechanism V: New Physics","37 pages,latex. Revision: correction of error in the calculation of
  CKM matrix and reconsideration of top quark mass problem",,,,"hep-th",,"  TGD suggests the existence of two new branches of physics, namely M_{89}
hadron physics and M_{127} leptohadron physics. Leptons and U type quarks are
predicted to have light colored excitations. The anomalous production of e^+e^-
pairs in heavy ion collisions sup- ports the existence of light leptomeson but
there are objections against light exotics. a) Asymptotic freedom in the
standard sense might be lost: the recently identified exotic color bosons
however save the situation. b) Z^0 decay width seems to exclude light exotics.
The solution of the problem relies on p-adic probability concept. The real
counterpart (\sum_jP(ito j))_R for the sum of p-adic probabi- lities differs
from the sum \sum_j P(i toj)_R for the real counter- parts of p-adic
probabilities. Interpretation:(\sum_jP(i to j))_R is used, when only a common
signature for final states is used. \sum_j(P(i to j)_R is used, when each final
state is monitored separately. The total decay rate of $Z^0$ to unmonitored
exotic leptons is sensitive to the value of \theta_W(eff) and vanishes for
sin^2(\theta_W(eff))=0.2324 and sensible value of \alpha_s(L)! In TGD the
observed top quark candidate most probably corresponds to u and d quarks of
M_{89} hadron physics. The details of the identification and signatures of the
new Physics are discussed.
","[{""version"":""v1"",""created"":""Mon, 10 Oct 1994 12:46:15 GMT""},{""version"":""v2"",""created"":""Fri, 28 Oct 1994 09:50:48 GMT""},{""version"":""v3"",""created"":""Thu, 15 Jun 1995 08:50:33 GMT""}]","2008-02-03"
"hep-th/9410063","Robert W. Carroll","Robert Carroll (Mathematics Dept., University of Illinois, Urbana, IL)","On dispersionless Hirota type equations","10 pages, latex (need only run once)",,,,"hep-th",,"  Dispersionless Hirota type equations are extracted from the dispersionless
limit of the Fay differential identity due to Takasaki- Takebe. A few other
results are sketched between inverse scattering, dKdV, and gravity.
","[{""version"":""v1"",""created"":""Mon, 10 Oct 1994 13:54:35 GMT""}]","2007-05-23"
"hep-th/9410064","Vadim Zeitlin","Vadim Zeitlin","QED$_{2+1}$ with Nonzero Fermion Density and Quantum Hall Effect","8 pages, LaTeX; FIAN/TD/94-09","Phys. Lett. B352 (1995) 422","10.1016/0370-2693(95)00488-7",,"hep-th cond-mat",,"  A general expression for the conductivity in the QED$_{2+1}$ with nonzero
fermion density in the uniform magnetic field is derived. It is shown that the
conductivity is entirely determined by the Chern-Simons coefficient:
$\sigma_{ij}=\varepsilon_{ij}~{\cal C}$ and is a step-function of the chemical
potential and the magnetic field.
","[{""version"":""v1"",""created"":""Mon, 10 Oct 1994 13:58:51 GMT""}]","2009-10-28"
"hep-th/9410065","Gerald Dunne","Gerald Dunne","Self-Dual Chern-Simons Theories","42 pages LaTeX",,"10.1007/978-3-540-44777-1",,"hep-th",,"  In these lectures I review classical aspects of the self-dual Chern-Simons
systems which describe charged scalar fields in $2+1$ dimensions coupled to a
gauge field whose dynamics is provided by a pure Chern-Simons Lagrangian. These
self-dual models have one realization with nonrelativistic dynamics for the
scalar fields, and another with relativistic dynamics for the scalars. In each
model, the energy density may be minimized by a Bogomol'nyi bound which is
saturated by solutions to a set of first-order self-duality equations. In the
nonrelativistic case the self-dual potential is quartic, the system possesses a
dynamical conformal symmetry, and the self-dual solutions are equivalent to the
static zero energy solutions of the equations of motion. The nonrelativistic
self-duality equations are integrable and all finite charge solutions may be
found. In the relativistic case the self-dual potential is sixth order and the
self-dual Lagrangian may be embedded in a model with an extended supersymmetry.
The self-dual potential has a rich structure of degenerate classical minima,
and the vacuum masses generated by the Chern-Simons Higgs mechanism reflect the
self-dual nature of the potential.
","[{""version"":""v1"",""created"":""Mon, 10 Oct 1994 13:58:52 GMT""}]","2015-06-26"
"hep-th/9410072",,"Viqar Husain","The Affine symmetry of self-dual gravity","20 pages, RevTex, a few presentational changes - version to appear in
  J. Math. Phys","J.Math.Phys. 36 (1995) 6897-6906","10.1063/1.531197","Alberta-Thy-26-94","hep-th gr-qc",,"  Self-dual gravity may be reformulated as the two dimensional principal chiral
model with the group of area preserving diffeomorphisms as its gauge group.
Using this formulation, it is shown that self-dual gravity contains an infinite
dimensional hidden symmetry whose generators form the Affine (Kac-Moody)
algebra associated with the Lie algebra of area preserving diffeomorphisms.
This result provides an observable algebra and a solution generating technique
for self-dual gravity.
","[{""version"":""v1"",""created"":""Mon, 10 Oct 1994 09:35:42 GMT""},{""version"":""v2"",""created"":""Mon, 14 Aug 1995 17:17:28 GMT""}]","2009-10-28"
"hep-th/9410105","Gautam Mandal","Avinash Dhar, Gautam Mandal and Spenta R. Wadia","Leading Large N Modification of QCD_2 on a Cylinder by Dynamical
  Fermions","24 pages, TIFR-TH-94/36","Nucl.Phys. B436 (1995) 487-506","10.1016/0550-3213(94)00535-M",,"hep-th",,"  We consider 2-dimensional QCD on a cylinder, where space is a circle. We find
the ground state of the system in case of massless quarks in a $1/N$ expansion.
We find that coupling to fermions nontrivially modifies the large $N$ saddle
point of the gauge theory due to the phenomenon of `decompactification' of
eigenvalues of the gauge field. We calculate the vacuum energy and the vacuum
expectation value of the Wilson loop operator both of which show a nontrivial
dependence on the number of quarks flavours at the leading order in $1/N$.
","[{""version"":""v1"",""created"":""Mon, 10 Oct 1994 15:34:16 GMT""}]","2016-09-06"
"nucl-th/9410018","Wally Melnitchouk","W.Melnitchouk (U.Regensburg) and A.W.Thomas (U.Adelaide)","Pion Content of the Nucleon in Polarized Semi-Inclusive D.I.s","to appear in Proceedings of the Workshop on CEBAF at Higher Energies
  (April 1994); 9 pages, 3 uuencoded figures, ADP-94-6/T148",,,,"nucl-th hep-ph",,"  An explicit pionic component of the nucleon may be identified by measuring
polarized $\Delta^{++}$ fragments produced in deep-inelastic scattering off
polarized protons. The pion-exchange model predicts highly correlated
polarizations of the $\Delta^{++}$ and target proton, in marked contrast with
the competing diquark fragmentation process.
","[{""version"":""v1"",""created"":""Mon, 10 Oct 1994 10:13:20 GMT""}]","2007-05-23"
"nucl-th/9410019",,"D. Van Neck, A.E.L. Dieperink and E. Moya de Guerra","The Spectral Function for Finite Nuclei in the Local Density
  Approximation","21 pages + 9 figures available upon request, RevTex, preprint
  KVI-1087","Phys.Rev.C51:1800-1808,1995","10.1103/PhysRevC.51.1800",,"nucl-th",,"  The spectral function for finite nuclei is computed within the framework of
the Local Density Approximation, starting from nuclear matter spectral
functions obtained with a realistic nucleon-nucleon interaction. The spectral
function is decomposed into a single-particle part and a ''correlated'' part;
the latter is treated in the local density approximation.
  As an application momentum distributions, quasi-particle strengths and
overlap functions for valence hole states, and the light-cone momentum
distribution in finite nuclei are computed.
","[{""version"":""v1"",""created"":""Mon, 10 Oct 1994 11:59:07 GMT""}]","2008-11-26"
