"hep-ph/9410260","Markus Finkemeier","R. Decker, M. Finkemeier, P. Heiliger and H.H. Jonsson","Tau Decays into Four Pions","12 pages, 12 figures (appended). Revised version: Minor changes in
  presentation and references. Fortran code included with tex source.","Z.Phys. C70 (1996) 247-254",,"TTP 94-13, LNF-94/066(IR)","hep-ph",,"  We compute branching ratios and invariant mass distributions of the tau
decays into four pions. The hadronic matrix elements are obtained by starting
from the structure of the hadronic current in chiral limit and then
implementing low-lying resonances in the different channels. Reasonable
agreement with experiment is obtained both for the $\tau \to \nu_{\tau} + (4
\pi ) $ decay rates and the $e^+e^- \to (4 \pi ) $ cross sections. Furthermore
we supply an interface to use our matrix elements within the Tauola Monte-Carlo
program.
","[{""version"":""v1"",""created"":""Tue, 11 Oct 1994 13:53:42 GMT""},{""version"":""v2"",""created"":""Thu, 11 May 1995 15:02:34 GMT""}]","2009-09-25"
"hep-ph/9410261",,"S. Barshay and P. Heiliger","Some Properties of a Transient New Coherent Condition of Matter Formed
  in High--Energy Hadronic Collisions","23 pages, LaTeX. A complete postscript file is available via
  anonymous ftp at ttpux2.physik.uni-karlsruhe.de (129.13.102.139) as /ttp94-18
  /ttp94-18.ps, Local preprint# TTP94-18","Z.Phys. C66 (1995) 459-466","10.1007/BF01556372",,"hep-ph",,"  We investigate the dynamical possibility for the formation of a transient new
coherent condition of matter in high--energy hadronic collisions. The coherent
bosonic amplitude is characterized by a non--zero momentum and is sustained by
$P $--wave interactions of quasi--pions in a dense fermionic medium. We make
quantitative estimates of several essential properties: the condensate momentum
and the fermionic density, the size of the coherent amplitude and the negative
energy density contributed by the condensate, a characteristic proper time for
the system to exist prior to breakdown into a few pions, and a characteristic
extension of the system over the plane perpendicular to the collision axis.
These quantities then allow us to make definite estimates of new signals: a few
pions with anomalously small transverse momenta $\leq 50 $ MeV/c; and a
possible anomalous bremsstrahlung of very soft photons with characteristic
transverse momenta as low as about 4 MeV/c.
","[{""version"":""v1"",""created"":""Tue, 11 Oct 1994 13:54:59 GMT""}]","2009-10-28"
"hep-ph/9410262","Godbole Rohini M.","M. Nowakowski and S.D. Rindani","Astrophysical Limits on Gravitino Mass","14 pages in Latex,PRL-TH-94/18","Phys.Lett. B348 (1995) 115-120","10.1016/0370-2693(95)00116-3",,"hep-ph",,"  We calculate exotic cooling rates of stars due to photo-production of light
particles (mostly scalars and pseudoscalars) which originate from the hidden
sector of no scale supergravity theories. Using this we can restrict the
gravitino mass $m_{3/2}$. The range of eliminated values of $m_{3/2}$ stretches
over six orders of magnitude and is given by $\displaystyle{2 \times 10^8 <
{m_{\tilde g} \over m_{3/2}} < 6 \times 10^{13}}$, $m_{\tilde g}$ being the
gluino mass. Combining our result with the earlier analysis from colliders
($\displaystyle{ {m_{\tilde g} \over m_{3/2}} < 2.7 \times 10^{14}}$) we
conclude that $\displaystyle{{m_{\tilde g} \over m_{3/2}} < {\cal O}(10^8)}$
except for a narrow window around $10^{14}$. Together with the current
experimental limit on $m_{\tilde{g}}$ and cosmological constraints on
$m_{3/2}$, albeit model dependent, our analysis shows that a light gravitino is
on the verge of being ruled out.
","[{""version"":""v1"",""created"":""Tue, 11 Oct 1994 14:21:58 GMT""}]","2009-10-28"
"hep-ph/9410263","Josef Hartmann","J.Hartmann, F.Beck and W. Bentz","Elimination of the Landau Ghost from Chiral Solitons","14 pages, Latex, figures available upon request, submitted to
  Phys.Rev. C#","Phys.Rev.C50:3088-3093,1994","10.1103/PhysRevC.50.3088",,"hep-ph",,"  We show a practical way based on the K\""{a}ll\'{e}n-Lehmann representation
for the two-point functions to eliminate the instability of the vacuum against
formation of small sized meson configurations in the chiral $\sigma$ model.
","[{""version"":""v1"",""created"":""Tue, 11 Oct 1994 15:22:40 GMT""}]","2009-09-25"
"hep-ph/9410291","Anirban Kundu","Anirban Kundu and Sreerup Raychaudhuri","Taming the Scalar Mass Problem with a Singlet Higgs Boson","(LaTeX file), 13 pages, preprint no. SINP-TNP/94-12","Phys.Rev. D53 (1996) 4042-4048","10.1103/PhysRevD.53.4042",,"hep-ph",,"  We investigate the fine-tuning problem in the Standard Model and show that
Higgs boson and top quark masses consistent with current experimental bounds
cannot be obtained unless one extends the particle spectrum. A minimal
extension which achieves this involves addition of a singlet real scalar and
one generation of vectorlike fermions. We show that this leads to a
phenomenologically viable prediction for the mass of the Standard Model Higgs
boson.
","[{""version"":""v1"",""created"":""Tue, 11 Oct 1994 12:17:59 GMT""}]","2009-10-28"
"hep-th/9410066","Igor G. Korepanov","Igor G. Korepanov","Hidden Symmetries in the 6-Vertex Model of Statistical Physics","An English version of the author's article which recently appeared in
  Zapiski Nauvhnyh Seminarov POMI (S-Petersburg) and is based on two older
  papers (of 1987) mentioned in the bibliography. The author's Russian paper of
  1986 from the bibliography will soon appear in English, too","Zapiski Nauchn. Semin. POMI (S-Petersburg) 215 (1994) 163-177",,,"hep-th",,"  The transfer matrix of the 6-vertex model of two-dimensional statistical
physics commutes with many (more complicated) transfer matrices, but these
latter, generally, do not commute between each other. The studying of their
action in the eigenspaces of the 6-vertex model transfer matrix becomes
possible due to a ``multiplicative property'' of the {\em vacuum curves} of
$\cal L$-operators from which transfer matrices are built. This approach
allowed, in particular, to discover for the first time the fact that the
dimensions of abovementioned eigenspaces must be multiples of (big enough)
degrees of the number 2.
","[{""version"":""v1"",""created"":""Mon, 10 Oct 1994 16:44:06 GMT""}]","2007-05-23"
"hep-th/9410067","Dr Ian Kogan","Ian I. Kogan and Alex Kovner","Compact QED$_3$ - a simple example of a variational calculation in a
  gauge theory","18 pages, OUTP- 94-23 P, TPI-MINN-94/37-T","Phys.Rev. D51 (1995) 1948-1955","10.1103/PhysRevD.51.1948",,"hep-th hep-ph",,"  We apply a simple mean field like variational calculation to compact QED in
2+1 dimensions. Our variational ansatz explicitly preserves compact gauge
invariance of the theory. We reproduce in this framework all the known results,
including dynamical mass generation, Polyakov scaling and the nonzero string
tension. It is hoped that this simple example can be a useful reference point
for applying similar approximation techniques to nonabelian gauge theories.
","[{""version"":""v1"",""created"":""Mon, 10 Oct 1994 17:41:41 GMT""}]","2009-10-28"
"hep-th/9410068","Alok Kumar","Alok Kumar and Koushik Ray","Thermodynamics of Two Dimensional Black Holes","18 pages (One uncoded postscript file for figure appended),
  IP/BBSR/94-54","Phys.Lett. B351 (1995) 431-438","10.1016/0370-2693(95)00374-T",,"hep-th gr-qc",,"  Thermodynamic relations for a class of 2D black holes are obtained
corresponding to observations made from finite spatial distances. We also study
the thermodynamics of the charged version of the Jackiw-Teitelboim black holes
found recently by Lowe and Strominger. Our results corroborate, in appropriate
limits, to those obtained previously by other methods. We also analyze the
stability of these black holes thermodynamically.
","[{""version"":""v1"",""created"":""Mon, 10 Oct 1994 23:12:36 GMT""}]","2009-10-28"
"hep-th/9410069",,"Tom\'as Ort\'in","Duality Versus Supersymmetry","Latex file, 3 pages, Queen Mary and Westfield Report QMW-PH-94-35
  (Contribution to the 7th Marcel Grossman Meeting on General Relativity,
  Stanford, July 1994)",,,,"hep-th",,"  We study the effect of S-duality and target-space duality tranformations of
$N=4,d=4$ and $N=1,d=10$ supersymmetric configurations on their Killing
spinors. We find that, under reasonable assumptions, the dual configurations
are also supersymmetric and that the Killing spinors transform in a simple way.
","[{""version"":""v1"",""created"":""Mon, 10 Oct 1994 21:02:34 GMT""}]","2016-08-14"
"hep-th/9410070","Marcio J. Martins","M.J. Martins","Exact solution of the simplest super-orthosymplectic invariant magnet","8 pages, UFSCARF-TH-12","Phys.Rev.Lett. 74 (1995) 3316-3318","10.1103/PhysRevLett.74.3316",,"hep-th",,"  We present the exact solution of the $Osp(1|2)$ invariant magnet by the Bethe
ansatz approach. The associated Bethe ansatz equation exhibit a new feature by
presenting an explicit and distinct phase behaviour in even and odd sectors of
the theory. The ground state, the low-lying excitations and the critical
properties are discussed by exploiting the Bethe ansatz solution.
","[{""version"":""v1"",""created"":""Mon, 10 Oct 1994 20:22:53 GMT""}]","2009-10-28"
"hep-th/9410071","Marcio J. Martins","M.J. Martins and P.B. Ramos","A note on graded Yang-Baxter solutions as braid-monoid invariants","7 pages, UFSCARF-TH-94-11","J.Phys.A27:L703-L708,1994","10.1088/0305-4470/27/18/010",,"hep-th",,"  We construct two $Osp(n|2m)$ solutions of the graded Yang-Baxter equation by
using the algebraic braid-monoid approach. The factorizable S-matrix
interpretation of these solutions is also discussed.
","[{""version"":""v1"",""created"":""Mon, 10 Oct 1994 20:23:20 GMT""}]","2014-11-18"
"hep-th/9410073","Gary Horowitz","G. W. Gibbons, Gary T. Horowitz and P. K. Townsend","Higher-dimensional resolution of dilatonic black hole singularities","27 pages, R/94/28, UCSBTH-94-35 (Comments added to the discussion
  section)","Class.Quant.Grav.12:297-318,1995","10.1088/0264-9381/12/2/004",,"hep-th gr-qc",,"  We show that the four-dimensional extreme dilaton black hole with dilaton
coupling constant $a= \sqrt{p/(p+2)}$ can be interpreted as a {\it completely
non-singular}, non-dilatonic, black $p$-brane in $(4+p)$ dimensions provided
that $p$ is {\it odd}. Similar results are obtained for multi-black holes and
dilatonic extended objects in higher spacetime dimensions. The non-singular
black $p$-brane solutions include the self-dual three brane of ten-dimensional
N=2B supergravity and a multi-fivebrane solution of eleven-dimensional
supergravity. In the case of a supersymmetric non-dilatonic $p$-brane solution
of a supergravity theory, we show that it saturates a bound on the energy per
unit $p$-volume.
","[{""version"":""v1"",""created"":""Mon, 10 Oct 1994 23:32:20 GMT""},{""version"":""v2"",""created"":""Mon, 17 Oct 1994 21:06:17 GMT""}]","2010-04-06"
"hep-th/9410074","John Uglum","L. Susskind and J. Uglum","Black Holes, Interactions, and Strings","SU-ITP-94-35, 18 pages plus 6 figures, phyzzx",,,,"hep-th gr-qc",,"  We give some examples in which neglecting the interactions between particles
or truncating the description of a black hole to the spherically symmetric mode
leads to unphysical results. The restoration of the interactions and higher
angular momentum modes resolves these problems. It is argued that mathematical
consistency of the description of black holes in the Schwarzschild coordinate
system requires that we neither truncate the theory nor ignore the
interactions. We present two hypotheses on how matter must behave under large
Lorentz boosts in order for black holes to be consistent with quantum
mechanics. Finally, we argue that string theory exhibits these properties. Talk
presented at the PASCOS meeting in Syracuse, New York, May 1994.
","[{""version"":""v1"",""created"":""Tue, 11 Oct 1994 00:42:24 GMT""}]","2009-09-25"
"hep-th/9410075","M. Yoshimura","M.Yoshimura","Time Evolution of Pure Quantum State and Emergence of A Nearly Thermal
  State","10 pages, TU/94/468",,,,"hep-th gr-qc",,"  Dynamical evolution of the quantum ground state (vacuum) is analyzed for time
variant harmonic oscillators characterized by asymptotically constant
frequency. The oscillatory density matrix in the asymptotic future is uniquely
determined by a constant number of produced particles, independent of other
details of transient behavior at intermediate times. Time average over one
oscillation period yields a classical, in some cases even an almost thermal
behavior. In an analytically soluble model the created particle number obeys
the Planck distribution in a parameter limit. This suggests a new way of
understanding the Gibbons-Hawking temperature in the de Sitter spacetime.
","[{""version"":""v1"",""created"":""Tue, 11 Oct 1994 07:24:30 GMT""}]","2007-05-23"
"hep-th/9410076","Yoonbai Kim","Yoonbai Kim","Bubble with Global Monopole","latex with 3 latex figures (use biglatex command) 14 pages,
  DPNU-94-39",,,,"hep-th",,"  The first-order phase transition of $O(3)$ symmetric model is considered in
the limit of high temperature. It is shown that this model supports a new
bubble solution where the global monopole is formed at the center of the buble
in addition to the ordinary $O(3)$ bubble. Though the free energy of it is
larger than that of normal bubble, the production rate can considerably large
at high temperatures.
","[{""version"":""v1"",""created"":""Tue, 11 Oct 1994 09:14:43 GMT""}]","2016-09-06"
"hep-th/9410077","Wolfgang Eholzer","Wolfgang Eholzer and Nils-Peter Skoruppa","Conformal Characters and Theta Series","15 pages (AMS TeX), preprint MSRI, BONN-TH-94-24","Lett. Math. Phys. 35 (1995) 197","10.1007/BF00761292",,"hep-th",,"  We describe the construction of vector valued modular forms transforming
under a given congruence representation of the modular group SL(2,Z) in terms
of theta series. We apply this general setup to obtain closed and easily
computable formulas for conformal characters of rational models of W-algebras.
","[{""version"":""v1"",""created"":""Tue, 11 Oct 1994 10:40:32 GMT""}]","2015-06-26"
"hep-th/9410078",,"J. Gamboa","A Model of Two-Dimensional Quantum Gravity in the Strong Coupling Regime","10pp., Revtex, Si/94/06","Phys.Rev.Lett.74:1900-1903,1995","10.1103/PhysRevLett.74.1900",,"hep-th gr-qc",,"  A model of two-dimensional quantum gravity that is the analog of the
tensionless string is proposed. The gravitational constant ($k$) is the analog
of the Regge slope ($\alpha^{'}$) and it shows that when $k \rightarrow
\infty$, $2D$ quantum gravity can be understood as a tensionless string theory
embeded in a two-dimensional target space. The temporal coordinate of the
target space play the role of time and the wave function can be interpreted as
in standard quantum mechanics.
","[{""version"":""v1"",""created"":""Tue, 11 Oct 1994 13:13:58 GMT""}]","2011-07-19"
