"math/9410208",,"Herbert Edelsbrunner, Ernst M\""ucke","Three-dimensional alpha shapes","32 pages",,,"LACES 52B-94-25","math.CO cs.CC math.MG",,"  Frequently, data in scientific computing is in its abstract form a finite
point set in space, and it is sometimes useful or required to compute what one
might call the ``shape'' of the set. For that purpose, this paper introduces
the formal notion of the family of $\alpha$-shapes of a finite point set in
$\Real^3$. Each shape is a well-defined polytope, derived from the Delaunay
triangulation of the point set, with a parameter $\alpha \in \Real$ controlling
the desired level of detail. An algorithm is presented that constructs the
entire family of shapes for a given set of size $n$ in time $O(n^2)$, worst
case. A robust implementation of the algorithm is discussed and several
applications in the area of scientific computing are mentioned.
","[{""version"":""v1"",""created"":""Wed, 12 Oct 1994 00:00:00 GMT""}]","2016-09-06"
"math/9410209",,"Herbert Edelsbrunner, Ernst M\""ucke","Simulation of simplicity: a technique to cope with degenerate cases in
  geometric algorithms","38 pages",,,"LACES 68Q-94-24","math.CO cs.CC",,"  This paper describes a general-purpose programming technique, called the
Simulation of Simplicity, which can be used to cope with degenerate input data
for geometric algorithms. It relieves the programmer from the task to provide a
consistent treatment for every single special case that can occur. The programs
that use the technique tend to be considerably smaller and more robust than
those that do not use it. We believe that this technique will become a standard
tool in writing geometric software.
","[{""version"":""v1"",""created"":""Wed, 12 Oct 1994 00:00:00 GMT""}]","2016-09-06"
"solv-int/9410001","Nimmo Jjc","J J C NIMMO(Department of Mathematics, University of Glasgow, Glasgow
  G12 8QW, Scotland)","Darboux Transformations from Reductions of the KP Hierarchy","10 pages, LaTeX2e plus Latex2e style file for layout. (Should work
  with LaTeX209 with minimum changes (see line 3 of source))",,,"University of Glasgow, Department of Mathematics, Paper No. 94/54","solv-int nlin.SI",,"  The use of effective Darboux transformations for general classes Lax pairs is
discussed. The general construction of ``binary'' Darboux transformations
preserving certain properties of the operator, such as self-adjointness, is
given. The classes of Darboux transformations found include the multicomponent
BKP and CKP reductions of the KP hierarchy.
","[{""version"":""v1"",""created"":""Tue, 11 Oct 1994 16:10:47 GMT""}]","2008-02-03"
