"hep-ph/9408305","Rik Tangerman","R.D. Tangerman and P.J. Mulders","Polarized twist-three distributions $g_T$ and $h_L$ and the role of
  intrinsic transverse momentum","21 pages, REVTEX 3.0 (6 figures included in separate LATEX file using
  feynman.tex, others available upon request), NIKHEF-94-P7",,,,"hep-ph",,"  In a nonstandard way we split up the polarized quark distributions $g_T$ and
$h_L$ into their twist-two, quark-mass, and interaction-dependent parts,
emphasizing the sensitivity to quark intrinsic transverse momentum. We show how
to derive the Burkhardt-Cottingham sum rule in this approach and derive a
similar sum rule for the chiral-odd distribution $h_2$. The effect of intrinsic
transverse momentum in experimental observables is illustrated in the
calculation of the ${\cal O}(1/Q)$ double-spin asymmetry $A_{LT}$ in Drell-Yan
scattering.
","[{""version"":""v1"",""created"":""Tue, 16 Aug 1994 15:35:35 GMT""}]","2009-09-25"
"hep-th/9408085","The Nudibranch","Gil Gat and Rashmi Ray","Anomalous Magnetic Moment of Anyons","8 pp, plain latex, two figures attached at the end","Phys.Lett. B340 (1994) 162-166","10.1016/0370-2693(94)01330-6","UMD-PP-95-32","hep-th cond-mat",,"  The anomalous magnetic moment of anyons is calculated to leading order in a
1/N expansion. It is shown that the gyromagnetic ratio g remains 2 to the
leading order in 1/N. This result strongly supports that obtained in
\cite{poly}, namely that g=2 is in fact exact.
","[{""version"":""v1"",""created"":""Tue, 16 Aug 1994 02:36:20 GMT""}]","2009-10-28"
"hep-th/9408086","Omar Foda","Omar Foda and Yas-Hiro Quano","Virasoro character identities from the Andrews--Bailey construction","22 pages. Expanded version with new results","Int.J.Mod.Phys. A12 (1997) 1651-1676","10.1142/S0217751X97001110","Univ. Melbourne 26","hep-th math.QA",,"  We prove $q$-series identities between bosonic and fermionic representations
of certain Virasoro characters. These identities include some of the
conjectures made by the Stony Brook group as special cases. Our method is a
direct application of Andrews' extensions of Bailey's lemma to recently
obtained polynomial identities.
","[{""version"":""v1"",""created"":""Tue, 16 Aug 1994 02:55:11 GMT""},{""version"":""v2"",""created"":""Wed, 17 Aug 1994 04:29:33 GMT""},{""version"":""v3"",""created"":""Wed, 31 Aug 1994 06:55:23 GMT""}]","2016-09-06"
"hep-th/9408087","Henric Rhedin","Stephen Hwang and Henric Rhedin","General branching functions of affine Lie algebras","11 pages, G\""oteborg ITP 94-8","Mod.Phys.Lett.A10:823-830,1995","10.1142/S0217732395000879",,"hep-th",,"  Explicit expressions are presented for general branching functions for cosets
of affine Lie algebras $\hat{g}$ with respect to subalgebras $\hat{g}^\prime$
for the cases where the corresponding finite dimensional algebras $g$ and
$g^\prime$ are such that $g$ is simple and $g^\prime$ is either simple or sums
of $u(1)$ terms. A special case of the latter yields the string functions. Our
derivation is purely algebraical and has its origin in the results on the BRST
cohomology presented by us earlier. We will here give an independent and simple
proof of the validity our results. The method presented here generalizes in a
straightforward way to more complicated $g$ and $g^\prime$ such as {\it e g }
sums of simple and $u(1)$ terms.
","[{""version"":""v1"",""created"":""Tue, 16 Aug 1994 06:49:55 GMT""}]","2011-07-19"
"hep-th/9408088","Euro Spallucci","A.Aurilia, E.Spallucci, I.Vanzetta","Postmodern String Theory: Stochastic Formulation","24pages, ReVTeX","Phys.Rev.D50:6490-6502,1994","10.1103/PhysRevD.50.6490",,"hep-th",,"  In this paper we study the dynamics of a statistical ensemble of strings,
building on a recently proposed gauge theory of the string geodesic field. We
show that this stochastic approach is equivalent to the Carath\'eodory
formulation of the Nambu-Goto action, supplemented by an averaging procedure
over the family of classical string world-sheets which are solutions of the
equation of motion. In this new framework, the string geodesic field is
reinterpreted as the Gibbs current density associated with the string
statistical ensemble. Next, we show that the classical field equations derived
from the string gauge action, can be obtained as the semi-classical limit of
the string functional wave equation. For closed strings, the wave equation
itself is completely analogous to the Wheeler-DeWitt equation used in quantum
cosmology. Thus, in the string case, the wave function has support on the space
of all possible spatial loop configurations. Finally, we show that the string
distribution induces a multi-phase, or {\it cellular} structure on the
spacetime manifold characterized by domains with a purely Riemannian geometry
separated by domain walls over which there exists a predominantly Weyl
geometry.
","[{""version"":""v1"",""created"":""Tue, 16 Aug 1994 07:52:46 GMT""},{""version"":""v2"",""created"":""Thu, 18 Aug 1994 07:07:28 GMT""}]","2019-08-17"
"hep-th/9408089","Margaret Gabler","Finn Larsen and Frank Wilczek","Geometric Entropy, Wave Functionals, and Fermions","27 pages, uses Phyzzx, IASSNS-HEP 94/51","Annals Phys. 243 (1995) 280-298","10.1006/aphy.1995.1100",,"hep-th gr-qc",,"  We develop techniques for calculating the ground state wave functional and
the geometric entropy for some simple field theories. Special attention is
devoted to fermions, which present special technical difficulties in this
regard. Explicit calculations are carried through for free mass bosons and
fermions in two dimensions, using an adaptation of Unruh's technique to treat
black hole radiance.
","[{""version"":""v1"",""created"":""Tue, 16 Aug 1994 12:19:33 GMT""}]","2015-06-26"
"hep-th/9408090","Igor Tyutin","I. A. Batalin, S.L.Lyakhovich and I. V. Tyutin","Split Involution Coupled to Actual Gauge Symmetry","22pp, P.N.Lebedev Physical Institute","Int.J.Mod.Phys. A10 (1995) 1917-1936","10.1142/S0217751X95000930",,"hep-th",,"  The split involution quantization scheme, proposed previously for pure
second--class constraints only, is extended to cover the case of the presence
of irreducible first--class constraints. The explicit Sp(2)--symmetry property
of the formalism is retained to hold. The constraint algebra generating
equations are formulated and the Unitarizing Hamiltonian is constructed.
Physical operators and states are defined in the sense of the new equivalence
criterion that is a natural counterpart to the Dirac's weak equality concept as
applied to the first--class quantities.
","[{""version"":""v1"",""created"":""Tue, 16 Aug 1994 12:55:58 GMT""}]","2015-06-26"
"hep-th/9408091","Richard MacKenzie","Avinash Khare, R. MacKenzie and M.B. Paranjape","On the Coleman-Hill Theorem","11 pages, REVTEX, UdeM-GPP-TH-94-5","Phys.Lett. B343 (1995) 239-243","10.1016/0370-2693(94)01420-H",,"hep-th",,"  The Coleman-Hill theorem prohibits the appearance of radiative corrections to
the topological mass (more precisely, to the parity-odd part of the vacuum
polarization tensor at zero momentum) in a wide class of abelian gauge theories
in 2+1 dimensions. We re-express the theorem in terms of the effective action
rather than in terms of the vacuum polarization tensor. The theorem so restated
becomes somewhat stronger: a known exception to the theorem, spontaneously
broken scalar Chern-Simons electrodynamics, obeys the new non-renormalization
theorem. Whereas the vacuum polarization {\sl does} receive a one-loop,
parity-odd correction, this does not translate to a radiative contribution to
the Chern-Simons term in the effective action. We also point out a new
situation, involving scalar fields and parity-odd couplings, which was
overlooked in the original analysis, where the conditions of the theorem are
satisfied and where the topological mass does, in fact, get a radiative
correction.
","[{""version"":""v1"",""created"":""Tue, 16 Aug 1994 13:46:21 GMT""}]","2009-10-28"
"hep-th/9408092","Mike Freeman","Michael Freeman","Conserved charges and soliton solutions in affine Toda theory","18 pages, plain tex, minor changes, references added","Nucl.Phys. B433 (1995) 657-670","10.1016/0550-3213(94)00519-K","KCL-TH-94-8","hep-th",,"  We study the conserved charges of affine Toda field theories by making use of
the conformally invariant extension of these theories. We compute the values of
all charges for the single soliton solutions, and show that these are related
to eigenvectors of the Cartan matrix of the finite-dimensional Lie algebra
underlying the theory.
","[{""version"":""v1"",""created"":""Tue, 16 Aug 1994 15:35:44 GMT""},{""version"":""v2"",""created"":""Mon, 7 Nov 1994 15:01:10 GMT""}]","2009-10-28"
"math/9408205",,"Nigel J. Kalton","The basic sequence problem",,,,"Banach Archive 8/16/94","math.FA",,"  We construct a quasi-Banach space $X$ which contains no basic sequence.
","[{""version"":""v1"",""created"":""Tue, 16 Aug 1994 15:26:48 GMT""}]","2008-02-03"
"nucl-th/9408015","Steven C. Pieper","M. Radici, S. Boffi, Steven C. Pieper, and V. R. Pandharipande","Many-body effects in 16O(e,e'p)","21 Pages, PHY-7849-TH-94","Phys.Rev.C50:3010-3017,1994","10.1103/PhysRevC.50.3010",,"nucl-th",,"  Effects of nucleon-nucleon correlations on exclusive $(e,e'p)$ reactions on
closed-shell nuclei leading to single-hole states are studied using
$^{16}O(e,e'p)^{15}N$ ($6.32$ MeV, $3/2^-$) as an example. The quasi-hole wave
function, calculated from the overlap of translationally invariant many-body
variational wave functions containing realistic spatial, spin and isospin
correlations, seems to describe the initial state of the struck proton
accurately inside the nucleus, however it is too large at the surface. The
effect of short-range correlations on the final state is found to be largely
cancelled by the increase in the transparency for the struck proton. It is
estimated that the values of the spectroscopic factors obtained with the DWIA
may increase by a few percent due to correlation effects in the final state.
","[{""version"":""v1"",""created"":""Mon, 15 Aug 1994 16:38:51 GMT""}]","2009-09-25"
"nucl-th/9408016","Robert B. Wiringa","R.B.Wiringa, V.G.J.Stoks, and R.Schiavilla","An accurate nucleon-nucleon potential with charge-independence breaking","36 pages, PHY-7742-TH-94","Phys.Rev.C51:38-51,1995","10.1103/PhysRevC.51.38",,"nucl-th",,"  We present a new high-quality nucleon-nucleon potential with explicit charge
dependence and charge asymmetry, which we designate Argonne $v_{18}$. The model
has a charge-independent part with fourteen operator components that is an
updated version of the Argonne $v_{14}$ potential. Three additional
charge-dependent and one charge-asymmetric operators are added, along with a
complete electromagnetic interaction. The potential has been fit directly to
the Nijmegen $pp$ and $np$ scattering data base, low-energy $nn$ scattering
parameters, and deuteron binding energy. With 40 adjustable parameters it gives
a $\chi^{2}$ per datum of 1.09 for 4301 $pp$ and $np$ data in the range 0--350
MeV.
","[{""version"":""v1"",""created"":""Mon, 15 Aug 1994 22:43:01 GMT""}]","2009-09-25"
"nucl-th/9408017","Jean Marc Richard","Jean-Marc Richard (Grenoble) and Sonia Fleck (Lyon, France)","Limits on the Domain of Coupling Constants for Binding N-Body Systems
  with No Bound Subsystems","RevTeX 3.0, 8 pages, to appear in Phys. Rev. Lett","Phys.Rev.Lett.73:1464-1467,1994","10.1103/PhysRevLett.73.1464",,"nucl-th",,"  We study the domain of coupling constants for which a 3-body or 4-body system
is bound while none of its subsystems is bound. Limits on the size of the
domain are derived from a variant of the Hall--Post inequalities which relate
$N$-body to $(N-1)$-body energies at given coupling. Possible applications to
halo nuclei and hypernuclei are briefly outlined.
","[{""version"":""v1"",""created"":""Tue, 16 Aug 1994 14:23:44 GMT""}]","2009-10-28"
