"astro-ph/9408047","Kailash C. Sahu","Kailash C. Sahu","Microlensing Events of the LMC are Better Explained by Stars within the
  LMC Than by Machos","14 pages, To appear in Sept., 1994 issue of Pub. Astron. Soc. Pac.,
  Figures available on request from ksahu@iac.es","Publ.Astron.Soc.Pac. 106 (1994) 942","10.1086/133465",,"astro-ph",,"  The recently reported microlensing events of the LMC have caused much
excitement, and have been interpreted as due to `dark objects' (MACHOs) in the
halo of our Galaxy. It is shown here that the stars within the LMC play a
dominant role as gravitational lenses and can indeed account for the observed
events. The MACHO event and one of the EROS events lie within the bar for which
the probability of microlensing is consistent with being caused by an object
within the LMC. If the stars within the LMC play a dominant role as lenses, the
events should be concentrated towards the center of the LMC. If MACHOs play a
dominant role as lenses then, for a given number of monitored stars, the events
should be uniformly distributed over the whole of the LMC. Thus the galactic
and the LMC lenses can be statistically distinguished in most cases. It is
further shown that, under certain conditions, the light curve of an event
caused by a star within the LMC would be different from the one caused by a
MACHO. This can also be a distinguishing signature, and seems to have been
observed in case of the MACHO event. The fit discrepancy near the peak which
the authors say ``is not yet understood"" would be a natural consequence if the
event is caused by an object within the LMC, which further indicates that the
lensing is due to a low mass star within the LMC itself.
","[{""version"":""v1"",""created"":""Mon, 15 Aug 1994 20:20:34 GMT""}]","2009-10-22"
"astro-ph/9408048","Craig Robinson","C.R. Robinson and F.A. Cordova","X-ray Variability and Period Determinations in the Eclipsing Polar DP
  Leo","uuencoded PostScript file (25 pages) + 8 figures available by
  anonymous ftp to ftp.astro.psu.edu (in the directory /pub/robinson), to
  appear in ApJ, PSU preprint 1994-19",,"10.1086/175007",,"astro-ph",,"  An analysis of ROSAT observations for the eclipsing magnetic cataclysmic
binary DP Leo provides constraints on the origin, size, temperature,
variability and structure of the soft X-ray emission region on the surface of
the white dwarf. These data, when combined with prior observations, show a
progression of approximately 2 degrees per year in the impact position of the
accretion stream onto the white dwarf. One explanation for the observed drift
in stream position is that a magnetic activity cycle on the secondary produces
orbital period oscillations. These oscillations result in an orbital period
which cycles above and below the rotational period of the nearly synchronous
white dwarf. The accretion stream and X-ray emission regions are modeled to fit
the observational data. A distance to the system is also calculated. [An
erroneous value for the cyclotron luminosity, included in an earlier paper
version of the preprint, is corrected here.]
","[{""version"":""v1"",""created"":""Mon, 15 Aug 1994 21:26:07 GMT""}]","2009-10-22"
"astro-ph/9408049",,"R.J. Nemiroff (NASA/GMU), J.P. Norris (NASA/GSFC), J.T. Bonnell
  (NASA/USRA), W.A.D.T. Wickramasinghe (UPenn), C. Kouveliotou (NASA/USRA),
  W.S. Paciesas (NASA/UAH), G.J. Fishman (NASA/MSFC), C.A. Meegan (NASA/MSFC)","Gross Spectral Differences between Bright and Dim Gamma-Ray Bursts","in press: The Astrophysical Journal (Letters), 15 pages of Plain TEX
  version 3.0. Postscript text and figures available through RJN's Home Page
  URL of http://enemy.gsfc.nasa.gov/htmltest/rjn.html","Astrophys.J. 435 (1994) L133","10.1086/187612","RJNSISSA008","astro-ph",,"  We find that dim gamma-ray bursts (GRBs) are softer than bright GRBs, as
indicated on average by data from the Burst and Transient Source Experiment
(BATSE) on board the Compton Gamma Ray Observatory. We show that this
correlation is statistically significant with respect to variations due to
random differences between GRBs. This effect is discernable using a variety of
methods and data sets, including public domain data. We analyze several types
of systematic errors and selection effects in the BATSE data and conclude that
the observed effect is not dominated by any of them. We therefore assert that
this dim/soft effect is a real property of GRBs. It is possible that this
correlation is a consequence of the time dilation detected by Norris et al.
(1994) and that this is additional evidence that burst sources are located at
cosmological distances.
","[{""version"":""v1"",""created"":""Mon, 15 Aug 1994 21:54:06 GMT""}]","2009-10-22"
"astro-ph/9408050","Carolin Seitz","Carolin Seitz, Peter Schneider","Steps towards Nonlinear Cluster Inversion Through Gravitational
  Distortions. II. Generalization of the Kaiser & Squires Method","23 pages",,,"MPA report 823","astro-ph",,"  The weak distortions of high-redshift galaxies caused by gravitational light
deflection near clusters of galaxies can be used to reconstruct the projected
(two-dimensional) surface mass density of intermediate redshift clusters. This
technique, pioneered by Tyson, Valdes & Wenk, and Kaiser & Squires, is
reconsidered in the present paper, where we generalize the inversion equation
found by Kaiser & Squires (KS) in several respect. Adopting a different
smoothing procedure for the discreetly sampled data (individual galaxy images),
we effectively reduce the shot noise in the KS procedure. In particular we show
that the best density reconstructions are obtained if the smoothing scale is
adopted to the `strength of the signal', which yields a better resolution near
the center of the cluster where the distortions are strongest. Furthermore, we
point out the importance of boundary effects and demonstrate their disastrous
impact on rectangular data fields (CCDs) with large side ratio. Most important,
however, is the generalization of the KS method to critical clusters, i.e., to
such clusters which are capable of producing multiple images and giant luminous
arcs. The corresponding modifications of the inversion procedure are severe; in
particular, the resulting inversion equation is much more difficult to solve.
As we pointed out in a previous paper (Schneider & Seitz), there exists a local
degeneracy if the cluster is critical. We have developed an iteration procedure
to solve the inversion equation, which we demonstrate to yield a very accurate
","[{""version"":""v1"",""created"":""Tue, 16 Aug 1994 08:23:08 GMT""}]","2007-05-23"
"astro-ph/9408051","Andrew Ulmer","Andrew Ulmer","Super-Eddington Radiation Transfer in Soft Gamma Repeaters","16 p + 2 figs (uuencoded), submitted to APJLett, POP-577",,"10.1086/187695",,"astro-ph",,"  Bursts from soft gamma repeaters have been shown to be super-Eddington by a
factor of 1000 and have been persuasively associated with compact objects.
Here, a model of super-Eddington radiation transfer on the surface of a
strongly magnetic ($\geq 10^{13}$ gauss) neutron star is studied and related to
the observational constraints on soft gamma repeaters. In strong magnetic
fields, the cross-section to electron scattering is strongly suppressed in one
polarization state, so super-Eddington fluxes can be radiated while the plasma
remains in hydrostatic equilibrium. The model offers a somewhat natural
explanation for the observation of similarity between spectra from bursts of
varying intensity. The radiation produced in the model is found to be linearly
polarized to about 1 part in 1000 in a direction determined by the local
magnetic field, and the large intensity variations between bursts are
understood as a change in the radiating area on the source. Therefore, the
polarization may vary as a function of burst intensity, since the complex
structure of the magnetic field may be more apparent for larger radiating
areas. It is shown that for radiation transfer calculations in this limit of
super-strong magnetic fields it is sufficient to solve the radiation transfer
equations for the low opacity state rather than the coupled equations for both.
With this approximation, standard stellar atmosphere techniques are utilized to
calculate the model energy spectrum.
","[{""version"":""v1"",""created"":""Tue, 16 Aug 1994 08:35:25 GMT""}]","2009-10-22"
"cmp-lg/9408008","Neil Rowe","Neil C. Rowe (Code CS/Rp, Department of Computer Science, Naval
  Postgraduate School, Monterey)","Statistical versus symbolic parsing for captioned-information retrieval","Workshop on the Balancing Act, ACL-94, Las Cruces NM, July 1994",,,,"cmp-lg cs.CL",,"  We discuss implementation issues of MARIE-1, a mostly symbolic parser fully
implemented, and MARIE-2, a more statistical parser partially implemented. They
address a corpus of 100,000 picture captions. We argue that the mixed approach
of MARIE-2 should be better for this corpus because its algorithms (not data)
are simpler.
","[{""version"":""v1"",""created"":""Mon, 15 Aug 1994 19:08:41 GMT""}]","2008-02-03"
"cmp-lg/9408009","Atro Voutilainen","Pasi Tapanainen (Rank Xerox Research Centre, Grenoble Laboratory),
  Atro Voutilainen (Research Unit for Computational Linguistics, University of
  Helsinki)","Tagging accurately -- Don't guess if you know","6 pages, Proc. ANLP94, uuencoded and gzipped postscript",,,,"cmp-lg cs.CL",,"  We discuss combining knowledge-based (or rule-based) and statistical
part-of-speech taggers. We use two mature taggers, ENGCG and Xerox Tagger, to
independently tag the same text and combine the results to produce a fully
disambiguated text. In a 27000 word test sample taken from a previously unseen
corpus we achieve 98.5% accuracy. This paper presents the data in detail. We
describe the problems we encountered in the course of combining the two taggers
and discuss the problem of evaluating taggers.
","[{""version"":""v1"",""created"":""Tue, 16 Aug 1994 10:22:05 GMT""}]","2008-02-03"
"cond-mat/9408042","Peter Forrester","P.J. Forrester","Integration formulas and exact calculations in the Calogero-Sutherland
  model","12 pgs (one fig. not included), latex, some corrections made before
  publication in Lett. Mod. Phys. B",,"10.1142/S0217984995000346",,"cond-mat",,"  Some integration formulas which either occur or are implicit in Ha's recent
exact calculation of some correlations in the Calogero-Sutherland model are
discussed. These integration formulas include the calculation of the inner
product $<0|\rho (0)|\kappa>$ between the density operator acting on an excited
state and the ground state, and a generalization of the Selberg integral due to
Dotsenko and Fateev.
","[{""version"":""v1"",""created"":""Mon, 15 Aug 1994 23:55:43 GMT""},{""version"":""v2"",""created"":""Fri, 3 Feb 1995 05:24:01 GMT""}]","2009-10-22"
"dg-ga/9408001","Reyer Sjamaar","Reyer Sjamaar","Convexity Properties of the Moment Mapping Re-examined","36 pages, 3 figures, LaTeX-2e. Revised version. A number of errors
  corrected and references added. To appear in Adv. in Math","Adv. Math. 138 (1998), 46-91",,,"dg-ga alg-geom math.AG math.DG",,"  Consider a Hamiltonian action of a compact Lie group on a compact symplectic
manifold. A theorem of Kirwan's says that the image of the momentum mapping
intersects the positive Weyl chamber in a convex polytope. I present a new
proof of Kirwan's theorem, which gives explicit information on how the vertices
of the polytope come about and on how the shape of the polytope near any point
can be read off from infinitesimal data on the manifold. It also applies to
some interesting classes of noncompact or singular Hamiltonian spaces, such as
cotangent bundles and complex affine varieties.
","[{""version"":""v1"",""created"":""Mon, 15 Aug 1994 20:27:02 GMT""},{""version"":""v2"",""created"":""Tue, 5 Aug 1997 21:55:32 GMT""}]","2008-02-03"
"dg-ga/9408002","Braverman Maxim","Maxim Braverman","Witten deformation of Ray-Singer analytic torsion","10 pages. AMS-LaTeX",,,,"dg-ga hep-th math.DG",,"  Consider a flat vector bundle F over compact Riemannian manifold M and let f
be a self-indexing Morse function on M. Let g be a smooth Euclidean metric on
F. Set g_t=exp(-2tf)g and let \rho(t) be the Ray-Singer analytic torsion of F
associated to the metric g_t. Assuming that the vector field $grad f$ satisfies
the Morse-Smale transversality conditions, we provide an asymptotic expansion
for log(\rho(t)) for t\to\infty of the form a_0+a_1t+b log(t)+o(1). We present
explicit formulae for coefficients a_0,a_1 and b. In particular, we show that b
is a half integer.
","[{""version"":""v1"",""created"":""Tue, 16 Aug 1994 13:39:11 GMT""}]","2016-08-31"
"hep-ph/9408288",,"Dieter Stoll","Gauge fixing by unitary transformations in QCD","email: stoll@tkyux.phys.s.u-tokyo.ac.jp; 8 pages LaTex; Paper to be
  published in Physics Letters B","Phys.Lett. B336 (1994) 518-523","10.1016/0370-2693(94)90566-5",,"hep-ph",,"  The unitary gauge fixing technique is applied to the QCD hamiltonian
formulated in terms of angular variables. It is demonstrated that in this
formulation projections on the physical Hilbert space are unnecessary to
separate physical and unphysical degrees of freedom. Therefore the application
of the unitary gauge fixing technique can be extended to the operator level.
","[{""version"":""v1"",""created"":""Mon, 15 Aug 1994 18:40:57 GMT""}]","2009-10-28"
"hep-ph/9408289",,"Dieter Stoll","The hamiltonian formulation of QCD in terms of angle variables","email: stoll@tkyux.phys.s.u-tokyo.ac.jp; 7 Pages LaTex Paper to
  appear in Physics Letters B","Phys.Lett. B336 (1994) 524-528","10.1016/0370-2693(94)90567-3",,"hep-ph",,"  For the sake of eliminating gauge variant degrees of freedom we discuss the
way to introduce angular variables in the hamiltonian formulation of QCD. On
the basis of an analysis of Gauss' law constraints a particular choice is made
for the variable transformation from gauge fields to angular field variables.
The resulting formulation is analogous to the one of Bars in terms of corner
variables. Therefore the corner or angle formulation may constitute an useful
starting point for the investigation of the low energy properties of QCD in
terms of gauge invariant degrees of freedom.
","[{""version"":""v1"",""created"":""Mon, 15 Aug 1994 18:53:55 GMT""}]","2009-10-28"
"hep-ph/9408294","Martin John Savage","Martin J. Savage","E2 Strength in the Radiative Charmed Baryon Decay","10 pages, 2 uuencoded figures included, uses harvmac and epsf,
  CMU-HEP 94-25","Phys.Lett.B345:61-66,1995","10.1016/0370-2693(94)01597-6",,"hep-ph",,"  The radiative decay $\Sigma_Q^* \rightarrow \Lambda_Q\gamma$ can have both
magnetic dipole (M1) and electric quadrupole (E2) components. In the heavy
quark limit $M_Q\rightarrow\infty$ the transition arises from the spin of the
light degrees of freedom changing from $s_l=1$ to $s_l=0$ and hence the E2
contribution vanishes. We compute the leading contribution to the E2 strength
in chiral perturbation theory and find that the amplitude is enhanced by a
small energy denominator in the chiral limit. This enhancement essentially
compensates for the $1/M_c$ suppression that is present in the charm system. We
find a mixing ratio of order a few percent dependent upon the
$\Sigma_c^*--\Sigma_c$ spin symmetry breaking mass difference. The analogous
quantity in the b-baryon sector is smaller by a factor of $\sim M_c/M_b$.
","[{""version"":""v1"",""created"":""Mon, 15 Aug 1994 16:29:33 GMT""}]","2010-11-01"
"hep-ph/9408295",,"U. Baur","Amplitude Zeros and Rapidity Correlations in $W\gamma$ and $WZ$
  Production in Hadronic Collisions","6 pages, talk given at the DPF94 conference, Albuquerque, NM, August
  2 - 6, 1994, uuencoded postscript file, FSU-HEP-940815",,,,"hep-ph",,"  A comparative study of amplitude zeros in $W\gamma$ and $WZ$ production in
hadronic collisions is presented. The Standard Model amplitude for $q_1 \bar
q_2 \rightarrow W^\pm Z $ at the Born-level is shown to exhibit an approximate
zero located at $\cos\theta = (g^{q_1}_{-} + g^{q_2}_{-}) / (g^{q_1}_{-} -
g^{q_2}_{-})$ at high energies, where the $g^{q_i}_{-}$ ($i=1,2$) are the
left-handed couplings of the $Z$-boson to quarks and $\theta$ is the center of
mass scattering angle of the $W$-boson. This approximate zero is similar to the
well-known radiation zero in $W\gamma$ production. Prospects to observe the
amplitude zeros using rapidity correlations between the final state particles
are explored.
","[{""version"":""v1"",""created"":""Mon, 15 Aug 1994 20:45:15 GMT""}]","2007-05-23"
"hep-ph/9408296","John Learned","John G. Learned and Sandip Pakvasa","Detecting Tau Neutrino Oscillations at PeV Energies","18 pages latex, incl 3 figs, UH-511-799-94","Astropart.Phys.3:267-274,1995","10.1016/0927-6505(94)00043-3",,"hep-ph astro-ph hep-ex",,"  It is suggested that a large deep underocean (or ice) neutrino detector,
given the presence of significant numbers of neutrinos in the PeV energy range
as predicted by various models of Active Galactic Nuclei, can make unique
measurements of the properties of neutrinos. It will be possible to observe the
existence of the tau neutrino, measure its mixing with other flavors, in fact
test the mixing pattern for all three flavors based upon the mixing parameters
suggested by the atmospheric and solar neutrino data, and measure the tau
neutrino cross section. The key signature is the charged current tau neutrino
interaction, which produces a double cascade, one at either end of a lightly
radiating track. At a few PeV these cascades would be separated by roughly 100
m, and thus be easily resolvable in next generation DUMAND-like detectors.
First examples might be found in detectors presently under construction. Future
applications are precise neutrino astronomy and earth tomography. This paper is
an expanded version of hep-ph/9405296, for publication.
","[{""version"":""v1"",""created"":""Tue, 16 Aug 1994 03:18:10 GMT""}]","2010-11-01"
"hep-ph/9408297","Lu Cai-dian","Cai-Dian Lu","QCD Corrections to $b \to s \gamma$ Decay in 2-Higgs Doublet Model","23 pages, 8 figures(not included), Minor Changes","Nucl.Phys. B441 (1995) 33-48","10.1016/0550-3213(95)00054-V","AS-ITP 94-32. To appear in Nucl. Phys. B","hep-ph",,"  We give a more complete calculation of $b \to s\gamma $ decay in 2-Higgs
doublet model, including leading log QCD corrections from $m_{top}$ to $M_W$ in
addition to corrections from $M_{W}$ to $m_b$. The inclusive decay rate in the
first model is found to be suppressed 23\% comparing with the calculations
without the QCD running from $m_{top}$ to $M_W$. And the enhancement up to 5\%
is found in calculations of the second model. More strict restrictions to
parameters of 2-Higgs doublet model II are found.
","[{""version"":""v1"",""created"":""Tue, 16 Aug 1994 15:43:57 GMT""},{""version"":""v2"",""created"":""Tue, 7 Feb 1995 19:47:59 GMT""},{""version"":""v3"",""created"":""Wed, 15 Mar 1995 18:05:36 GMT""}]","2009-10-28"
"hep-ph/9408298","Harold W. Fearing","S. Scherer and H. W. Fearing","Field Transformations and the Classical Equation of Motion in Chiral
  Perturbation Theory","TRIUMF preprint TRI-PP-94-64, 10 pages in LaTex using RevTex macro","Phys.Rev. D52 (1995) 6445-6450","10.1103/PhysRevD.52.6445",,"hep-ph nucl-th",,"  The construction of effective Lagrangians commonly involves the application
of the `classical equation of motion' to eliminate redundant structures and
thus generate the minimal number of independent terms. We investigate this
procedure in the framework of chiral perturbation theory. The use of the
'classical equation of motion' is interpreted in terms of field
transformations. Such an interpretation is crucial if one wants to bring a
given Lagrangian into a canonical form with a minimal number of terms. We
emphasize that the application of field transformations not only eliminates
structures, or, what is equivalent, expresses certain structures in terms of
already known different structures, but also leads to a modification of
coefficients of higher--order terms. This will become relevant, once one
considers effective interaction terms beyond next--to--leading order, i.e.,
beyond $O(p^4)$.
","[{""version"":""v1"",""created"":""Tue, 16 Aug 1994 06:33:03 GMT""}]","2009-10-28"
"hep-ph/9408299","Masayuki Asakawa","Masayuki Asakawa, Zheng Huang, and Xin-Nian Wang","How Disoriented Chiral Condensates Form: Quenching vs. Annealing","10 pages, 3 uuencoded postscript figures included, REVTEX, LBL-35981.
  All figures can be printed with any postscript printer. However, Fig. 3 is
  actually in color and its hard copy is available in color upon request","Phys.Rev.Lett. 74 (1995) 3126-3129","10.1103/PhysRevLett.74.3126",,"hep-ph nucl-th",,"  We demonstrate that semiclassical fluctuations, their relaxation, and the
chiral phase transition are automatically incorporated in the numerical
simulations of the classical equations of motion in the linear $\sigma$-model
when longitudinal and transverse expansions are included. We find that domains
of disoriented chiral condensate with 4--5 fm in size can form through a quench
while an annealing leads to domains of smaller sizes. We also demonstrate that
quenching cannot be achieved by relaxing a chirally symmetric system through
expansion.
","[{""version"":""v1"",""created"":""Tue, 16 Aug 1994 05:40:32 GMT""}]","2009-10-28"
"hep-ph/9408301",,"A.A.Andrianov, R. Rodenberg and N.V.Romanenko","Fine Tuning in One-Higgs and Two-Higgs Standard Models","13 pages, LaTeX, Preprint PITHA-94-23 (July 1993)","NuovoCim.A108:577-588,1995","10.1007/BF02816853",,"hep-ph",,"  The fine-tuning principles are examined to predict the top-quark and
Higgs-boson masses. The modification of the Veltman condition based on the
compensation of vacuum energies is developed. It is implemented in the Standard
Model and in its minimal extension with two Higgs doublets. The top-quark and
Higgs-boson couplings are fitted in the SM for the lowest ultraviolet scale
where the fine-tuning can be stable under rescaling. It yields the low-energy
values $m_t \simeq 175 GeV; m_H \simeq 210 GeV$.
","[{""version"":""v1"",""created"":""Tue, 16 Aug 1994 08:58:07 GMT""}]","2008-11-26"
"hep-ph/9408302","Ewan Davidson Stewart","Ewan D. Stewart","A General Supergravity Formalism for a Naturally Flat Inflaton Potential","6 pages, talk given at the MG7 Meeting, 24-29 July 1994, KUNS 1286",,,,"hep-ph astro-ph gr-qc hep-th",,"  A globally supersymmetric model of inflation will not work in a generic
supergravity theory because the higher order, nonrenormalisable supergravity
corrections destroy the flatness of the inflaton's potential. In this talk I
derive a form for the Kahler potential which eliminates these corrections if $
W = \partial W / \partial \varphi = \psi = 0 $ during inflation (where $W$ is
the superpotential, the inflaton is contained in $\varphi$, and $ \partial W /
\partial \psi \neq 0 $). I then point out that Kahler potentials of the
required form often occur in superstrings and that the target space duality
symmetries of superstrings often contain R-parities which would make $ W =
\partial W / \partial \varphi = 0 $ automatic for $\psi = 0$.
","[{""version"":""v1"",""created"":""Tue, 16 Aug 1994 11:37:43 GMT""}]","2007-05-23"
"hep-ph/9408303",,"Tao Huang and Chuan-Wang Luo","Light Quark Dependence of the Isgur-Wise Function from QCD Sum rules","13 Pages latex, 9 figures available upon request","Phys.Rev.D50:5775-5780,1994","10.1103/PhysRevD.50.5775","BIHEP-TH-94-10","hep-ph",,"  We study light quark dependence of the Isgur-Wise function for
$B_a\rightarrow D_a$ and $B_a\rightarrow D^{*}_a$ in the framework of QCD sum
rules. At zero recoil , all the Isgur-Wise functions equal as required by heavy
quark symmetry and at non-zero recoil, the Isgur-Wise function for $B_s$ decay
falls faster than that for $B_{u,d}$ decay , which is just contrary to the
recent prediction of the heavy meson chiral perturbation theory. As
by-products, we also estimate SU(3) breaking effects in the mass and the decay
constant.
","[{""version"":""v1"",""created"":""Tue, 16 Aug 1994 13:59:21 GMT""},{""version"":""v2"",""created"":""Wed, 17 Aug 1994 02:50:08 GMT""}]","2011-07-19"
"hep-ph/9408304","Marcello Lissia","V. Berezinsky, G. Fiorentini and M. Lissia","The MSW solution to the solar neutrino problem for non-standard solar
  models","13 pages in RevTeX 3.0 plus 3 figures in uuencoded postscript files.
  Full postscript version available via anonymous ftp from
  risc0.ca.infn.it:/pub/private/lissia/lngs-94-104.ps (192.84.132.4) Submitted
  to Physics Letters B","Phys.Lett.B341:38-45,1994","10.1016/0370-2693(94)01204-0","LGNS-94-104, INFNFE-9-94 and INFNCA-TH-94-15","hep-ph astro-ph",,"  The difficulties for non-standard solar models (NSSM) in resolving the solar
neutrino problem are discussed stressing the incompatibility of the
gallium--Kamiokande data, and of the gallium--chlorine data. We conclude that
NSSM's cannot explain simultaneously the results of any two of the solar
neutrino data (chlorine, Kamiokande and gallium). We address further the
question whether the MSW solution exists for NSSM's (e.g. models with $^8$B
neutrino flux much lower than the standard one and/or central temperature $T_c$
very different from $T_c^{\text{SSM}}$). We demonstrate that the MSW solution
exists and is very stable relative to changes of $S_{17}$ ($S$-factor for $p$ +
$^7$Be reaction) and $T_c$. In particular, $\Delta m^2$ is almost constant
while $\sin^2 2\theta$ depends on the exact values of $S_{17}$ (or
$^8$B-neutrino flux) and $T_c$.
","[{""version"":""v1"",""created"":""Tue, 16 Aug 1994 13:08:14 GMT""},{""version"":""v2"",""created"":""Wed, 17 Aug 1994 11:42:20 GMT""}]","2009-09-25"
