"astro-ph/9408084","Joachim Wambsganss","Joachim Wambsganss and Bohdan Paczynski","Parameter degeneracy in models of the quadruple lens system Q2237+0305","15 pages uuencoded compressed postscript text plus 4 postscript
  figures; MPI Astrophysik report MPA-821; to appear in Astronomical Journal",,"10.1086/117144",,"astro-ph",,"  The geometry of the quadruple lens system Q2237+0305 is modeled with a simple
astigmatic lens: a power-law mass distribution: m \propto r^\beta with an
external shear \gamma. The image positions can be reproduced with an accuracy
better than 0.01 arcsec for any 0.0 < \beta < 1.85 and the corresponding value
of \gamma = 0.1385 - 0.0689 \beta. This is a factor of about 4 more precise
than what can be achieved by the best constant M/L lens models. The image
intensity ratios and the time delay ratios are almost constant along our one
parameter family of models, but the total magnification varies from 8 to >
1000, and the maximum time delay (between leading image B and trailing image C)
for H_0 of 75 km/sec/Mpc varies from more than 20 hours to about 1.5 hours,
while \beta increases from 0.0 to 1.85.
","[{""version"":""v1"",""created"":""Fri, 26 Aug 1994 11:55:05 GMT""}]","2009-10-22"
"astro-ph/9408085",,"C. Lissandrini, S. Cristiani, F. La Franca","Sky Subtraction with Fiber-Spectrographs","19 pages Plain Tex Tables and Figures available on request To appear
  in the Pub. A. S. P. KEYPD-1-94-AUG-26","Publ.Astron.Soc.Pac. 106 (1994) 1157","10.1086/133493",,"astro-ph",,"  The sky subtraction performances of multi-fiber spectrographs are discussed,
analysing in detail the case of the OPTOPUS system at the 3.6 meter ESO
telescope at La Silla. A standard technique, based on flat-fields obtained with
a uniformly illuminated screen on the dome, provides poor results. A new method
has been developed, using the [OI] emission line at 5577 \AA\ as a calibrator
of the fiber transmittance, taking into account the diffuse light and the
influence of each fiber on the adjacent ones, and correcting for the effects of
the image distortions on the sky sampling. In this way the accuracy of the sky
subtraction improves from $2-8 \%$ to $1.3-1.6 \%$.
","[{""version"":""v1"",""created"":""Fri, 26 Aug 1994 14:52:00 GMT""}]","2009-10-22"
"chao-dyn/9408004","Jim Swift","Kurt Wiesenfeld (Georgia Tech), and James W. Swift (Northern Arizona
  University)","Averaged equations for Josephson junction series arrays with LRC load","11 pages, LaTeX, with 2 figures in a separate uuencoded,
  tar-compressed file",,"10.1103/PhysRevE.51.1020",,"chao-dyn nlin.CD",,"  We derive the averaged equations describing a series array of Josephson
junctions shunted by a parallel inductor-resistor-capacitor load. We assume
that the junctions have negligable capacitance ($\beta = 0$), and derive
averaged equations which turn out to be completely tractable: in particular the
stability of both in-phase and splay states depends on a single parameter,
$\del$. We find an explicit expression for $\delta$ in terms of the load
parameters and the bias current. We recover (and refine) a common claim found
in the technical literature, that the in-phase state is stable for inductive
loads and unstable for capacitive loads.
","[{""version"":""v1"",""created"":""Fri, 26 Aug 1994 08:59:36 GMT""}]","2009-10-22"
"cond-mat/9408084",,"F. Y. Wu, P. Pant (Department of Physics, Northeastern University) and
  C.King (Department of Mathematics, Northeastern University)","The Chiral Potts Model and Its Associated Link Invariant","32 pages + 9 figures","J. Statistical Physics 78, 1253-1276 (1995).","10.1007/BF02180131",,"cond-mat",,"  A new link invariant is derived using the exactly solvable chiral Potts model
and a generalized Gaussian summation identity. Starting from a general
formulation of link invariants using edge-interaction spin models, we establish
the uniqueness of the invariant for self-dual models. We next apply the
formulation to the self-dual chiral Potts model, and obtain a link invariant in
the form of a lattice sum defined by a matrix associated with the link diagram.
A generalized Gaussian summation identity is then used to carry out this
lattice sum, enabling us to cast the invariant into a tractable form. The
resulting expression for the link invariant is characterized by roots of unity
and does not appear to belong to the usual quantum group family of invariants.
A table of invariants for links with up to 8 crossings is given.
","[{""version"":""v1"",""created"":""Thu, 25 Aug 1994 19:32:53 GMT""}]","2009-10-22"
"cond-mat/9408085",,"M. Buttiker (IBM T. J. Watson Res. Ctr., Yorktown Heights, N.Y.)","Time-Dependent Current Partition in Mesoscopic Conductors","22 pages, 3 figures upon request, IBM RC 19717",,"10.1007/BF02741461",,"cond-mat",,"  The currents at the terminals of a mesoscopic conductor are evaluated in the
presence of slowly oscillating potentials applied to the contacts of the
sample. The need to find a charge and current conserving solution to this
dynamic current partition problem is emphasized. We present results for the
electro-chemical admittance describing the long range Coulomb interaction in a
Hartree approach. For multiply connected samples we discuss the symmetry of the
admittance under reversal of an Aharonov-Bohm flux.
","[{""version"":""v1"",""created"":""Thu, 25 Aug 1994 21:26:52 GMT""}]","2009-10-22"
"dg-ga/9408005","Dr. Gilbert Weinstein","Gilbert Weinstein","On the Dirichlet problem for harmonic maps with prescribed singularities","28 pages","Duke Math. J. Volume 77, Number 1 (1995), 135-165",,,"dg-ga math.DG",,"  Let $\M$ be a classical Riemannian globally symmetric space of rank one and
non-compact type. We prove the existence and uniqueness of solutions to the
Dirichlet problem for harmonic maps into $\M$ with prescribed singularities
along a closed submanifold of the domain. This generalizes our previous work
where such maps into the hyperbolic plane were constructed. This problem, in
the case where $\M$ is the complex-hyperbolic plane, has applications to
equilibrium configurations of co-axially rotating charged black holes in
General Relativity.
","[{""version"":""v1"",""created"":""Fri, 26 Aug 1994 07:44:17 GMT""}]","2010-06-24"
"gr-qc/9408031",,"E. I. Guendelman and A. B. Kaganovich","Kaluza -- Klein Quantum Cosmology with Primordial Negative Cosmological
  Constant","5 pages, Latex, BGU-94/17/August-PH","Grav.Cosmol. 1 (1995) 103-105",,,"gr-qc",,"  In many interesting models, including superstring theories, a negative vacuum
energy is predicted. Although this effect is usually regarded as undesirable
from a cosmological point of view, we show that this can be the basis for a new
approach to the cosmology of the early Universe. In the framework of quantum
cosmology (in higher dimensions) when we consider a negative cosmological
constant and matter that could be dust or, alternatively, coherent excitations
of a scalar field, the role of cosmic time can be understood. Then we can
predict the existence of a ``quantum inflationary phase'' for some dimensions
and a simultaneous ``quantum deflationary phase'' for the remaining dimensions.
We discuss how it may be possible to exit from this inflation-compactification
era to a phase with zero cosmological constant which allows a classical
description at late times.
","[{""version"":""v1"",""created"":""Thu, 25 Aug 1994 19:52:00 GMT""}]","2007-05-23"
"gr-qc/9408032","Robert Mann","J.S.F. Chan and R.B. Mann","Gravitation and Cosmology in Generalized (1+1)-dimensional dilaton
  gravity","34 pages","Class.Quant.Grav.12:351-372,1995","10.1088/0264-9381/12/2/006",,"gr-qc",,"  The actions of the ``$R=T$'' and string-inspired theories of gravity in (1+1)
dimensions are generalized into one single action which is characterized by two
functions. We discuss differing interpretations of the matter stress-energy
tensor, and show how two such different interpretations can yield two different
sets of field equations from this action. The weak-field approximation,
post-Newtonian expansion, hydrostatic equilibrium state of star and
two-dimensional cosmology are studied separately by using the two sets of field
equations. Some properties in the ``$R=T$'' and string-inspired theories are
shown to be generic in the theory induced by the generalized action.
","[{""version"":""v1"",""created"":""Thu, 25 Aug 1994 20:04:37 GMT""}]","2010-04-06"
"gr-qc/9408033","Jorma Louko","Jorma Louko","Chern-Simons functional and the no-boundary proposal in Bianchi IX
  quantum cosmology","9 pages, REVTeX v3.0. (One reference added.)","Phys.Rev.D51:586-590,1995","10.1103/PhysRevD.51.586","WISC-MILW-94-TH-20","gr-qc hep-th",,"  The Chern-Simons functional $S_{\rm CS}$ is an exact solution to the
Ashtekar-Hamilton-Jacobi equation of general relativity with a nonzero
cosmological constant. In this paper we consider $S_{\rm CS}$ in Bianchi type
IX cosmology with $S^3$ spatial surfaces. We show that among the classical
solutions generated by~$S_{\rm CS}$, there is a two-parameter family of
Euclidean spacetimes that have a regular NUT-type closing. When two of the
three scale factors are equal, these spacetimes reduce to a one-parameter
family within the Euclidean Taub-NUT-de~Sitter metrics. For a nonzero
cosmological constant, $\exp(iS_{\rm CS})$ therefore provides a semiclassical
estimate to the Bianchi~IX no-boundary wave function in Ashtekar's variables.
","[{""version"":""v1"",""created"":""Fri, 26 Aug 1994 03:22:18 GMT""},{""version"":""v2"",""created"":""Wed, 15 Feb 1995 01:27:42 GMT""}]","2010-11-01"
"gr-qc/9408034","Dalia Goldwirth","D. S. Goldwirth and J. Katz","A Comment on Junction and Energy Conditions in Thin Shells","(Tex file + PS file with a figure) Tex errors were corrected","Class.Quant.Grav.12:769-778,1995","10.1088/0264-9381/12/3/014",,"gr-qc",,"  This comment contains a suggestion for a slight modification of Israel's
covariant formulation of junction conditions between two spacetimes, placing
both sides on equal footing with normals having uniquely defined orientations.
The signs of mass energy densities in thin shells at the junction depend not
only on the orientations of the normals and it is useful therefore to discuss
the sign separately. Calculations gain in clarity by not choosing the
orientations in advance. Simple examples illustrate our point and complete
previous classifications of spherical thin shells in spherically symmetric
spacetimes relevant to cosmology.
","[{""version"":""v1"",""created"":""Fri, 26 Aug 1994 10:37:18 GMT""},{""version"":""v2"",""created"":""Tue, 30 Aug 1994 13:58:32 GMT""},{""version"":""v3"",""created"":""Fri, 2 Sep 1994 11:51:29 GMT""}]","2010-04-06"
"hep-ph/9408367","Cliff Burgess","P. Bamert, C.P. Burgess and R.N. Mohapatra","Heavy Sterile Neutrinos and Neutrinoless Double Beta Decay","(We have revised somewhat our discussion of nucleosynthesis and
  laboratory bounds, and have modified figure 3 accordingly. Our conclusions
  remain unchanged.) plain TeX, 17 pages plus 4 figures attached, McGill-94/37,
  NEIP-94-007, UMD-PP-95-11","Nucl.Phys. B438 (1995) 3-16","10.1016/0550-3213(94)00575-Y",,"hep-ph",,"  We investigate the possibility of producing neutrinoless double beta decay
without having an electron neutrino with a mass in the vicinity of 1 eV. We do
so by having a much lighter electron neutrino mix with a much heavier (m > 1
GeV) sterile neutrino. We study the constraints on the masses and mixings of
such heavy sterile neutrinos from existing laboratory, astrophysical and
cosmological information, and discuss the properties it would require in order
to produce a detectable signal in current searches for neutrinoless double beta
decay.
","[{""version"":""v1"",""created"":""Thu, 25 Aug 1994 16:27:53 GMT""},{""version"":""v2"",""created"":""Wed, 12 Oct 1994 19:05:24 GMT""}]","2009-10-28"
"hep-ph/9408368","Andres Schaale","A.A.Bel'kov, A.V.Lanyov, A.Schaale, S.Scherer","An Effective Chiral Meson Lagrangian at $O(P^6)$ from the NJL Model","20 pages","Acta Phys.Slov. 45 (1995) 121",,,"hep-ph",,"  In this work we present a strong chiral meson Lagrangian up to and including
$O(p^6)$ in the momentum expansion. It is derived from the Nambu--Jona-Lasinio
(NJL) model using the heat-kernel method. Identities related to the properties
of covariant derivatives of the chiral matrix $U$ as well as field
transformations have been used to obtain a minimal set of linearly independent
terms.
","[{""version"":""v1"",""created"":""Thu, 25 Aug 1994 18:57:39 GMT""}]","2007-05-23"
"hep-ph/9408369","Karsten Jedamzik","K. Jedamzik and G.M. Fuller","Baryon Number Transport in a Cosmic QCD-Phase Transition","25 pages, 4 figures (available upon request by mail or fax), plain
  tex, UCRL-JC-000000",,,,"hep-ph",,"  We investigate the transport of baryon number across phase boundaries in a
putative first order QCD-phase transition. Two independent phenomenological
models are employed to estimate the baryon penetrability at the phase boundary:
chromoelectric flux tube models; and an analogy to baryon-baryon coalescence in
nuclear physics. Our analysis indicates that baryon transport across phase
boundaries may be order of magnitude more efficient than other work has
suggested. We discuss the substantial uncertainties involved in estimating
baryon penetrability at phase boundaries.
","[{""version"":""v1"",""created"":""Thu, 25 Aug 1994 18:02:15 GMT""}]","2009-09-25"
"hep-ph/9408370",,"Eugene Golowich and Sandip Pakvasa","Uncertainties from Long Range Effects in $B \to K^* \gamma","Standard Latex file, 20 pgs (figures not included), UMHEP-411,
  UH-511-800-94","Phys.Rev. D51 (1995) 1215-1223","10.1103/PhysRevD.51.1215",,"hep-ph",,"  We reconsider the `long-range' component of the radiative transition $B \to
K^* \gamma$. A careful analysis of the vector dominance amplitude $B \to V_1
V_2 \to V_1 \gamma$ is carried out, with emphasis on the role of gauge
invariance. The procedure for incorporating phenomenological $B\to V_1 V_2$
data is identified and polarization data, only recently available, is employed
to estimate the magnitude of the vector dominance effect. We summarize
uncertainties in the $B\to K^*\gamma$ radiative transition produced by
long-range effects and provide sugggestions for further experimental work.
","[{""version"":""v1"",""created"":""Thu, 25 Aug 1994 18:58:28 GMT""}]","2009-10-28"
"hep-ph/9408371",,"W.-K. Tang, S. J. Brodsky, M. V\""anttinen and P. Hoyer","Polarization as a Probe to the Production Mechanisms of Charmonium in
  $\pi N$ Collisions","8 pages",,,,"hep-ph",,"  Measurements of the polarization of $\jp$ produced in pion-nucleus collisions
are in disagreement with leading twist QCD prediction where $\jp$ is observed
to have negligible polarization whereas theory predicts substantial
polarization. We argue that this discrepancy cannot be due to poorly known
structure functions nor the relative production rates of $\jp$ and $\chi_J$.
The disagreement between theory and experiment suggests important higher twist
corrections, as has earlier been surmised from the anomalous non-factorized
nuclear $A$-dependence of the $\jp$ cross section.
","[{""version"":""v1"",""created"":""Thu, 25 Aug 1994 21:07:00 GMT""}]","2009-09-25"
"hep-ph/9408372",,"W.-K. Tang","Anomalous Charm Production at Large $x_{F}$","16 pages",,,,"hep-ph",,"  We show that the new QCD production mechanisms which were proposed by S. J.
Brodsky, P. Hoyer, A. H. Mueller and the author can explain at least some of
the anomalous behavior of open and/or closed charm production at large $x_{F}$.
","[{""version"":""v1"",""created"":""Thu, 25 Aug 1994 21:20:00 GMT""}]","2009-09-25"
"hep-ph/9408373",,"D. Atwood, B. Blok and A. Soni","Feasibility of Extracting V_td from Radiative B(B_s) Decays","19 pages. [Figures can be obtained by sending e-mail message to
  soni@bnlcl1.bnl.gov]","Int.J.Mod.Phys.A11:3743-3760,1996; Nuovo Cim.A109:873-883,1996","10.1142/S0217751X96001759","SLAC-PUB-6635","hep-ph",,"  We use existing measurements of $D^-\to K^{\ast0}\rho^-$ and $B\to
\psi+K^\ast$, coupled with flavor independence of QCD, and with vector meson
dominance to show that long distance contributions to $B\to \rho +\gamma$ are
potentially very serious. We note that long distance (LD) contributions can be
appreciably different in $B^-\to \rho^-+\gamma$ and $B^0\to \rho^0 (\omega)
+\gamma$. All radiative decays of $B$, $B_S$ are shown to be governed
essentially by two LD and two short-distance (SD) hadronic entities. Separate
measurements of $B^-\to \rho^-+\gamma$, $B^0\to \rho^0 (\omega) +\gamma$, along
with $B\to K^\ast +\gamma$ appear necessary for a meaningful extraction of
\vtd. Measurements of $B_S\to \phi+\gamma$ and $K^{\ast0}+\gamma$ could also
provide very useful consistency checks.
","[{""version"":""v1"",""created"":""Thu, 25 Aug 1994 21:23:08 GMT""}]","2010-11-11"
"hep-ph/9408374","Craig Roberts","Craig D. Roberts","Pion Observables and QCD","Summary of a presentation at the workshop ``Chiral Dynamics: Theory
  and Experiment'', Cambridge MA 25-29 July, 1994. 10 Pages. 4 Figures,
  incorporated via extras/epsfig and available as PostScript with this file.
  Standard LaTeX plus ``citews.sty'', which is appended to the file. ANL
  Preprint: PHY-7854-TH-94",,"10.1007/3-540-59279-2_66",,"hep-ph nucl-th",,"  The nonperturbative, Dyson-Schwinger equation approach to solving QCD
provides a straightforward, microscopic description of dynamical chiral
symmetry breaking and confinement. It is an ideal tool for the study of pion
observables. This is illustrated via its application to the calculation of: the
$\pi$-$\pi$ scattering lengths $a_0^0$, $a_0^2$, $a_1^1$, $a_2^0$, $a_2^2$ and
associated partial wave amplitudes; the $\pi^0\rightarrow \gamma\gamma$ decay
width; and the charged pion form factor, $F_\pi(q^2)$.
","[{""version"":""v1"",""created"":""Thu, 25 Aug 1994 23:17:48 GMT""}]","2009-10-28"
"hep-ph/9408375","James Liu","J. T. Liu and D. Ng","The effect of new physics on R_b = \Gamma(Z->b bbar) /
  \Gamma(Z->hadrons)","16 pages (RevTeX file, includes 1 FEYNMAN and 2 postscript figures),
  CTP-TAMU-41/94 TRI-PP-94-71","Phys.Lett. B342 (1995) 262-269","10.1016/0370-2693(94)01364-I",,"hep-ph",,"  Motivated by the $\sim 2\sigma$ discrepancy between the experimental value
for $R_b$ and the theoretical prediction of the Standard Model, we examine the
effect of new physics on the $Z$-$b$-$\overline{b}$ vertex. Using general
results for both new scalars and gauge bosons, we show that two conditions must
be satisfied in order for new physics to give observable deviations in the
vertex. In particular, the fermion in the loop must transform chirally under
$SU(2)\times U(1)$ and it must be massive compared to the exchanged boson. We
examine the implications of these results on the 2 Higgs Doublet model and the
Left-Right Symmetric model.
","[{""version"":""v1"",""created"":""Fri, 26 Aug 1994 02:46:54 GMT""}]","2009-10-28"
"hep-ph/9408376",,"S. Narison","A fresh look into the heavy quark-mass values","15 pages in latex file + 3 figures in 3 ps-files appended at the end
  of the paper, CERN-TH.7405/94 (replace 9408376 : compressed abstract)","Phys.Lett.B341:73-83,1994","10.1016/0370-2693(94)01273-3",,"hep-ph hep-lat",,"  Using the recent {\it world average} $\alpha_s(M^2_Z)= 0.118 \pm 0.006$, we
give the {\it first direct extraction} from the $\Psi$ and $\Upsilon$ data of
the values of the {\it running heavy quark masses} within QCD spectral sum
rules to two-loops in the $\overline {MS}$-scheme: $\mr_b(M^{PT2}_b)$ =
$(4.23~^{+0.03}_{-0.04} \pm 0.02)$ GeV and $\mr_c(M^{PT2}_c)$ = $(1.23~^{+
0.02}_{-0.04} \pm 0.03)$ GeV, (the errors are respectively due to $\alf$ and to
the gluon condensate), and the corresponding value of the {\it short-distance
perturbative pole masses to two-loops}: $M^{PT2}_b=(4.62 \pm 0.02)$ GeV,
$M^{PT2}_c= (1.41\pm 0.03)$ GeV, which we compare with the updated values of
the {\it non-relativistic pole masses} re-extracted {\it directly} from the
two-loop non-relativistic sum rules: $M^{NR}_b= (4.69~^{-0.01}_{+0.02} \pm
0.02)$ GeV and $M^{NR}_c=(1.44\pm 0.02\pm 0.03)$ GeV. It is also informative to
compare the {\it three-loop} values of the short-distance pole masses:
$M^{PT3}_b=(4.87\pm 0.05 \pm 0.02)$ GeV and $M^{PT3}_c= (1.62\pm 0.07 \pm
0.03)$ GeV, with the {\it dressed mass} $M^{nr}_b = (4.94 \pm 0.10 \pm 0.03)$
GeV, entering into the {\it non-relativistic Balmer formula} including higher
order $\alf$ corrections. The $small$ mass-differences $M^{NR}_b-M^{PT2}_b
\simeq M^{nr}_b-M^{PT3}_b \simeq 70$ MeV and $M_c^{NR}-M_c^{PT2} \simeq (30 \pm
20)$ MeV {\it can measure the size} of the non-perturbative effect induced by
{\it renormalon} type-singularities. An analogous analysis is pursued for the
heavy-light mesons, where a simultaneous {\it re-fit} of the $B$ and $B^*$
masses from relativistic sum rules leads to: $M_b^{PT2}= (4.63 \pm 0.08)$ GeV,
","[{""version"":""v1"",""created"":""Fri, 26 Aug 1994 10:26:52 GMT""}]","2011-01-27"
"hep-ph/9408377","Johannes Bluemlein","Johannes Bl\""umlein","Small $x$ Contributions to the Structure Function $F_L(x,Q^2)$","4 p., postscript encoded with uufiles; DESY 94--149","Nucl.Phys.Proc.Suppl. 39BC (1995) 22-24","10.1016/0920-5632(95)00035-8",,"hep-ph",,"  The gluon contributions to $F_L(x,Q^2)$ in ${\cal O}(\alpha_s)$ are
calculated taking into account the transverse momentum of the initial state
parton. In comparison with collinear factorization $F_L(x,Q^2)$, is not
affected at large $x$ but takes smaller values in the small $x$ range. The
onset of the $k_{\perp}$ effect is a function of $Q^2$.
","[{""version"":""v1"",""created"":""Fri, 26 Aug 1994 08:45:27 GMT""}]","2009-10-28"
"hep-ph/9408378",,"B. Kerbikov and D. Kharzeev","Nucleon-Antinucleon Annihilation at the Open Charm Threshold","8 pages, 1 figure available upon request, LaTeX, CERN-TH.7350/94","Phys.Rev. D51 (1995) 6103-6106","10.1103/PhysRevD.51.6103",,"hep-ph",,"  We discuss the $p\bar{p}$ annihilation into a pair of charmed $D$ mesons not
far from the threshold of the reaction. An interesting interference pattern in
the differential cross section is predicted to arise from the existence of both
$t$-channel charmed-baryon exchange and $s$-channel $\Psi^{''}$ charmonium
resonance amplitudes. We argue that the experimental study of this process
would provide new and valuable information about the unknown
$p\bar{p}\Psi^{''}$ and $\Lambda_c N D$ couplings. These are important to know
to solve the long-standing puzzle of the heavy flavour contents of baryons and
to test the semi-local duality.
","[{""version"":""v1"",""created"":""Fri, 26 Aug 1994 14:26:43 GMT""}]","2009-10-28"
"hep-th/9408138","Hu Zhan-ning","Zhan-Ning Hu","Baxter-Bazhanov Model, Frenkel-Moore Equation and the Braid Group","14 pages, latex, 5 pasted figures (Page 13, 14)",,,"AS-ITP-94-38","hep-th",,"  In this paper the three-dimensional vertex model is given, which is the
duality of the three-dimensional Baxter-Bazhanov (BB) model. The braid group
corresponding to Frenkel-Moore equation is constructed and the transformations
$R, I$ are found. These maps act on the group and denote the rotations of the
braids through the angles $\pi$ about some special axes. The weight function of
another three-dimensional vertex model related the 3D lattice integrable model
proposed by Boos, Mangazeev, Sergeev and Stroganov is presented also, which can
be interpreted as the deformation of the vertex model corresponding to the BB
model.
","[{""version"":""v1"",""created"":""Thu, 25 Aug 1994 22:56:43 GMT""},{""version"":""v2"",""created"":""Thu, 13 Apr 1995 10:58:53 GMT""}]","2009-09-25"
"hep-th/9408139","Hu Zhan-ning","Zhan-Ning Hu, Bo-Yu Hou","Remarks on the Star-Triangle Relation in the Baxter-Bazhanov Model","6 pages, latex file, AS-ITP-94-39",,"10.1007/BF02184882",,"hep-th",,"  In this letter we show that the restricted star-triangle relation introduced
by Bazhanov and Baxter can be obtained either from the star-triangle relation
of chiral Potts model or from the star-square relation which is proposed by
Kashaev $et ~al$ and give a response of the guess which is suggested by
Bazhanov and Baxter in Ref. \cite{b2}.
","[{""version"":""v1"",""created"":""Thu, 25 Aug 1994 23:08:28 GMT""}]","2009-10-28"
"hep-th/9408140","Soeren Koester","S{\o}ren K\""oster","Two dimensional QCD is a string theory","Review on references [1] and [4], 94pp., DTP 94-33",,,,"hep-th",,"  This text, written as dissertation within the M.Sc. course in particle theory
at the Centre for Particle Theory, University of Durham, during the academic
year 1993/94, reviews two articles by D.Gross and by D.Gross and W.Taylor which
interpret the 1/N- expansion of the partition function of $QCD_2$ as string
perturbation series. For this required mathematical and physical background is
presented.
","[{""version"":""v1"",""created"":""Thu, 25 Aug 1994 18:01:50 GMT""}]","2016-08-15"
"hep-th/9408141","Michael Murray","A.L. Carey and M.K. Murray","Mathematical remarks on the cohomology of gauge groups and anomalies","13 pp. (Revised version corrected some lines longer than 80 columns -
  content is unchanged.)",,,,"hep-th",,"  Anomalies can be viewed as arising from the cohomology of the Lie algebra of
the group of gauge transformations and also from the topological cohomology of
the group of connections modulo gauge transformations. We show how these two
approaches are unified by the transgression map. We discuss the geometry behind
the current commutator anomaly and the Faddeev- Mickelsson anomaly using the
recent notion of a gerbe. Some anomalies (notably 3-cocycles) do not have such
a geometric origin. We discuss one example and a conjecture on how these may be
related to geometric anomalies.
","[{""version"":""v1"",""created"":""Fri, 26 Aug 1994 07:39:41 GMT""}]","2007-05-23"
