"hep-th/9408142",,"A. Petermann, A. Zichichi","Explicit supertring vacua in a background of gravitational waves and
  dilaton","10 pages, latex, CERN-TH.7373/94","Nuovo Cim.A108:97-104,1995","10.1007/BF02814860",,"hep-th",,"  We present an explicit solution of superstring effective equations,
represented by gravitational waves and dilaton backgrounds. Particular
solutions will be examined in a forthcoming note.
","[{""version"":""v1"",""created"":""Fri, 26 Aug 1994 08:40:32 GMT""}]","2009-08-25"
"hep-th/9408143","Michitomo Nishizawa","Kimio Ueno and Michitomo Nishizawa","Quantum groups and zeta-functions","12 pages",,,,"hep-th math.QA",,"  A $q$-analogue of the Hurwitz zeta-function is introduced through
considerations on the spectral zeta-function of quantum group $SU_{q}(2)$, and
its analytic aspects are studied via the Euler-MacLaurin summation formula.
Asymptotic formulas of some relevant $q$-functions are discussed.
","[{""version"":""v1"",""created"":""Fri, 26 Aug 1994 08:29:57 GMT""}]","2008-02-03"
"hep-th/9408144","Kazuo Gouroku","Kazuo Ghoroku","Conformally Exact Black Hole Perturbed by a Marginal Operator","11 pages Latex, FIT-HE-94-81","Phys.Lett. B347 (1995) 21-27","10.1016/0370-2693(95)00057-R",,"hep-th",,"  We have examined effective theory induced by gauged WZW models, in which the
tachyon field is added as a marginal operator. Due to this operator added, we
must further add the higher order corrections, which modifies the original
configuration, to make the theory full-conformally invariant. It has been found
that 2d is a critical dimension in the sense that the metric obtained from
gauged WZW is modified by the tachyon condensation for $d>2$, but not for $d\le
2$.
","[{""version"":""v1"",""created"":""Fri, 26 Aug 1994 05:20:46 GMT""}]","2009-10-28"
"hep-th/9408145","Alexander Laufer","A. O. Barut, J. R. Zeni, A. J. Laufer","The exponential map for the unitary group SU(2,2)","10 pages","J.Phys. A27 (1994) 6799-6806","10.1088/0305-4470/27/20/017",,"hep-th math.QA",,"  In this article we extend our previous results for the orthogonal group,
$SO(2,4)$, to its homomorphic group $SU(2,2)$. Here we present a closed, finite
formula for the exponential of a $4\times 4$ traceless matrix, which can be
viewed as the generator (Lie algebra elements) of the $SL(4,C)$ group. We apply
this result to the $SU(2,2)$ group, which Lie algebra can be represented by the
Dirac matrices, and discuss how the exponential map for $SU(2,2)$ can be
written by means of the Dirac matrices.
","[{""version"":""v1"",""created"":""Fri, 26 Aug 1994 10:06:00 GMT""},{""version"":""v2"",""created"":""Tue, 30 Aug 1994 12:43:58 GMT""}]","2009-10-28"
"hep-th/9408146","Valeri Dvoeglazov","Valeri Dvoeglazov (Universidad Autonoma de Zacatecas)","What Particles Are Described by the Weinberg Theory?","HPATEX.STY used, 11pp","Helv.Phys.Acta 70:686-696,1997",,"EFUAZ FT-94-06-REV","hep-th",,"  The main goal of the paper is to study the origins of a contradiction between
the Weinberg theorem B-A=\lambda and the `longitudinality' of an antisymmetric
tensor field (and of a Weinberg field which is equivalent to it), transformed
on the (1,0)\oplus (0,1) Lorentz group representation. On the basis of analysis
of dynamical invariants in the Fock space situation has been partly clarified.
","[{""version"":""v1"",""created"":""Fri, 26 Aug 1994 11:01:53 GMT""},{""version"":""v2"",""created"":""Sun, 28 Aug 1994 19:40:19 GMT""},{""version"":""v3"",""created"":""Sun, 7 Sep 1997 00:15:07 GMT""}]","2011-04-20"
"hep-th/9408156","Hideaki Aoyama","Hideaki Aoyama and Shinya Wada","Bounce in Valley: Study of the extended structures from thick-wall to
  thin-wall vacuum bubbles","9 pages + 4 figures, KUCP-0069","Phys.Lett. B349 (1995) 279-283","10.1016/0370-2693(95)00313-A",,"hep-th",,"  The valley structure associated with quantum meta-stability is examined. It
is defined by the new valley equation, which enables consistent evaluation of
the imaginary-time path-integral. We study the structure of this new valley
equation and solve these equations numerically. The valley is shown to contain
the bounce solution, as well as other bubble structures. We find that even when
the bubble solution has thick wall, the outer region of the valley is made of
large-radius, thin-wall bubble, which interior is occupied by the true-vacuum.
Smaller size bubbles, which contribute to decay at higher energies, are also
identified.
","[{""version"":""v1"",""created"":""Fri, 26 Aug 1994 08:37:16 GMT""}]","2009-10-28"
"math/9408217","Serge Troubetzkoy","Michael Boshernitzan, G. A. Galperin, Tyll Kr\""uger, Serge Troubetzkoy","Some remarks on periodic billiard orbits in rational polygons",,,,"Stony Brook IMS 1994/14","math.DS",,"  A polygon is called rational if the angle between each pair of sides is a
rational multiple of $\pi.$ The main theorem we will prove is
  Theorem 1: For rational polygons, periodic points of the billiard flow are
dense in the phase space of the billiard flow.
  This is a strengthening of Masur's theorem, who has shown that any rational
polygon has ``many'' periodic billiard trajectories; more precisely, the set of
directions of the periodic trajectories are dense in the set of velocity
directions $\S^1.$ We will also prove some refinements of Theorem 1: the ``well
distribution'' of periodic orbits in the polygon and the residuality of the
points $q \in Q$ with a dense set of periodic directions.
","[{""version"":""v1"",""created"":""Fri, 26 Aug 1994 00:00:00 GMT""}]","2016-09-06"
"nucl-th/9408026","Stacey Scoville","D.J. Dean, S.E. Koonin, K. Langanke, and P.B. Radha","Temperature dependence of the nuclear symmetry energy","7 pages, including 2 figures, Caltech preprint MAP-177","Phys.Lett. B356 (1995) 429-433","10.1016/0370-2693(95)00858-I",,"nucl-th",,"  We have studied the properties of A=54 and A=64 isobars at temperatures T
\leq 2 MeV via Monte Carlo shell model calculations with two different residual
interactions. In accord with empirical indications, we find that the symmetry
energy coefficient, b_{sym}, is independent of temperature to within 0.6 MeV
for T \leq 1 MeV. This is in contrast to a recent suggestion of a 2.5 MeV
increase of b_{sym} for this temperature, which would have significantly
altered the supernova explosion scenario.
","[{""version"":""v1"",""created"":""Thu, 25 Aug 1994 22:25:44 GMT""},{""version"":""v2"",""created"":""Fri, 26 Aug 1994 15:42:22 GMT""}]","2009-10-28"
